video_id,title,publishedAt,channelId,channelTitle,categoryId,trending_date,tags,view_count,likes,dislikes,comment_count,thumbnail_link,comments_disabled,ratings_disabled,description
"2qAWka0YHlM","WAK KELENG DIAMUK WARGA","2020-08-07T07:44:00Z","UCfx3oPv3cJm2aCJ7UnhKx8A","Arif muhammad","23","20.08.08","arif muhammad|mak beti|ma beti|mamak beti|kebakaran|wak keling|medan|komedi|commedi","1643386","87628","2403","9722","https://i.ytimg.com/vi/2qAWka0YHlM/default.jpg","False","False","Find me on sosial media :Instagram: https://www.instagram.com/arifmuhammaddd_/Facebook: subscribe channel baru juga ya : https://www.youtube.com/channel/UCgw8MA5E6okfSgEAlWN-VCQfor bussines Email: arifmuhammadd35@gmail.com"
"qwZHkThL_rg","Rizky Billar Hadir di Ultah Lesti Kejora di Indosiar? Ini Bocoran dari Ramzi","2020-08-02T04:31:34Z","UCQdLPSqktEJqUSNADs9uZAg","beepdo","24","20.08.08","rizky|billar|rizky lesti|rizky billar lesti|kabar rizky billar|kabar lesti|berita lesti kejora|berita rizky billar|beepdo update|ramzi|avi basalamah|indosiar|dangdut|lesti channel|mop channel|kh infotainment|cumi cumi|cumi cumi indigo|esge entertainment|sambel lalap|kapanlagi video|kapanlagi","845827","16623","493","1326","https://i.ytimg.com/vi/qwZHkThL_rg/default.jpg","False","False","Tanggal 5 Agustus mendatang Lesti Kejora ulang tahun. Di hari itu Indosiar akan menyelenggarakan konser khusus di ultah Lesti tersebut. Ramzi, pada Minggu (2/8) sedikit membocorkan rencana ultah Lesti di Indosiar. Apakah Rizky Billar akan hadir?#lesti #rizkybilalr #ramziVideo Rizky Billar lainnya bisa disaksikan di;https://www.youtube.com/c/beepdo/search?view_as=subscriber&query=rizky+bilarDownload Aplikasi Beepdo.comhttps://play.google.com/store/apps/details?id=com.wBeepdo_8718922Baca berita menarik lainnya dari dunia hiburan dan viral dihttps://www.beepdo.com/Follow juga akun instagram Beepdo.com dihttps://www.instagram.com/beepdocom/Like Akun Facebook resmi Beepdo.com dihttps://www.facebook.com/beepdo/"
"a39xMSzm4Z4","Polisi Terpaksa Tembak Kaki Sapi yang Mengamuk - BIP 31/07","2020-07-31T02:53:50Z","UCJihkOSfgpDz_HHhkb-OGLQ","Buletin iNews","25","20.08.08","Berita Terkini|Breaking News|TV Berita|Berita Indonesia|Info Indonesia|Special Report|Live Streaming|Hotman Paris Show|CNN Indonesia|Kompas TV|TV One|Metro TV|Mata Najwa|ILC Full|Buletin|iNews|viral|detik-detik","2534149","14971","1187","1792","https://i.ytimg.com/vi/a39xMSzm4Z4/default.jpg","False","False","Tanggal Tayang: 31/07/2020Program berita harian yang menyajikan berbagai peristiwa terkini secara cepat dan akurat dari seluruh Indonesia. Mengupas berbagai masalah yang tengah hangat di masyarakat, baik di bidang sosial, ekonomi, perkotaan, hingga dunia hukum dan politik. Semuanya dikemas secara mendalam, menyentuh tapi tetap kritis. Buletin iNews Pagi, Siang, dan Malam juga dilengkapi dengan berita-berita hiburan serta feature unik baik dari dalam dan luar negeri yang disajikan secara humanis.Subscribe iNews Official Youtube Channel:https://www.youtube.com/OfficialiNewsSubscribe Buletin iNews Youtube Channel:https://www.youtube.com/GTVNewsIndonesiaFollow Our Official Twitter: https://twitter.com/gtvid_newsCheck Our Official Website: https://www.inews.idLike Our Official Facebook: https://www.facebook.com/gtvindonesianewsFollow Our Official Instagram:https://www.instagram.com/gtvindonesia_newsSaksikan info berita terkini di:Buletin iNews Pagi: Senin – Jumat Pukul 03.45 WIBBuletin iNews Siang: Setiap Hari Pukul 10.30 WIB Buletin iNews Malam: Senin – Jumat 01.00 WIBBuletin iNews: Senin – Jumat 12.00 | 14.00 | 00.00"
"LIh-otuNcYc","Arsenal 2-1 Chelsea | FA Cup 19/20 Match Highlights","2020-08-01T20:37:03Z","UCViN2fPWI6zuZDXwn0O54xg","beIN SPORTS Indonesia","17","20.08.08","fa cup|fa cup highlights|aubameyang|lacazette|tierney|ceballos|xhaka|martinez|bellerin|arteta|pepe|azpiliqueta|athony taylor|var|frank lampard|lampard|arsenal|chelsea|emirates fa cup|giroud|barkley|david luiz|kontroversi|kartu merah|epic comeback|brace goal","1325369","13268","564","1969","https://i.ytimg.com/vi/LIh-otuNcYc/default.jpg","False","False","Arsenal 2-1 Chelsea, Sabtu, 1 Agustus 2020Dua gol dari Aubameyang bawa sempurnakan comeback Arsenal atas Chelsea dan sekaligus pastikan gelar FA Cup ke-14 mereka. Namun dibalik kemenangan The Gunners, wasit Anthony Taylor menjadi sasaran kritik pedas karena beberapa keputusan kontroversinya termasuk saat mengganjar Kovacic dengan kartu merah.Tonton keseruan liga-liga terbaik hanya di beIN Sports Connecthttps://bein.onelink.me/PGZK/beinYTSimak berita dan update menarik seputar liga terbaik dan beIN SportsIndonesia di semua sosial media:Facebook https://www.facebook.com/beinsportsindonesia/Twitter https://twitter.com/beinsportsid?lang=enInstagram https://www.instagram.com/beinsports.id/YouTube https://www.youtube.com/channel/UCViN2fPWI6zuZDXwn0O54xg"
"XmSIlTip_4U","Lesti Jatuh! Rizky Jatuh! Keduanya Jatuh ... Cintaa | Amin 2020 I Tukul One Man Show","2020-07-23T18:36:06Z","UCYqOeAXJm8yV9sJ8Ud3cR7A","Indosiar","24","20.08.08","indosiar|Lesti Jatuh|Rizky Jatuh|Keduanya Jatuh ... Cintaa|Amin 2020|Tukul One Man Show|Tukul Arwana One Man Show|Tukul Arwana|Memes Prameswari|Rizky Billar|Lesty DA","14324099","275424","9444","28252","https://i.ytimg.com/vi/XmSIlTip_4U/default.jpg","False","False","Tonton tayangan lengkap Indosiar di vidio.com atau klik https://bit.ly/30Ofj4uProgram fresh Indosiar Tukul Arwana One Man Show menyajikan hiburan terkini dari the one and only Tukul Arwana. Kelucuan dan kejahilannya hadir menemani pemirsa di rumah bersama para selebriti dan figur publik viral yang berbeda setiap harinya. Saksikan Tukul Arwana One Man Show setiap hari pukul pukul 22.45 WIB. Lesti Jatuh! Rizky Jatuh! Keduanya Jatuh ... Cintaa | Amin 2020Follow Indosiar juga di Sosial Media ya Indosiar Mania!Facebook: bit.ly/FBIndosiarTwitter: bit.ly/TWIndosiarInstagram: @Indosiar"
"X7UChCdnYdc","Young Lex & Gisel - Masih Bisa Panjang | Official Music Video","2020-07-30T03:00:11Z","UCebb7o98FEA73WjNsCja5Xg","Trinity Optima Production","10","20.08.08","young lex|young lex nyeselkan|gisel|trinity optima production|trinity optima|nyeselkan|gisel putus dengan wijin|papa gading|awkarin|young lex ggs|young lex o aja ya kan|young lex awkarin|young lex dedy corbuzier|lagu terbaru 2020|lagu|lagu cover terbaik|cover acoustic|tiara andini|masih bisa panjang|masih bisa sayang|video clip|lagu baru young lex gisel|gisel young lex|masih bisa sayang young lex lirik|young lex ft gisel|lagu young lex dan gisel","2581503","91614","3763","4936","https://i.ytimg.com/vi/X7UChCdnYdc/default.jpg","False","False","Young Lex & Gisel - Masih Bisa Panjang | Official Music VideoBerbeda dengan single terakhirnya Young Lex, “CIU”, yang dibawakan lebih upbeat dan reggae, kini sang rapper kembali lagi dengan Masih Bisa Panjang yang cenderung lebih mellow. Masih Bisa Panjang sendiri mengisahkan tentang perasaan sesal dari seseorang yang masih ingin kembali melanjutkan hubungannya dengan sang mantan kekasih.Untuk melengkapi lagu ini, Young Lex tidak sendiri. Penyanyi jebolan Indonesian Idol 2008, Gisella Anastasia, diajak untuk berkolaborasi. Lagu ini dibuat sudah cukup lama dan butuh berduet dengan penyanyi wanita. Lalu terbersit untuk berkolaborasi dengan Gisel.Setelah mengalami penundaan rilis dan syuting video musik yang cukup lama akibat pandemi COVID-19, akhirnya lagu Masih Bisa Panjang dirilis. Walaupun momennya belum benar-benar normal kembali, Young Lex optimistis Masih Bisa Panjang akan disukai oleh banyak orang seperti lagu-lagunya sebelumnya.Gisella sendiri juga berharap banyak orang yang ikut tersentil dengan makna lagu Masih Bisa Panjang. LirikMasih Bisa SayangKali Ini Saja SayangKasih KesempatanMasih Bisa Panjang Coba PikirkanMasih Bisa SayagKali Ini Saja SayangKasih KesempatanMasih Bisa Panjang Coba PikirkanJangan Bilang Aku Nggak Pernah CobaCoba Untuk Pertahankan SemuaCinta, Waktu, UsahaAku Berikan SemuaTapi PercumaPasti Ada Yang Salah Cara BerpikirmuIni Cuma Masalah Tentang AsumsimuHarus Selalu Kabarin Dimana PosisikuAku Nggak BisaKamu Yang Bilang Nyesel Ngajak BalikanKamu Juga Yang Bilang Aku Nggak Pantas DisayangTolong Jangan DipaksaKu Sudah Hilang RasaPutus Satu Satunya Cara Kita Tak TerlukaPasti Ada Yang Salah Cara BerfikirmuAku Selalu Ngalah Sama Sifat EgoismuAku Pernah Coba Pertahankan Sama Kamu(Coba Pikirkan) Tapi Aku Nggak BisaKasih Kesempatan Masih Bisa PanjangCoba PikirkanKasih Kesempatan Masih Bisa PanjangCoba PikirkanMasih Bisa SayangSong CreditsComposed by YOUNGLEXPublished by MASSIVE MUSIC ENTERTAINMENTProduced by ROBERT WYNAND (PAPI)Vocal Recorded @BRO’S Std, JKT Engineered by ALDY FACHROBBYVocal Produced by SIMHALA AVADANA, Edited by ANGGI ANGGOROMixed by TATSURO MILLER @RecRoom Std, MYMastered by DIMAS PRADIPTA @SumIt! Std, JKTDengarkan juga lagu Masih Bisa Panjang di Digital Streaming Platform:ALL DSP             : https://lnk.to/masihbisapanjangApple                  : https://lnk.to/masihbisapanjang/applemusicSpotify                : https://lnk.to/masihbisapanjang/spotifyJoox                    : https://lnk.to/masihbisapanjang/jooxDeezer                 : https://lnk.to/masihbisapanjang/deezerLangit Musik      : https://lnk.to/masihbisapanjang/langitmusikiTunes                 : https://lnk.to/masihbisapanjang/itunesYouTube Music : https://lnk.to/masihbisapanjang/youtubemusicResso                  : https://lnk.to/masihbisapanjang/ressoAktifkan RBT Masih Bisa Panjang dengan ketik:Telkomsel  : Ketik MABIPA sms ke 1212XL                : Ketik MABIPA sms ke 1818TRI              : Ketik MG(spasi)MABIPA sms ke 1212Indosat       : Ketik MABIPA sms ke 808Follow :Instagram : https://www.instagram.com/young_lex18/?hl=enInstagram : https://www.instagram.com/trinityoptima/Twitter       : https://twitter.com/trinityoptimap?la...TikTok :Music Page : https://vt.tiktok.com/yRVLtp/Young  Lex  : https://vt.tiktok.com/yR5BCQ/Gisel             : https://vt.tiktok.com/yRXxhB/#YoungLex #Gisel #MasihBisaPanjang©️TRINITY OPTIMA PRODUCTION / PRO-M 2020"
"pkTZY0N1_WE","Billy Marah-Marah, Amanda Manopo NANGIS | OPERA VAN JAVA (24/07/20) Part 1","2020-07-24T14:53:35Z","UC24_Z2L-8Ki183AI9zJJzNQ","TRANS7 OFFICIAL","24","20.08.08","TRANS7|TRANSMEDIA|#StayAtHome|TRANS7 LIVESTREAMING|ACARA TRANS7|TRANS7 LIVE|TRANS7 HARI INI|OPERA VAN JAVA|OPERA VAN JAVA TERBARU|OVJ TERBARU|OPERA VAN JAVA JULI 2020|PARTO|AZIS GAGAP|DENNY CAGUR|SINDEN OVJ|MPOK ALPA|MPOK NINA|FERDIANS|FERDIAN HIPNOTIS|OVJ HARI INI|RINA NOSE|FERDIAN SUGESTI MPOK ALPA DIHIPNOTIS|OVJ HIPNOTIS|ANWAR|ANWAR BAB|ANWAR DI OVJ|MPOK ALPA NANGIS|BILLY AMANDA|BILLY AMANDA MANOPO|AMANDA MANOPO|BILLY AMANDA PACARAN","8983933","158797","17748","29548","https://i.ytimg.com/vi/pkTZY0N1_WE/default.jpg","False","False","OPERA VAN JAVAJumat, 24 Juli 2020PART 1 : https://youtu.be/pkTZY0N1_WEPART 2 : https://youtu.be/RbBUnUh33PEPART 3 : https://youtu.be/mRCi3PcGUGYPART 4 : https://youtu.be/FrnZ2HXbFMwPART 5 : https://youtu.be/nZZC5sDeH38----------------------OPERA VAN JAVATAYANG SETIAP HARI SENIN - MINGGUPUKUL 20.00 WIB===========================#OVJ#OperaVanJava#BillyAmanda"
"zNrTInvVrmI","Sapi Kurban Jokowi Mengamuk | REDAKSI MALAM (27/07/20)","2020-07-28T13:15:01Z","UC96DbGaroMfqTkEjObGFl2g","REDAKSI TRANS7 OFFICIAL","25","20.08.08","NEWS TRANS7|HARD NEWS|BERITA POLITIK|BERITA KRIMINAL|BERITA INDONESIA|BERITA DAERAH|REDAKSI TRANS7","4033638","32954","2397","3417","https://i.ytimg.com/vi/zNrTInvVrmI/default.jpg","False","False",""
"H_HKE1mwzuo","(여자)아이들((G)I-DLE) - '덤디덤디 (DUMDi DUMDi)' : ONLINE MEDIA SHOWCASE Ver.","2020-08-03T11:02:55Z","UCritGVo7pLJLUS8wEu32vow","(G)I-DLE (여자)아이들 (Official YouTube Channel)","10","20.08.08","kpop|gidle|(여자)아이들|(G)I-DLE|IDLE|여자아이들|아이들|미연|민니|수진|소연|우기|슈화|MIYEON|MINNIE|SOOJIN|SOYEON|YUQI|SHUHUA|큐브|CUBE","3230896","197249","4520","8751","https://i.ytimg.com/vi/H_HKE1mwzuo/default.jpg","False","False","(여자)아이들((G)I-DLE) - '덤디덤디 (DUMDi DUMDi)' : ONLINE MEDIA SHOWCASE Ver.(G)I-DLE Official YouTube: http://www.youtube.com/gidleofficial(G)I-DLE Official Twitter: https://twitter.com/G_I_DLE(G)I-DLE Official Facebook: https://facebook.com/G.I.DLE.CUBE(G)I-DLE Official Instagram: https://instadgram.com/official_g_i_dle(G)I-DLE Official Weibo: http://weibo.com/cubegidle(G)I-DLE Official Fansite: https://www.united-cube.comⓒ All Rights Reserved CUBE Entertainment Inc.#여자아이들 #GIDLE #덤디덤디"
"CmS5rlX9cDA","Galaxy Unpacked August 2020: Official Replay | Samsung","2020-08-05T16:51:01Z","UCWwgaK7x0_FR1goeSRazfsQ","Samsung","28","20.08.08","Samsung|Samsung Electronics|Galaxy|Mobile|Unpacked|Galaxyunpacked|Samsungevent|SamsungEvent","6364100","0","0","0","https://i.ytimg.com/vi/CmS5rlX9cDA/default.jpg","True","True","Witness power like never before. The #SamsungEvent is LIVE.Learn more: http://smsng.co/GalaxyNote20To view the YouTube streams on a desktop or laptop computer you'll need:• Most recent version of Google Chrome, Firefox, MS Edge or Safari• Operating system: Windows 7+, Mac OS X 10.7+ or Ubuntu 10+"
"IYb4ZL7Eza8","REACTION DRAW MY LIFE ZENMATHO!","2020-08-03T05:05:53Z","UCmvzWSa5JuXLJIFLoH3lxRQ","Zenmatho","24","20.08.08","Draw My Life|Draw My Life Zenmatho|Draw My Life Indonesia","379833","48203","358","6109","https://i.ytimg.com/vi/IYb4ZL7Eza8/default.jpg","False","False","Draw My Life Zenmatho ► https://www.youtube.com/watch?v=cL3_FFFSswM► Like Video, jika teman-teman suka :)► Subscribe Gratis! Disini : http://bit.ly/SubscribeGratis► Follow My Instagram : http://instagram.com/zenmathoTerimakasih yang sudah membaca, Semangat selalu Jangan Lupa Bernafas!"
"bt-x9ZkkSgk","[HOT CLIPS] [RUNNINGMAN] Queens are back again! JESSI & SOMI (ENG SUB)","2020-08-03T09:00:16Z","UCBzkVegsFusO7ZMa_J8MZ7Q","sNack!","24","20.08.08","SBS|sbs|Entertainment|sNack|running man|runningman|Kim Jong Kook|Lee Kwang Soo|Ji Seok Jin|Yoo Jae Suk|Song Ji Hyo|Haha|Gary|Yang Se Chan|Jeon So Min|running man the hotclip|런닝맨|유재석|김종국|이광수|지석진|송지효|하하|개리|양세찬|전소민|running man ep|chạy đi chờ chi|hot|game|레전드|legend|제시|Jessi|전소미|Jeon So Mi|이영지|Lee Young Ji|마마무|솔라|Mamamoo|Solar","1366214","0","0","1326","https://i.ytimg.com/vi/bt-x9ZkkSgk/default.jpg","False","True","[HOT CLIPS] [RUNNINGMAN] Queens are back again! JESSI & SOMI (ENG SUB)Ep.514SUPER guests!!JESSI & SOMI Dancing!!#SBS #RUNNINGMAN #런닝맨 #LEEKWANGSOO #KIMJONGKOOK #KJK #YOOJAESUK #HAHA #YANGSECHAN #JEONSOMIN #SONGJIHYO #JISEOKJIN"
"rfx06LFoCgU","무더운 여름날 도영 그리고 런쥔 | 어사즈 1기 도영, 런쥔 | 어색하지만 괜찮아 Ep.1-1","2020-08-02T11:00:25Z","UCG-coSVp89xFSWN4pbVL53w","채널 NCT DAILY","22","20.08.08","NCT127|NCT|Ch_NCT|채널NCT|채널엔시티|엔시티|엔시티일이칠|NCTDREAM|엔시티드림|도영|런쥔|마크|해찬|DOYOUNG|MARK|RENJUN|HAECHAN|어사즈|어색하지만 괜찮아|Awsaz|It’s awkward but it’s ok|The Awkward Bros","1379308","244195","381","19164","https://i.ytimg.com/vi/rfx06LFoCgU/default.jpg","False","False","#NCT #어사즈 #어색하지만_괜찮아#ItsAwkward_ButItsOk#Awsaz #TheAwkwardBros#DOYOUNG #RENJUN#MARK #HAECHAN#NCT127 #NCTDREAM#채널NCT #채널엔시티Subscribe for more contenthttps://www.youtube.com/c/chncthttps://www.youtube.com/c/nctdailyhttps://www.youtube.com/c/nctdancehttps://www.youtube.com/c/nctmusic"
"uUeBVpdFyYk","SULE ANDRE KENA EJEKAN BOCAH NYABLAK, ENTONG KOPIT!  | SANTUY MALAM (28/7/20) P1","2020-07-29T06:24:55Z","UCIohHXwCEKxWCLvAguJ-GjA","TRANS TV Official","24","20.08.08","TRANSTV|TRANS TV|TRANSMEDIA|LIVE STREAMING TRANS TV|TRANS TV LIVE STREAMING|#StayHome|#WithMe|StayAtHome|#dirumahaja|TERBARU|ACARA TRANS TV|TRANS TV LIVE|TRENDIN|VIDEO TRENDING|TRENDING HARI INI","4304402","54634","3427","3582","https://i.ytimg.com/vi/uUeBVpdFyYk/default.jpg","False","False","SANTUY MALAM===TAYANG SETIAP HARI SENIN-JUM'AT PUKUL 19.00 WIB===PART 1: https://youtu.be/uUeBVpdFyYkPART 2: https://youtu.be/AerlddTefioPART 3: https://youtu.be/5EE2MLbtzs0PART 4: https://youtu.be/4tvTU-926SM===Kangen sama komedinya Andre, Sule, Atau Nunung? Gimana kalau mereka disatukan 'kembali' ya? Apalagi ditambah dengan bintang tamu yang nggak kalah serunya. Setelah seharian kerja, saatnya dihibur oleh program baru kami, Santuy! Capek Seharian kerja? Lelah banyak masalah? Santuy-in aja bos!===WEBSITE - http://www.transtv.co.idTWITTER - https://twitter.com/TRANSTV_CORPFACEBOOK - https://www.facebook.com/TransTVMediaINSTAGRAM -  Uhttps://www.instagram.com/TRANSTV_CORP#NontonSantuyMalamSamaSaya  #SantuyMalamSamaSaya #SantuyMalam28Juli2020"
"eYfkkftBgKw","Yelse - Berbeza Kasta ( Official Music Video )","2020-07-29T00:00:04Z","UCA1j_75REY9xurdvnr_H8ig","Teras Musik","10","20.08.08","berbeza kasta|di depan orang tuamu|kau sebut tentang harta|aku akan pergi walau terluka|berbeda kasta|beda kasta|perbedaan kasta|yelse|yelse berbeza kasta|berbeza kasta yelse|teras musik|kasta|kau malukan|berbeza kasta lirik|berbeza kasta cover|lagu tiktok|tik tok|yt:cc=on","1385295","13637","643","2128","https://i.ytimg.com/vi/eYfkkftBgKw/default.jpg","False","False","Tittle: Berbeza KastaArtist : YelseSongwriter: Rajali Asmara / Elta Record_______________________________________Lirik BERBEZA KASTAHaruskah berakhir sampai disiniCinta yang dulu kita binaKini telah layu di dalam hati**) Sudahlah, cukuplah sampai disiniPercuma saja berkasihKita sudah tak sehaluan lagiPerbezaan kasta yang jauhAku tau siapa dirikuTerlalu dalam jurang pemisahKasih sudah berakhir disini sajaReff:Didepan orangtua mu kau malukan dirikuKau bandingan aku dengan dirinyaKau hina diriku, kau sebut tentang hartaKasih kusedar ku tiada berpunyaJikala kau memang tak lagi cintaAku kan pergi walau terluka... musik ...kembali ke **)Teras Musik adalah channel resmi dari label Elta Record, khusus untuk Lagu Pop Indonesia dari artis artis Sumatera Barat [Minang]. yang kami bangun untuk menghibur pencinta musik Indonesia dimanapun berada. Kami berharap anda senang dan puas atas kunjungan anda ke channel ini.Channel ini akan berisi Lagu Terbaru dari penyanyi-penyanyi kebanggaan kami : Thomas Arya, Elsa Pitaloka, iPANK, Andra Respati, Kinthani, Ovhi Firsty dan banyak penyanyi penyanyi lainnya dibawah bendera Elta Record.Silahkan Like, Share dan Subscribe channel ini agar membuat kami semangat untuk menghibur anda.Terima kasih,ManagementTERAS MUSIKYelse - Berbeza Kasta ( Official Music Video )https://youtu.be/eYfkkftBgKw#BerbezaKasta #Yelse #SlowRock"
"lBkARUCJyXs","[Behind The Scene] Cerita di Balik Layar 'Pink Panda HYLT' | Budget, Bloopers, Persiapan, Proses","2020-07-31T02:00:05Z","UCjMbL79qz2vmOwINfaK2Bbw","Step by Step ID","26","20.08.08","pink panda|blackpink|how you like that|blackpink how you like that|how you like that cover|how you like that dance|dance cover|blackpink hylt|step by step id|natya shina|invasion dc|pink panda how you like that|pink panda hylt|hylt|blackpink lisa|blackpink jisoo|blackpink rose|blackpink comeback|blackpink dance|blackpink dance cover|behind the scene|pink panda reaction|pink panda how you like that reaction|pink panda blackpink|블랙핑크|Step by Step ID","1128312","79296","1132","8300","https://i.ytimg.com/vi/lBkARUCJyXs/default.jpg","False","False","Pink Panda 'HOW YOU LIKE THAT' cover: https://youtu.be/iYQ9X7n4CwUPink Panda 'HOW YOU LIKE THAT' MV Ver.: https://www.youtube.com/watch?v=uLGnnlztfmMMembers :Asyifa as Lisahttps://www.instagram.com/a.ci.paNatya as Rosehttps://www.instagram.com/natyashinaVina as Jisoohttps://www.instagram.com/devinaalmiraVellania as Jenniehttps://www.instagram.com/vellaaaniaVideographer : Satria ( https://www.instagram.com/looksatria )Camerawork ( https://www.instagram.com/camerawork.pro )Behind The Scene Cameraman:Rani (https://www.instagram.com/ranidjanisy)Photographer :Ztworks ( https://www.instagram.com/ztworks )Zt ( https://www.instagram.com/zt.justzt )Nana ( https://www.instagram.com/nananatasia )Behind The Scene Editor :Rani ( https://www.instagram.com/ranidjanisy )Behind The Scene Supervisor:Rendy ( https://www.instagram.com/rendypritz )Natya ( https://www.instagram.com/natyashina )Crew :Rendy ( https://www.instagram.com/rendypritz )Rani ( https://www.instagram.com/ranidjanisy )Raka ( https://www.instagram.com/raka.kirana )Deris ( https://www.instagram.com/drrstya )Amel ( https://www.instagram.com/rpnmel )Naufal (https://www.instagram.com/naufalfebriansyah)Wahyu (https://www.instagram.com/_wahyudi19)Makeup Artist :BMT Academyhttps://www.instagram.com/bmt.academyVonny (https://www.instagram.com/vonnyhwang)Pufa (https://www.instagram.com/puff88_)Nathasa (https://www.instagram.com/nathasaagnes)Skincare & Makeup: peripera.id and naturepublic.idWhere to get the products?Shope: Nature Republic OfficialTokopedia: Nature Republic OfficialPeripera :Shoppe: Peripera Official ShopTokopedia : Peripera OfficialWardrobe :Costume ( Syplh Crew )https://www.instagram.com/sylph_crewShoes ( Irv Shoes )https://www.instagram.com/irvshoesVenue : Symphony of The Sea, Ancol ( https://www.instagram.com/ancoltamanimpian )Jakarta Aquarium ( https://www.instagram.com/jakartaaquarium )Lembang Wonderland ( https://www.instagram.com/lembangwonderland )MidEast (https://www.instagram.com/mideast.shisha)Business inquiry:Pritananda.Rendy@gmail.comLine @mbr3151n (use @)#Blackpink #HowYouLikeThat #stepbystepid"
"IsH3dB9TXHQ","KEKOCAKAN MASALAH RAMBUT PANJANG, PENDEK, DAN KERITING || Situasi Klik dan Gatot oleh 123 GO!","2020-08-06T03:00:06Z","UC43nz9qnZ7AIrbOlfxejTig","123 GO! Indonesian","24","20.08.08","swakriya|kerajinan|kerajinan-kerajinan|kejailan|kejailan-kejailan|tantangan|tantangan-tantangan|seru|lucu|123GO!|123 go|123go|jail|teman|ramah|tutorial|kiat|cara","1378266","17864","1541","1235","https://i.ytimg.com/vi/IsH3dB9TXHQ/default.jpg","False","False","BERLANGGANAN: http://bit.ly/2CD26zLDari semua masalah ini, mana yang kamu alami sendiri? Bagikan video ini ke teman-temanmu yang mengalaminya, ya. Dan seperti biasa, jangan lupa, subscribe channel YouTube 123 Go! Indonesian untuk menonton konten seru lainnya! #123GO #lucu #kegagalanMusik oleh Epidemic Sound: https://www.epidemicsound.com/Sampel Foto: https://www.depositphotos.com https://www.shutterstock.comVideo ini ditujukan sebagai hiburan. Kami tidak menjamin kelengkapan, keamanan, dan kelayakan apa pun. Segala tindakan yang dilakukan berdasarkan informasi di video ini akan sepenuhnya menjadi risiko pelaku, dan kami tidak akan bertanggung jawab atas segala kerusakan dan kehilangan. Pemirsa bertanggung jawab penuh untuk menilai, merawat, dan melakukan tindak pencegahan jika berencana untuk meniru.Video berikut ini mungkin menampilkan aktivitas yang dilakukan oleh aktor-aktor kami dalam lingkungan terkendali - mohon bertindak penuh pertimbangan, kewaspadaan, dan kehati-hatian apabila hendak meniru."
"6k4f8JqHlmI","DAY 1 - BAPAREKRAF GAME PRIME 2020 PUBG MOBILE ONLINE TOURNAMENT - 100 JUTA PRIZE POOL","2020-08-04T11:00:05Z","UCImASpw8RiwrF6ycmD-OtxA","GGWP.ID","20","20.08.08","[none]","275070","9357","1895","372","https://i.ytimg.com/vi/6k4f8JqHlmI/default.jpg","False","False","16 tim PUBG Mobile Indonesia terbaik siap bertarung memperebutkan Rp100.000.000 prize pool tanggal 4-5 Agustus 2020!Menurut kamu, siapa yang berhasil keluar sebagai juara dan menyantap ayam?- Bigetron Ion- Alter Ego- Aura- Aerowolf Limax- Morph Team- Louvre Kings- Bonafide King- Boom Esports- NFT Esports- The Pillars Slayer- Victim Sovers- Geek Fam- RRQ Ryu- Onic Esports- Nero Team (dari qualifier)- Fora Esports (dari qualifier)Informasi selengkapnya seputar gaming dan esports dapat kamu cek di http://ggwp.id----------------------------------------------------------------Facebook Page: fb.com/DuniakuNetworkGGWPInstagram: instagram.com/ggwp_esports"
"tJQaUW36pMw","Jessi (제시) - '눈누난나 (NUNU NANA)' MV","2020-07-30T09:00:14Z","UCN2bQLTTvNPZWCWU5TYghKA","Jessi","10","20.08.08","Jessi|제시|MV|Music Video|NUNU NANA|눈누난나|누나|NUNA|MV Teaser|Music Video Teaser|뮤직비디오|뮤비|3rd|mini album|Album|3번째|앨범|피네이션|P NATION|음원|음원 발매|Dance|Hip Hop|힙합|댄스","9841656","675792","9420","30914","https://i.ytimg.com/vi/tJQaUW36pMw/default.jpg","False","False","Jessi (제시) - '눈누난나 (NUNU NANA)' MV MV Executive Producer: P NATION MV Director: Kwon Yong Soo @ SACCHARIN FILMComposed by: 유건형, 페노메코(PENOMECO), 전병일 Lyrics by: Jessi, PSY, Illson (더블케이), 페노메코(PENOMECO), DAMIAN, johnjohn, JAE ROArranged by: 유건형, 전병일, 강필성Mixed by Stay Tuned @ Stay Tuned StudioMastered by 성지훈 @ JFS Mastering* '눈누난나 (NUNU NANA)' is now available on all streaming platforms including Apple Music & Spotify. - Spotify: https://open.spotify.com/artist/64k5e9kV9MdukXjFrR5R37 - iTunes & Apple Music: https://music.apple.com/us/artist/jessi/911707693 - Jessi Official YouTube: https://www.youtube.com/jessiofficial- Jessi Official Instagram: https://www.instagram.com/jessicah_o/ - Jessi Official Facebook: https://www.facebook.com/jessihomusic - Jessi Official Tiktok: https://www.tiktok.com/@itsjessibaby -  P NATION Official Instagram: https://www.instagram.com/pnation.official/-  P NATION Official Facebook: https://www.facebook.com/pnation.official-  P NATION Official Twitter: https://twitter.com/OfficialPnation-  P NATION Official Weibo: https://weibo.com/pnation#Jessi #눈누난나 #제시 #NUNUNANA #PNATION #피네이션 Copyrights 2020 ⓒ P NATION All Rights Reserved"
