video_id,title,publishedAt,channelId,channelTitle,categoryId,trending_date,tags,view_count,likes,dislikes,comment_count,thumbnail_link,comments_disabled,ratings_disabled,description
"uCQGeBVItIQ","Kerah Biru : Kerasnya Jalanan Jakarta Bagi Supir Angkot Wanita","2020-07-29T10:00:14Z","UCeXBXzelo7MvLkMr3dAKODQ","Asumsi","22","20.08.08","Sopir Angkot|Angkot Ngetem|Angkot Ugal-ugalan|Raja Jalanan|Sopir Angkot Wanita|Sopir Angkot Cewek","963146","20060","351","2475","https://i.ytimg.com/vi/uCQGeBVItIQ/default.jpg","False","False","#KerahBiru #Angkot #SopirWanitaSupir angkutan umum biasanya lekat dengan profesi bagi kaum pria. Namun, kali ini berbeda. Di Pulogadung, Jakarta Timur, terdapat supir angkot wanita. Dia bekerja karena ingin membantu suaminya yang kerap mendadak sakit. Bagaimana dia bisa menyusuri kerasnya jalanan Jakarta setiap harinya? Menurutnya, dia paling tau ciri-ciri copet di angkot. Saksikan selengkapnya hanya di program Kerah Biru Asumsi episode 11!Follow akun Instagram #KerahBiru:https://instagram.com/kerah.biru?igshid=kjzx0i97st5k"
"oSK1BvvR8WA","Cara Jadi Pengusaha Millennial Sukses, Meskipun Modal dan Pengalaman Minimal !","2020-08-02T15:04:54Z","UC1mFZuLNWsFLCXa5spjG7Ow","WIRDA MANSUR","24","20.08.08","[none]","133714","10973","90","460","https://i.ytimg.com/vi/oSK1BvvR8WA/default.jpg","False","False","Free Webinar - Komunitas Millennial Anti Bokek by Wirda MansurJOIN GRUP TELEGRAM, GRATIS !http://t.me/millennialantibokekFOLLOW INSTAGRAM :http://instagram.com/millennialantibokek"
"GZBF0ULyf3I","ITZY Not Shy Opening Trailer","2020-07-30T15:00:05Z","UCaO6TYtlC8U5ttz62hTrZgg","JYP Entertainment","10","20.08.08","JYP Entertainment|JYP|ITZY|있지|ITZY Video|ITZY Yeji|ITZY Lia|ITZY Ryujin|ITZY Chaeryeong|ITZY Yuna|있지 예지|있지 리아|있지 류진|있지 채령|있지 유나|예지|리아|류진|채령|유나|Yeji|Lia|Ryujin|Chaeryeong|Yuna|ITZY BEHIND|ITZY VIDEOS|ITZY DEBUT|있지 데뷔|not shy|ITZY not shy|ITZY TEASER|있지 티저|not shy 티저|있지 뮤비 티저|not shy 뮤비 티저|ITZY MV TEASER|ITZY MV|M/V|TEASER|있지 컴백|ITZY COMEBACK|not shy MV|낫샤이 뮤비|낫샤이|not shy opening trailer|opening trailer","4274801","601747","10020","27824","https://i.ytimg.com/vi/GZBF0ULyf3I/default.jpg","False","False","ITZY Not Shy Opening Trailer[ITZY Official] http://ITZY.jype.comhttps://www.youtube.com/c/ITZYhttp://www.facebook.com/OfficialITZYhttp://www.twitter.com/ITZYOfficialhttp://fans.jype.com/ITZY#ITZY #NotShy #ITZY_NotShyCopyrights 2020 ⓒ JYP Entertainment. All Rights Reserved"
"NNbGXKohVAU","Tanggapan Billy soal Ramalan Hubungan Asmaranya dengan Amanda Manopo Part 02 - Call Me Mel 27/07","2020-07-27T15:50:49Z","UCl21jt0Ceho4Lp105Xt2BDg","Call me Mel","24","20.08.08","inews|melaney ricardo|call me mell|Info Indonesia|Live Streaming|Hotman Paris Show|Ichsan Akbar|viral|artis|selebgram|selebriti|Amanda Manopo|Billy Syahputra","858425","17027","511","4608","https://i.ytimg.com/vi/NNbGXKohVAU/default.jpg","False","False","Tanggal Tayang: 27/07/2020Amanda Manopo dan Billy Syahputra==========================================Part 01: https://youtu.be/XVS19RovR-4Part 02: https://youtu.be/NNbGXKohVAUPart 03: https://youtu.be/TRbYRwNa7XwPart 04: https://youtu.be/vsnkRbKymAU==========================================Meskipun dikenal sebagai stasiun televisi berita, iNews kini banyak menghadirkan acara-acara hiburan menarik. Salah satu program tayangannya adalah Call Me Mel yang menggabungkan antara talkshow dan komedi.Tak hanya konsep talkshow yang menarik dan menghibur dengan unsur komedinya, acara yang dibawakan oleh Melaney Ricardo dan Ichsan Akbar ini juga semakin menarik lagi dengan bintang-bintang tamu yang tengah viral di media sosial maupun sedang panas dibahas di dunia hiburan.Penasaran dengan keseruan Melaney Ricardo dan Ichsan Akbar bersama para selebritas yang sedang viral? Saksikan Call Me Mel, hanya di iNews!#CallMeMel"
"AMv7qz33oos","Polisi Tangkap Pemalak Truk yang Nekat - JATANRAS","2020-07-27T15:33:15Z","UCRObaWKEG55XLWjd67_2wjA","Official NET News","25","20.08.08","Berita|News|NETNEWS|OfficialNETNews|net|netmediatama|netmedia|net tv|internasional|tv digital|digital|Television (Invention)|Indonesia (Country)|Feature|Current Affairs","1348974","9576","810","2044","https://i.ytimg.com/vi/AMv7qz33oos/default.jpg","False","False","Subscribe Official NET. News Youtube Channel:https://www.youtube.com/OfficialNetNewsdan ikuti berita-berita terkini di NET. News via streaming di: http://www.netmedia.co.id/live-streamingserta baca beritanya di:http://news.netmedia.co.idFollow & Mention Twitter kami: https://twitter.com/OfficialNETNewsFollow & Like Facebook Fanpage kami: https://www.facebook.com/OfficialNETNewsFollow & Share Instagram kami:https://www.instagram.com/officialnet.news---Syarat & Ketentuan: http://bit.ly/1jAbOYj"
"NhtCFK3zfEY","BUKA-BUKAAN RIZKY BILLAR DAN LESTI TEMEN RASA PACAR?!! ROY KUPAS TUNTAS!!","2020-07-31T12:00:13Z","UCkKbg-8rc_9IcHQzTsu1uLQ","KR TV","22","20.08.08","roy ricardo|panjat sosial|semalem bobo dimana|janda|warner music|hip hop|barang kw|deddy corbuzier|vlog roy|krtv|hip hop indo|rapper indo|daily vlog|rizky billar|lesti|dinda hauw|trending|indosiar|leslar|ditinggal nikah|billar lesti|q&a|lesti kejora|kupas tuntas rizky billar dan lesti","669139","26875","398","2560","https://i.ytimg.com/vi/NhtCFK3zfEY/default.jpg","False","False","Kita main TRUTH OR TRUTH dulu jon sama adek gw si Rizky Billar!!♛ FOLLOW MY INSTAGRAM:https://instagram.com/royricardo♫ LUHALU [OFFICIAL MUSIC VIDEO]https://www.youtube.com/watch?v=EcsAumh1zCIfor business and bookings please email: ✉: teamroyal89@gmail.comTHANKS FOR WATCHING & DON'T FORGET TO SUBSCRIBE!!!- facebook: https://www.facebook.com/royricardoworld- soundcloud: https://soundcloud.com/royricardo- instagram: https://instagram.com/royricardo- twitter: https://twitter.com/royricardo#rizkybillar #lesti #truthortruth"
"MIOD4Lju8UI","Ayu Ting Ting - Cemburu Mantanmu (Official Music Video)","2020-07-27T03:00:12Z","UCxNTGZ-mmMLJvtD_DpuoEIw","Swara Bintang","10","20.08.08","Ayu Ting Ting|Cemburu Mantanmu|official|musik|tiktok|suara tiktok|single terbaru ayu ting ting|sambalado","1083590","60696","3362","51236","https://i.ytimg.com/vi/MIOD4Lju8UI/default.jpg","False","False","Single perdana dari Ayu Ting Ting berjudul Cemburu Mantanmu, yang dirilis oleh Swara Bintang, sebagai label baru Ayu Ting Ting, Cemburu Mantanmu memiliki melodi lagu yang sangat khas dan pasti familiar di telinga pendengar, Cemburu Mantanmu bercerita tentang pasangan yang cemburu dengan mantan dari pasangan kita, complicated yah? iya emang, tapi dengerin lagu sama lihatin videonya pasti bikin senyum senyum sendiri deh hehe.Streaming on Spotify: https://smarturl.it/CemburuMantanmu/SpotifyDownload on Apple Music: https://smarturl.it/CemburuMantanmu/AppleMusicStream on Joox: https://smarturl.it/CemburuMantanmu/JooxDengarkan lagu Ayu Ting Ting lainnya: https://www.youtube.com/playlist?list=PLG8zplT1aAOa2YoqPFHrBsIslsh-lEukXKu sayang sayang  kamu sepenuh hatiTerlalu dalam cinta yang kumilikiTak ingin lepas jauh jauh darimuIngin selamanya hidup bersamamu Kadang cemburu menghancurkan hatikuSaat ku tau siapa saja mantanmuWalaupun kamu sudah tak bersamanyaTapi rasa di hatiku tak menentu REFFSungguh hatiku cemburuBila ingat masa lalu muApa saja yang sudah kau lakukan denganyaSebelum bersamakuAwas awas awas ajaKalau kau ingat ingat diaHapus semua kenangan bersama dirinyaKalau kau benar cintaExecutive Producer Lina Priscilla for Swara Bintang RecordsTrack Produced by Keke KanantaSong Credits: (Song & Lyrics:Yogi RPH)Vocal Directed by Netta KDMusic Arranger: Yogi RPHMixing & Mastering:Yogi RPHProduction Video by StarHits ProductionVocal Director:Netta KDVocal Recorded by Yusuf @ Bro’s StudioPublishing: PT. Nagaswara PublisherindoHead Of Production : Dina SeptianaProd Music Video : Benedict AgungDirected : Benedict AgungCreative : Rini AtmajaProd Assistance : Jardan & RamaDop : MemetAss cam : Asrun TamaCam Operator : Imam & FebriEditor : Cipta Surya PribadiColorist & effect : Cipta Surya PribadiArt & Props : Samsu TeamLight Dept : UjangEquipment Support : MSPCatch us on SNS :https://twitter.com/swarabintanghttps://www.instagram.com/swarabintang.records/Don't re-upload our content but you can share our video. © 2020 Copyrights & Trademark by Swara Bintang Records"
"PaCUq4kKeaY","Arsenal celebrate at full-time after FA Cup win | FA Cup 19/20 Moments","2020-08-01T18:56:35Z","UCYtNSrfGdXooZYu_hkq18_w","beIN SPORTS Asia","24","20.08.08","Football|Arsenal|Chelsea|Arsenal FC|Chelsea FC|FA Cup|FA Cup 19/20|Arsenal vs Chelsea","845519","10246","350","1240","https://i.ytimg.com/vi/PaCUq4kKeaY/default.jpg","False","False","Arsenal beat Chelsea 2-1 to win a 14th FA Cup and the record holder made their celebrations count."
"oFWBf5Gt4M4","BLACKPINK - HOW YOU LIKE THAT MALE VERSION BY INVASION BOYS FROM INDONESIA","2020-07-30T13:00:07Z","UCYMCb9J-VO9KYr2QC2CbutQ","INVASION DC","24","20.08.08","HYLT_Dancecovercontest|HowYouLikeThat|블랙핑크|BLACKPINK|20200706_20200720|YG|BLACKPINK CONTEST|BLACKPINK HOW YOU LIKE THAT|PINK PANDA|PINK PANDA HOW YOU LIKE THAT|INVASION DC|LISA|JENNIE|ROSE|JISOO|INVASION|INVASION BOYS|블랙핑크 하우유라이크댓|리사|제니|로제|지수|DANCE COVER|COVER DANCE|blackpink dance cover|how you like that dance cover|blackpink male version|yg entertainment|invasion male version|HYLT|how you like that male version|댄스커버|커버댄스|blackpink choreography|블랙핑크 안무","442700","65675","1077","5320","https://i.ytimg.com/vi/oFWBf5Gt4M4/default.jpg","False","False","[ INVASION BOYS ] HOW YOU LIKE THAT / BLACKPINK - CHOREO BY ZT Hello! We are Invasion Boys from Invasion DC , We are back making an Original choreography for Blackpink How You Like That ! Please keep supporting us in the future , we hope you like this video! We want to thank all the sponsors, crew, dancers, and venues that made this project happened. ==========Remix by : ZSunder (https://www.youtube.com/watch?v=xP1QLjAUcn0)Members: Zthttps://www.instagram.com/zt.justztJeremy https://www.instagram.com/je.nath Mahdihttps://www.instagram.com/mahdiyasirfanBagashttps://www.instagram.com/bagasajiesrtmHasbihttps://www.instagram.com/hasbisullJulianhttps://www.instagram.com/julianmaezraAhsanhttps://www.instagram.com/ahsanoktaVideographer:Ztworks (https://www.instagram.com/ztworks)Editor:Make.A.Mov (https://www.instagram.com/make.a.mov)Ztworks (https://www.instagram.com/ztworks)Crew : Kiddy (https://www.instagram.com/_hellokiddy)Anggun (https://www.instagram.com/anggun.dt)Mila (https://www.instagram.com/anissamilaa)Raka (https://www.instagram.com/raka.kirana)Ales (https://www.instagram.com/alesanaja)Dian (https://www.instagram.com/dianchyt)Tiffany (https://www.instagram.com/tiffannyoh)Makeup Artist :https://www.instagram.com/bmt.academyVonny (https://www.instagram.com/vonnyhwang)Pufa (https://www.instagram.com/puff88_)Nathasa (https://www.instagram.com/nathasaagnes)Wardrobe:Costume (Sylph Crew)https://www.instagram.com/sylph_crewSoftlens (Kawaigankyu)https://www.instagram.com/kawaigankyuPants (4 empat id)https://www.instagram.com/4_empat.idNecklace (Oh So Sassy)https://www.instagram.com/ohsosassy.coChains (Tech Label)https://www.instagram.com/techs.labelEarrings (Moonshop)https://www.instagram.com/moonshopid__Venue :Kaskus (https://www.instagram.com/kaskusnetworks)Ballroom Season City (https://www.instagram.com/grandballroom_seasoncity)Regal Studio (https://www.instagram.com/regal_studio)Our Official Instagram :INVASION DC (https://www.instagram.com/invasion__dc)CONTACT PERSONInstagram : @Invasion__DC (https://www.instagram.com/invasion__dc)E-mail : Chandra_fx92@yahoo.comWA: +628 5215263891#BLACKPINK #HOWYOULIKETHAT #BLACKPINKHOWYOULIKETHAT"
"vsnkRbKymAU","Billy Syahputra Rela Lakukan Apapun Demi Amanda Manopo? Part 04 - Call Me Mel 27/07","2020-07-27T15:42:45Z","UCl21jt0Ceho4Lp105Xt2BDg","Call me Mel","24","20.08.08","inews|melaney ricardo|call me mell|Info Indonesia|Live Streaming|Hotman Paris Show|Ichsan Akbar|viral|artis|selebgram|selebriti|Amanda Manopo|Billy Syahputra","924304","16584","526","3016","https://i.ytimg.com/vi/vsnkRbKymAU/default.jpg","False","False","Tanggal Tayang: 27/07/2020Amanda Manopo dan Billy Syahputra==========================================Part 01: https://youtu.be/XVS19RovR-4Part 02: https://youtu.be/NNbGXKohVAUPart 03: https://youtu.be/TRbYRwNa7XwPart 04: https://youtu.be/vsnkRbKymAU==========================================Meskipun dikenal sebagai stasiun televisi berita, iNews kini banyak menghadirkan acara-acara hiburan menarik. Salah satu program tayangannya adalah Call Me Mel yang menggabungkan antara talkshow dan komedi.Tak hanya konsep talkshow yang menarik dan menghibur dengan unsur komedinya, acara yang dibawakan oleh Melaney Ricardo dan Ichsan Akbar ini juga semakin menarik lagi dengan bintang-bintang tamu yang tengah viral di media sosial maupun sedang panas dibahas di dunia hiburan.Penasaran dengan keseruan Melaney Ricardo dan Ichsan Akbar bersama para selebritas yang sedang viral? Saksikan Call Me Mel, hanya di iNews!#CallMeMel"
"Ui3bzE5I9fo","REAKSI BILLY SYAHPUTRA, PACAR DISEBUT CABE CABEAN","2020-07-28T15:35:20Z","UC8bOhuAs5WgShq4wh2cnGNQ","warta hot","24","20.08.08","Wartahot|Amanda manopo|Billy Syahputra|Nikita mirzani|Kekasih Billy Syahputra|Mantan pacar amanda manopo|Mantan pacar billy Syahputra|Hot news","714052","9347","427","2051","https://i.ytimg.com/vi/Ui3bzE5I9fo/default.jpg","False","False","Jangan lupa untuk Like, Comment, Share dan Subscribe ya! Follow juga akun sosial media kami yang lain:Instagram: https://www.instagram.com/warta.hot/Twitter: https://twitter.com/wartahotdotcom/FaceBook: https://www.facebook.com/wartahot#nikitamirzani #billysyahputra #amandamanopo"
"Uc3RhQd7RX0","Tak Kalah Dengan Mantan, Rizky Billar & Lesti Pamer Kemesraan|Was Was","2020-07-29T08:00:11Z","UCvm4qyl3nXVXc9QyJguOpdA","Was Was","24","20.08.08","cumi cumi|waswas|was was|berita artis|berita viral|infotaiment selebriti|berita hot|artis|gosip|Rizky Billar|lesti|leslar|dekat|mantan|ttm|teman tapi mesra","380637","6711","385","936","https://i.ytimg.com/vi/Uc3RhQd7RX0/default.jpg","False","False","Saksikan semua hanya di Was was!Jangan lupa  Subscribe, Like, Share, dan Comment. Heboh pemberitaan Lesty Kejora Dan Rizky Billar ditinggal nikah. Setelah itu keduanya jadi sorotan netizen, banyak yang meyakini hati Lesty sedang terguncang sejak ditinggal menikah oleh Rizky 2r. Lalu dikaitkan dengan Rizky Billar yang juga baru2 ini ditinggal menikah oleh Dinda Hauw. Seolah senasib netizen pun heboh menjodoh-jodohkan , beberapa hari yang lalu Rizky Billar terlihat menyambangi rumah Lesty, ada apa? Benarkah mulai timbul benih-benih cinta diantara mereka?, lantas seperti apa perasaan mereka masing-masing, berikut penjelasan Denny Darco lewat kartu tarotnya.Instagram : https://www.instagram.com/officialwaswas_indigoFacebook : https://www.facebook.com/OfficialWasWas/#Lesti #RizkyBillar #Leslar"
"j3SACggXDZE","Mahen - Luka Yang Kurindu (Official Music Video)","2020-07-20T10:00:11Z","UCcQaaKfBlPvMn_aRUHkQjLA","Indo Semar Sakti","10","20.08.08","mahen|petrus mahendra|luka yang kurindu|luka mahen|mahen luka yang kurindu|pura pura lupa|pop|lagu hits|lagu trending|indo semar records|indo semar sakti|indonesia","7015728","215096","3454","10892","https://i.ytimg.com/vi/j3SACggXDZE/default.jpg","False","False","Official Music Video 'Luka Yang Kurindu' by MahenSubscribe Indo Semar Sakti for new videos: http://smarturl.it/IndoSemarSubscribeJadikan Luka Yang Kurindu - Mahen Nada Sambung Pribadimu:Telkomsel: ketik LUKAMAHEN kirim ke 1212XL: ketik LUKAMAHEN kirim ke 1818Indosat: ketik LUKAMAHEN atau 53020427 kirim ke 808Available on Apple Music, Spotify, Joox, Youtube Music:https://backl.ink/142489300Yuk, Dengarkan Lagu Luka Yang Kurindu by Mahen!! Via LangitMusik MusikTanpaKuota - https://www.langitmusik.co.id/shareSo...Check out our instagram:https://www.instagram.com/indosemarsaktihttps://www.instagram.com/petrusmahendraContact Person:Ragil +62 811-1009-780Home label of Indonesian pop stars and legendary stars includes Farhan, Meyla Bilqis, Wahyu, Stereo June, SAE!, and many more. Also Naif, Tiket, La Luna, Plastik, Stinky, Netral.Song Credit:Composer: Pika IskandarMusic Arranger, Mixing and Mastering: Tito P SoenardiVocal Director: Ayoe PurnamasariRecording Engineer: UcupString Section: Budapest Scoring OrchestraMusic Video Production: Titik SembilanDirector: Alif FauzanStay updated with  Indo Semar Sakti music:Instagram : http://smarturl.it/IndoSemarInstagramTwitter : http://smarturl.it/IndoSemarTwitterFacebook : http://smarturl.it/IndoSemarFacebook"
"pReRHI7jmuY","Highlights | Strikes from Fernandes & Lingard seal Reds win | Leicester City 0-2 Manchester United","2020-07-26T21:00:05Z","UC6yW44UGJJBvYTlfC7CRg2Q","Manchester United","17","20.08.08","manchester united|mufc|man utd|manutd|mu|ggmu|old trafford|highlights|man utd highlights|de gea|wan-bissaka|maguire|lindelof|shaw|matic|pogba|paul pogba|fernades|bruno fernandes|rashford|marcus rashford|martial|anthony martial|greenwood|mason greenwood|ighalo|james|pereira|mctominay|fred|Leicester 0-2 Manchester United|Leicester 0-2 Man Utd","2679723","49111","1199","3077","https://i.ytimg.com/vi/pReRHI7jmuY/default.jpg","False","False","Enjoy the best of the action as goals from Bruno Fernandes and Jesse Lingard sealed a 2-0 win over Leicester City to confirm third place in the Premier League.Subscribe to Manchester United on YouTube at http://bit.ly/ManU_YTVisit Manchester United at http://www.manutd.comLike Manchester United on Facebook at http://www.facebook.com/manchesterunitedFollow Manchester United on Twitter at http://www.twitter.com/ManUtdFollow Manchester on Instagram at http://www.instagram.com/manchesterunitedSubscribe to MUTV at https://bit.ly/2L9ymRs"
"W_8mBam6fJc","Happy Asmara - Apakah Itu Cinta (DJ Selow) [OFFICIAL]","2020-07-20T02:00:15Z","UCIYnMS3cYRNl5-z25Kwy7AQ","DD STAR Record","10","20.08.08","Happy Asmara - Apakah Itu Cinta (DJ Selow) [OFFICIAL]|Happy Asmara|happy asmara apakah itu cinta|happy asmara apakah itu cinta official|apakah itu cinta|dj slow|waduk siman|kepung|kediri|happ","5219472","72571","2844","6418","https://i.ytimg.com/vi/W_8mBam6fJc/default.jpg","False","False","Happy Asmara - Apakah Itu Cinta (DJ Selow) [OFFICIAL]RBT Aktifkan NSP Apakah Itu Cinta By Happy AsmaraTelkomsel Ketik APKJT SMS ke 1212XL Ketik 32501854 SMS ke 1818TRI ketik 180343 SMS ke 1212Title : Apakah Itu CintaSinger : Happy AsmaraDance : CK Dance KediriSongwriter : IpankMusic Arranger : YudhistiraLokasi Shooting : Waduk Siman - Kepung - KediriLink Story WA Gratis :👉 https://bit.ly/30Cg6oVTIKTOK : 👉 https://vt.tiktok.com/UnApAQ/Berikut playlis dari artis kami :👇👇👇Nella Kharisma : http://bit.ly/34nKR0tHappy Asmara : https://bit.ly/3fax9V8Safira Inema : http://bit.ly/2ETyuPPJihan Audy : http://bit.ly/2PIuhEyMala Agatha : http://bit.ly/391ELGYDeviana Safara : http://bit.ly/2Zav0ScRena KDI : http://bit.ly/2sd4dbELinda Ayu : http://bit.ly/2MhOIWYVia Vallen : http://bit.ly/34GYmsBMaqdalena : http://bit.ly/2sVTpi7Elsa Safira : http://bit.ly/2MiDv8GVita KDI : http://bit.ly/35NEGo5Sasya Arkhisna : http://bit.ly/2Sf2i15Yeyen Vivia : http://bit.ly/2EDRKRbDian Marshanda : http://bit.ly/2s8Ue7nGita Florencia : http://bit.ly/34QVn0QCindy Aulia : http://bit.ly/2sPXYKXTupang : http://bit.ly/2Sg8Bl6Hormat kami : DD Star RecordPare - Kediri - Jawa Timur - IndonesiaEmail:    ddstarpro@gmail.comInstagram : http://bit.ly/2EI9VoKFacebook  : http://bit.ly/35N6cCjChannel : http://bit.ly/35OwofU#HappyAsmara #ApakahItuCinta #DJselowCopyright © 2020, DD Star Record [Official Video]YouTube channel managed by MusicYes Digital DistributionFully YouTube CertifiedJoin MusicYeshttps://musicyess.com/Account/Register"
"Pp7Ng21pLro","Penampakan Megalodon Telah Terlihat di Seluruh Dunia","2020-07-21T09:00:14Z","UCSg-Y9uI1E-my-I4WKKioEQ","SISI TERANG","24","20.08.08","SISI TERANG|Bright Side Indonesia|: hiu megalodon|video megalodon|gigi megalodon|serangan megalodon|sisi terang megalodon|apakah megalodon dinosaurus|apakah megalodon lebih besar daripada paus biru|apakah megalodon masih hidup|apakah megalodon hewan terbesar|bisakah megalodon memakan paus biru|seperti apa bentuk megalodon|apa makanan megalodon|video fakta tentang hiu|T-Rex|hiu paus|hiu Deep Blue|hiu raksasa|dokumenter predator laut|makhluk laut","6612972","106111","6461","5841","https://i.ytimg.com/vi/Pp7Ng21pLro/default.jpg","False","False","Makhluk misterius, besar, cepat, dan mematikan, bersembunyi di suatu tempat dalam kegelapan. Orang-orang bersaksi pernah melihat hiu raksasa di berbagai tempat di dunia. Mungkinkah itu Megalodon, sang predator kuno yang diyakini sudah lama punah? Namun, apakah mungkin Megalodon masih hidup di lautan dalam? Hiu raksasa ini adalah raja samudra yang sebenarnya - dan bahkan memburu paus! Mungkinkah makhluk semenakjubkan ini bisa menghilang tanpa jejak? Dan tentu, ada beberapa kasus ketika banyak saksi meyakini dirinya telah melihat sang Mega. Atau mungkinkah itu hanya karena rasa takut mereka?Megalodon, yang berarti gigi besar, adalah hiu terbesar yang pernah mengarungi lautan dan samudra Bumi. Megalodon dilaporkan hidup 23 sampai 3,6 juta tahun lalu dan ukurannya sangat besar. Gigitannya lebih kuat daripada T-Rex, dan itu tidak aneh - ia bukan cuma punya rahang super-kuat, panjang giginya pun mencapai 18 sentimeter! Bukan hanya itu, Megalodon punya sekitar 300 gigi yang tumbuh setidaknya dalam enam baris. Hiu ini sendiri bisa tumbuh sampai 18 meter - itu dua kali panjang bus bertingkat London! #sisiterang ALUR CERITA:Serangan hiu pantai New Jersey 00:00Hiu paus 2:08Hiu Deep Blue 3:03Hiu raksasa 3:56Menurut para ahli 5:05Berlangganan Sisi Terang  https://www.youtube.com/channel/UCSg-Y9uI1E-my-I4WKKioEQMusik oleh Epidemic Sound  https://www.epidemicsound.com/Materi stok (foto, rekaman, dan lain-lain):https://www.depositphotos.comhttps://www.shutterstock.comhttps://www.eastnews.ru"
"YSizNiOH2q8","Vita Alvia - LOS DOL (Official Music Video ANEKA SAFARI)","2020-07-20T13:10:31Z","UCmB1_agPlXbbwTCPKEuwEKA","Aneka Safari Records","10","20.08.08","aneka|safari|records|aneka safari records|yt:cc=on|safari records|dangdut|dangdut koplo|lagu dangdut terbaru|los dol|denny caknan|los dol remix","6438533","77812","4766","5131","https://i.ytimg.com/vi/YSizNiOH2q8/default.jpg","False","False","Lokasi pengambilan gambar video klip ini adalah lokasi yang dipakai dalam pengambilan gambar film layar lebar Habibie & Ainun ..Yukk silahkan dinikmati video klipnnya mari kita LOS DOL bersama sama !!Title: LOS DOLArtist: Vita AlviaAlbum: The Best Aneka Safari - Vita AlviaSongwriter: Denny Caknan & Lek Dahlan LirikLos Dol ndang lanjut leh mu Whatapp an cek paket datane, yen entek tak tukokne tenan dik elingo yen mantan nakokno kabarmu,tandane iku ora rindu, nanging kangen kringet bareng awakmu tak gawe los dol blas aku ra rewel nyanding sliramu sing angel di setel tutuk - tutuk no chatingan karo wong liyo rapopo, aku ra gelo, kok tutup - tutupi, nomere mbok ganti firasat ati angel di apusi senajan mbok ganti tukang las, bakul sayur lan tukang gastiteni, bakale ngerti reff : Los Dol ndang lanjut leh mu Whatapp an cek paket datane, yen entek tak tukokne tenan dik elingo yen mantan nakokno kabarmu,tandane iku ora rindu, nanging kangen kringet bareng awakmu Untuk Terjemahan Bahasa Indonesia ➡ Aktifkan SUBTITLE ..Siapa yang punya kisah serupa seperti isi lagu ini silahkan cerita ambyarkan kolom komentar ..***Yuk Berlangganan Subscribe Channel Youtube kita yang baru : http://bit.ly/anekasafaribts selamat menikmati ..***Available download & streaming on :iTunes ♪ : coming soon .. Spotify ♪ : coming soon .. Deezer ♪ : coming soon .. Buy on Amazon : coming soon .. Unduh Aplikasi Download Resmi Aneka Safari Digital : http://bit.ly/2I9DNep Other Popular Video From Our Artist :Happy Asmara | http://bit.ly/HappyPlayASRNella Kharisma | http://bit.ly/NellaPlayASRJihan Audy | http://bit.ly/JihanAudyPlayASRVita Alvia | http://bit.ly/VitaAlviaPlayASRDenik Armila | http://bit.ly/DenikArmilaPlayASRVia Vallen | http://bit.ly/ViaVallenPlayASRSyahiba Saufa | http://bit.ly/SyahibaPlayASRLutfiana Dewi | http://bit.ly/LutfianaDewiPlayASRNanda Feraro | http://bit.ly/NandaFeraroPlayASRMahesa | http://bit.ly/MahesaPlayASRMala Agatha | http://bit.ly/MalaAgathaPlayASRIkuti Seleksi Artis Nasional ANEKA SAFARI dengan cara upload video kamu di Youtube dan Instagram jangan lupa sertakan mention @safarirecords dan hashtag #AnekaSafariRecords ***Connect with us:Facebook : https://www.facebook.com/anekasafarirecordsTwitter : https://twitter.com/SafariRecordsIDInstagram : https://www.instagram.com/safarirecords/Contact :Tlp. : +6282333038023 ( Admin )Email : info@anekasafari.comWebsite : www.anekasafari.comCopyright © 2020 Aneka Safari Records. All rights reserved.#LosDol#VitaAlvia#Music#AnekaSafariRecords========================================Licensed to YouTube by IDE (Music)This channel & Video optimized by IDE OptimizationLicense your music here: https://smarturl.id/idemusicOptimize your video now: https://smarturl.id/optimize"
"J9mtES96nLU","MBAK YOU TERAWANG JODOH LESTI KEJORA SETELAH DITINGGAL RIZKI MENIKAH","2020-07-26T08:29:18Z","UCpqpwbaViy1OIlwTLPEp9NQ","seleb cam","24","20.08.08","Mbak You|Terawangan Mbak You|Mbak You Terawang Artis|Lesti Kejora|Lesti|Lesti Rizki|Berita terbaru Lesti Kejora|Berita terbaru Selebriti|Jodoh Lesti","1006326","10875","2228","2100","https://i.ytimg.com/vi/J9mtES96nLU/default.jpg","False","False","#selebcam #mbakyou #lestikejora #terawanganmbakyou"
