video_id,title,publishedAt,channelId,channelTitle,categoryId,trending_date,tags,view_count,likes,dislikes,comment_count,thumbnail_link,comments_disabled,ratings_disabled,description
"2dxTMxUo4PE","dalan liyane cover pengamen duo cantik & cece diana yang goyangnya bikin gagal fokus😍😂","2020-05-11T06:01:46Z","UCU4r7PCGPTKNpkh6TbAdMmA","Jefriandi Tarigan","22","20.17.05","dalan liyane|pengamen cantik|pengamen cewek|pengamen cewek cantik|pengamen grogol|pengamen cantik dari grogol|cece diana|cece diana jago dangdut|manda pengamen cantik|kini ku menemukanmu|seventen|trio wok wok|pengamen kocak|pengamen lucu|pengamen viral|lia pengamen cantik|pengamen jakarta|musisi jakarta|tatu|dalan liyane cover|happy asmara|nella kharisma|via vallen|pengamen|pengamen jalanan viral","204283","3725","146","443","https://i.ytimg.com/vi/2dxTMxUo4PE/default.jpg","False","False","Business/endorse Email:musicbenhil@gmail.comWhatsApp:081376219515 call/video=BLOCK(chat only)..Terima kasih sudah nonton video nya🙏😊Jangan lupa like komen Share ke temen temen Fb atau twitter kamu ya..Dan jangan lupa 👇👇SUBSCRIBE chanel saya ini Sekian dan terima kasih🙏🤘🏻😊.Follow jg instagram saya 👇👇Untuk update tentang musisi jalanan berbakat 👇👇👇https://www.instagram.com/jefriandi_tarigansubscribe cece diana👇👇https://www.youtube.com/channel/UCgcfBGRGqv9tT1t4gkXqhfgsubscribe manda👇👇https://www.youtube.com/channel/UCUFFRns_fiwQFF0B1oWKWWg"
"qJgkZtIYRIU","BAEKHYUN 백현 'Delight' Mood Sampler #Sticky Ver.","2020-05-11T15:00:24Z","UCzCedBCSSltI1TFd3bKyN6g","EXO","10","20.17.05","백현|BAEKHYUN|EXO|엑소|백현 솔로|Delight|딜라이트","500555","141026","225","4992","https://i.ytimg.com/vi/qJgkZtIYRIU/default.jpg","False","False","BAEKHYUN's 2nd Mini Album Delight will be released on May 25, 6PM (KST).BAEKHYUN Officialhttp://baekhyun.smtown.comhttp://www.youtube.com/baekhyunhttp://www.youtube.com/weareoneEXOhttp://www.facebook.com/weareoneEXOhttp://www.instagram.com/weareone.exohttp://twitter.com/weareoneEXO#BAEKHYUN #백현 #DelightBAEKHYUN 백현 'Delight' Mood Sampler #Sticky Ver. ℗ SM ENTERTAINMENT"
"fAmBKXs0CR0","PURNAMA MERINDU - KALIA SISKA ft SKA 86 (Cover Kentrung)","2020-05-08T13:21:01Z","UCX7RJTce2MLIfE4e8QxRl4g","UYE tone","10","20.17.05","kalia siska reggae|ska 86|reggae terbaru|ska|reggae|ska 86 terbaru|uye tone|ukulele|reggae ska|kentrung|purnama merindu|purnama merindu kentrung|purnama merindu versi reggae|jirolupat","418977","9349","161","1272","https://i.ytimg.com/vi/fAmBKXs0CR0/default.jpg","False","False","PURNAMA MERINDU - KALIA SISKA ft SKA 86 (Cover Kentrung)PURNAMA MERINDU - SITI NURHALIZAhttps://www.youtube.com/watch?v=q0VgfdlXfIcDukung karya musik original mereka dengan membeli CD atau membeli pada platform musik yang tersedia.Lagu Lagu Cover Kalia Siska Lainnya Ada disini : https://www.youtube.com/playlist?list...Lagu Lagu Cover SKA 86 Lainnya Ada disini : https://www.youtube.com/playlist?list...BAGIKAN/SHARE VIDEO INI SESUKA KALIAN 😊😊❤️❤️#KaliaSiska #Ska86 #PurnamaMerinduFollow me (Instagram) :@kaliasiska86https://www.instagram.com/kaliasiska86/@skadelapanenamhttps://www.instagram.com/skadelapanenam/?hl=id"
"RtMNFq6_s0k","Febby Rastanty MARAH Karena Wilona Dibawa-bawa?!  #TidurBarengBoy","2020-05-06T12:00:13Z","UCdpxBSzxXGz_J4K30YGvk_Q","Boy William","24","20.17.05","boywilliam|verrelbramasta|febbyrastanty|nebengboy|tidurbarengboy|natashawilona","873200","28132","2230","7973","https://i.ytimg.com/vi/RtMNFq6_s0k/default.jpg","False","False",""
"f_XWwVJlba4","Lagu Batak Masa Kini Dan Terpopuler Full Album","2020-05-12T02:00:11Z","UCCLwXw6IvuhukZLSGzsgtVA","Pelita Danau Toba","10","20.17.05","putri siagian|mona latumahina|reezal nainggolan|Full Album|pelita toba|lagu batak masa kini|nella kharisma geser kiri kanan|nella kharisma kau tercipta bukan untukku|nella kharisma sebelas dua","69327","558","78","31","https://i.ytimg.com/vi/f_XWwVJlba4/default.jpg","False","False","Official Music Video dari Putri Siagian, Mona Latumahina, Reezal Nainggolan ‘Lagu Batak Masa Kini' Full Album.Subscribe to Pelita Utama here: https:///smarturl.it/SubsToPelitaUtama*****Playlist :01). 00:00 Ise Be Nampuna Au ( Putri Siagian ) Cipt. Gaols Naibaho02). 05:45 Memori Indah ( Putri Siagian ) Cipt. Tumbur Nababan03). 10:42 Cinta Terakhirhu ( Reezal Nainggolan ) Cipt. Tumbur Nababan04). 15:09 Borhat Ma Ho Amang ( Mona Latumahina ) Cipt. Gaols Naibaho05). 21:01 Tarsongon Langit Makkolom ( Reezal Nainggolan ) Cipt. Jen Manurung06). 25:10 Amang Na Burju ( Putri Siagian ) Cipt. Abidin Simamora07). 29:54 Unang Maila Pogos ( Mona Latumahina ) Cipt. Anton Siallagan08). 34:00 Boasa Ikkon Pajuppang ( Reezal Nainggolan ) Cipt. Mangara T Manik09). 39:53 Aut Boi Nian ( Mona Latumahina  ) Cipt. Wervin Panggabean 10). 44:21 Beta Yang Mangarti ( Mona Latumahina ) Cipt. Tagor Pangaribuan*****====================================Pelita Utama is a record label and artist management based in Jakarta, Indonesia. Our artists include Nella Kharisma, Via Vallen, Mona Latumahina, Rany Simbolon, Jonar Situmorang, Victor Hutabarat and many more. Subscribe to our channel for exclusive videos, including official videos and lyric videos!Tonton video dari artis-artis lain Pelita Utama di:Mitha Talahatu https:///smarturl.it/MithaTalahatuPLsMona Latumahina https:///smarturl.it/MonaLatumahinaPLsRany Simbolon https:///smarturl.it/RanySimbolonPlaylistVia Vallen https:///smarturl.it/ViaVallenPlaylistDewi Kirana https:///smarturl.it/DewiKiranaPlaylistVicky Salamor https:///smarturl.it/VickySalamorPlaylistNella Kharisma https:///smarturl.it/NellaKharismaPLsJonar Situmorang https:///smarturl.it/JonarSitumorangPLsWafiq Azizah https://smarturl.it/WafiqAzizahPlayListsPutri Siagian https://smarturl.it/PutriSiagianPlaylistVita Alvia https://smarturl.it/VitaAlviaPlayListMila Rossa https://smarturl.it/MilaRossaPlayListDiah Arenza https://smarturl.it/DiahArenzaPlayListMala Agatha https://smarturl.it/MalaAgathaPlaylistRhyena Morena https://smarturl.it/RheynaMorenaPlayListVictor Hutabarat https://smarturl.it/VictorHutabaratPLContact:pelitautama.pt@gmail.comhttps:///smarturl.it/PelitaUtamaFacebookhttps:///smarturl.it/PelitaUtamaTwitterhttps:///smarturl.it/PelitaUtamaInstagram"
"d8B1LNrBpqc","PS5 Unreal Engine 5 Tech Demo","2020-05-13T15:15:03Z","UCKy1dAqELo0zrOtPkf0eTMw","IGN","20","20.17.05","IGN|ps5|PS5|Clip|Hardware|ps5 demo|ps5 gameplay|unreal engine|PlayStation 5|unreal engine 5|Sony Interactive Entertainment|unreal engine 5 ps5|playstation 5|PS5 Graphics|ps5 vs xbox series x|ps5 game|Unreal tech demo|unreal ps5|unreal playstation 5","6025630","215124","4939","38751","https://i.ytimg.com/vi/d8B1LNrBpqc/default.jpg","False","False","Unreal Engine 5 is Epic Games' next-gen game engine, utilizing film-quality art assets and dynamic lighting. A PS5 tech demo highlights the new capabilities of Epic's game engine."
"FyBNxZlkzcc","🔴LIVE | TOLOOOOOOOONG KITA TERJEBAK DITENGAH BANJIRRRR!!!!! TUHAAAAN TOLONG!!!!","2020-05-16T12:03:42Z","UCEIdGryox368qWinrZ9eA8A","SAAIHALILINTAR","24","20.17.05","[none]","523804","53904","694","22665","https://i.ytimg.com/vi/FyBNxZlkzcc/default.jpg","False","False","Saaih Halilintar Filmmakers - Little King Of YouTube -Business : saaihalilintar@gmail.com"
"4Lm9u-iXrDc","[M/V] NU'EST - I'm in Trouble","2020-05-11T09:00:03Z","UCUuyrV8JDv5UAMW2StsL-NA","NU'EST","10","20.17.05","뉴이스트|뉴이스트W|NU'EST|NU'EST W|JR|REN|ARON|BAEKHO|MINHYUN|민현|아론|백호|렌|최민기|김종현|곽아론|황민현|강동호|플레디스엔터테인먼트|Kpop|PLEDIS|뮤직비디오|M/V|Music Video","10943913","260555","1326","28876","https://i.ytimg.com/vi/4Lm9u-iXrDc/default.jpg","False","False","[M/V] NU'EST - I'm in TroubleAfter whispering sweet love with their previous 7th Mini Album [The Table], released in October of 2019, NU’EST returns in 7 months presenting another form of love with their 8th Mini Album [The Nocturne].Demonstrating their ability to change without limit, the 8th Mini Album [The Nocturne], once again portrays the group in a new light, offering a new perspective on love.The album focuses on “nightfall,” a moment that everyone encounters daily, when more honest emotions arise. The album unravels various aspects of the night, by realistically expressing emotions that many can relate to. Instead of portraying “nocturne” through the usual sentimental and gloomy mood, NU’EST uses various colors to express their emotions, illustrating “nocturne” as a song of the night.The title track, “I’m in Trouble,” depicts the moment one falls in love with another with an intense attraction. NU’EST demonstrates a more upgraded transformation by adding bolder expressions to their sophisticated yet restrained performance style. The lyrics contain sentiments that grow deeper as the night falls, presenting a bolder thrill and fatal charm.  As the story of a deeper and vibrant night unfolds, listeners will be able to encounter captivating tones that awaken the senses, and also a more mature NU’EST that hasn’t been revealed before.지난 2019년 10월, 미니 7집 [The Table]을 통해 달콤하게 사랑을 속삭였던 이들이 약 7개월 만에 미니 8집 [The Nocturne]으로 돌아와 또 다른 사랑의 짙어진 무드를 선사한다.여덟 번째 미니 앨범 [The Nocturne]은 매 앨범마다 한계 없는 변화를 보여준 뉴이스트의 색다른 모습을 담아내며, 그간 뉴이스트가 보여준 사랑 이야기에서 새로운 시선을 제시한다. 이번 앨범은 모든 사람들이 매일 마주치게 되는, 감정이 조금 더 솔직해지는 순간인 ‘밤’이라는 시간에 집중하여 밤의 여러 가지 모습을 누구나 공감할 수 있는 현실적인 표현과 이야기로 풀어냈다. 일반적인 ‘녹턴’이 가진 서정적이고 슬픈 야상곡이 아닌 다양한 색채로 표현하는 밤의 노래라는 의미를 더해 뉴이스트만의 감성과 언어로 야상곡을 완성시켰다. 타이틀곡 ‘I’m in Trouble’은 강렬한 이끌림으로 서로에게 빠지는 순간을 표현한 곡으로, 뉴이스트만의 세련되면서도 절제된 퍼포먼스에 과감해진 표현력을 더해 한층 더 업그레이드된 모습으로 변화를 시도하였다. 깊어질 밤 속에 더욱 깊어질 감성을 직설적인 가사로 담아냈으며 기존에 뉴이스트가 선보인 모습과는 또 다른 과감함과 짜릿한 전율을 선사, 치명적인 매력을 느낄 수 있다.이번 앨범을 통해 ‘밤’이라는 시간 속 더욱 짙고 선명해진 표현력만큼 감각을 일깨우는 매혹적인 음색과 함께 훨씬 더 성숙해진 뉴이스트를 만날 수 있을 것이다.NU'EST 'The Nocturne' oniTunes : https://music.apple.com/us/album/the-nocturne-ep/1512114865?l=ko&ls=1Spotify : https://open.spotify.com/album/5j8qRyyqFwXkIH7boJ6m9N?si=N5h3Fo_tQ9W6Z5Gv6m_9EwDeezer : https://www.deezer.com/us/album/146833622Tidal : https://listen.tidal.com/album/140516191QQ : https://y.qq.com/n/yqq/album/003zwYiQ1FnUYq.html#stat=y_new.singer.index.album_pic#뉴이스트 #NUEST #The_Nocturne #Im_in_TroublePledis Official Homepage: http://www.pledis.co.kr/NU'EST Official Facebook: https://www.facebook.com/pledisnuestNU'EST Official Twitter: https://twitter.com/nuestnewsNU'EST Official Fancafe: http://cafe.daum.net/nuestNU'EST Official Instagram: https://www.instagram.com/nuest_official/NU'EST Official Weibo: https://www.weibo.com/pledisnuestⓒ Pledis Entertainment. All Rights Reserved"
"kX2e5JWTDHo","Slank - Pahlawan Jalanan (Berkolaborasi dengan YABB)","2020-05-14T06:23:01Z","UC2ZxI_dxCy3_PwMu8EHKsKw","Musik Slank","10","20.17.05","slank|gojek|pahlawan jalanan|slankers|potlot|corona|covid 19|indonesia|ojol|ojek online|jakarta","51731","3529","69","341","https://i.ytimg.com/vi/kX2e5JWTDHo/default.jpg","False","False","𝐊𝐈𝐑𝐈𝐌 𝐃𝐎𝐍𝐀𝐒𝐈 & 𝐏𝐄𝐒𝐀𝐍 𝐒𝐄𝐌𝐀𝐍𝐆𝐀𝐓 𝐊𝐀𝐋𝐈𝐀𝐍 𝐃𝐈 https://kitabisa.com/slanksumbangsuaraLagu persembahan dari Slank dan Yayasan Anak Bangsa Bisa (YABB) untuk para pahlawan jalanan! Lagu ini ditujukan untuk memberikan pesan semangat bagi para pekerja harian yang terus berjuang di tengah pandemi. Slank dan YABB berkolaborasi melalui gerakan #SumbangSuara untuk menggalang dana dan dukungan dari masyarakat.Penggalangan dana ini didedikasikan untuk para pekerja yang penghasilan hariannya rentan menurun akibat sepinya jalanan karena pandemi COVID-19, seperti pedagang asongan, musisi jalanan, pemulung, tukang parkir, hingga supir angkot, taksi, ojek pangkalan dan online. Dana yang terkumpul akan disalurkan dalam bentuk paket sembako yang akan dibagikan ke kelompok pekerja harian di seluruh Indonesia. Kamu pun bisa ikutan berpartisipasi dengan berdonasi dan memberikan kata-kata penyemangat untuk mereka melalui https://kitabisa.com/slanksumbangsuara. Enjoy the song, dan jangan lupa untuk share pesan semangat ini ke para pahlawan jalanan yang kamu kenal!#SumbangSuara #YayasanAnakBangsaBisa #Slank #Slankdotcom #PahlawanJalanan"
"CMTmq4Wf_H4","HAREUDANG (DJ Angklung Fullbass) ~ Era Syaqira  |  Nestapa - Pasukan Perang","2020-05-04T07:13:11Z","UCe4cPmA9HNcCRYEGuknngZA","Khatulistiwa Record","10","20.17.05","khatulistiwa record|dangdut koplo|dj|dj remix|dj hareudang|hareudang dj","1987146","19819","3341","1999","https://i.ytimg.com/vi/CMTmq4Wf_H4/default.jpg","False","False","Hareudang hareudang hareudang panas panas panasSelalu selalu selalu panas dan hareudangTitle              :  Nestapa (Hareudang) cover versi DJ Remix Fullbass TerbaruArtis             :  Era Syaqira COVERSongwriter  :  Pasukan Perang Remixer              :  DJ Chang Vegas SurabayaVocal & Mixing  :  Bodhen FanesaVideo                  :  Kerta Widjayaofficial website  |  http://khatulistiwarecord.comAVAILABLE ONSpotify : https://spoti.fi/35ABCwnAmazon : https://amzn.to/2yt4eLK-----------------------------------------------------------------------------------Lirik :Hareudang, hareudang, hareudangPanas, panas, panasSelalu, selalu, selaluPanas dan hareudangNestapa di gurun pasirMerana karena panas hawanyaAkupun merasa anehGurun pasir mengapa panas hawanyaCoba dengar dengar cerita iniApakah iniHareudang, hareudang, hareudangFanas, fanas, fanasSyelalu, syelalu, syelaluFanas dan hareudangNestafa di gurun fasirMerana karena fanas hawanyaAkufun merasa anehGurun fasir mengafa fanas hawanyaCoba dengar dengar cerita iniAfakah iniHareudang, hareudang, hareudangFanas, fanas, fanasSyelalu, syelalu, syelalu fanas dan hareudangdipopulerkan oleh : Pasukan Perang-----------------------------------------------------------------------------------find usfacebook  |  https://www.facebook.com/KTWRecordtwitter  |  https://twitter.com/KTW_Recinstagram  |  https://www.instagram.com/khatulistiwa_recordEmail       :  info@khatulistiwarecord.comProduksi :  Khatulistiwa RecordCopyright © 2020 Khatulistiwa Record. All rights reserved.#Hareudang#EraSyaqira#Nestapa#DjHareudang"
"PcpPz-5b7zU","NGEBANGUN MOBIL KATANA SAMPAI 100JUTA TAPI TETAP KELIHATAN STANDARD!","2020-05-15T16:13:09Z","UCH98lDhkvCYgtQ5Zw8B1fzg","Babecabita","23","20.17.05","[none]","161653","4328","148","666","https://i.ytimg.com/vi/PcpPz-5b7zU/default.jpg","False","False","Follow Babe Cabita life on:YOUTUBE: Babecabita (tanpa spasi)https://www.youtube.com/channel/UCH98....INSTAGRAM:https://www.instagram.com/babecabiita....EMAIL:For business enquiries please contactBabecabiita@gmail.com or bebs.corp@gmail.com.LIKE, COMMENT, SHARE & SUBSCRIBE!Copyright 2020 - BEB'S , BUDAK KONTEN #Bebs #babecabita"
"B-mb2xDe-Cw","Didi Kempot Live at Synchronize Fest 2019","2020-05-09T13:00:08Z","UCbWYJOfJVwdeX8I9UG5F8Yw","demajorsTV","22","20.17.05","Didi Kempot|Synchronizefest2019","231404","14211","77","2071","https://i.ytimg.com/vi/B-mb2xDe-Cw/default.jpg","False","False","Pada 5 Mei 2020, Indonesia telah kehilangan seorang maestro campursari yang juga merupakan ‘The Godfather of Broken Heart’, (alm) Didi Kempot.Pria kelahiran Surakarta, 31 Desember 1966 ini sepanjang karirnya dalam bermusik dikenal sebagai performer yang gemar “merayakan” patah hati. Selama 30 tahun beliau berkarir di dunia musik, bisa terbilang baru tiga tahun belakangan dirinya berada di puncak karirnya sebagai seorang musisi. Sedikit cerita dibalik tampilnya alm. Didi Kempot di Synchronize Fest 2019 sebenarnya penyelenggara telah tanda tangan kontrak sejak April 2019, namun Synchronize Fest memutuskan baru mengumumkan penampilan beliau di bulan September 2019 sebagai peluru kejutan penampil dengan konsep pengumuman yang spesial. Terbukti pengumumannya kala itu telah dinanti-nantikan oleh para Sadboys dan Sadgirls yang akan hadir di Synchronize Fest 2019.Beliau menjadi penutup pada hari pertama gelaran festival 4 Oktober 2019, dan mendapatkan apresiasi tertinggi oleh para penonton yang didominasi anak muda. Para Sobat Ambyar nampak bertahan hingga selesai penampilan Lord Didi Kempot di panggung Dynamic. Tak sedikit diantara penonton turut menangis merasakan sakit hingga ulu hati saat beliau menyanyikan tembang-tembang sendu miliknya.Kini Didi Kempot telah tiada, namun kehadirannya di Synchronize Festival menjadi catatan bersejarah bagi siapapun yang menyaksikannya.Berikut kami persembahkan video penampilan pertama dan terakhir ‘The Godfather of Broken Heart’ Didi Kempot  pada gelaran Synchronize Festival.Semoga video ini berkenan di hati Anda, dan menjadi kenangan terindah yang kita ingat selalu tentang beliau.Selamat ambyar online bersama ~#SynchronizeFest#SynchronizeFest19#DidiKempot#SobatAmbyar#SadboysClub#SadgirlsClubSONGLIST :1. Stasiun balapan2. Kalung emas3. Layang kangen4. Banyu langit5. Bojo galak6. Kartonyono medot janji7. Cidro8. Pamer bojo9. Pantai Klayar10. Kangen Nickerie (Feat.Dory)Untuk info lebih lanjut mengenai Synchronize Fest, kunjungi:https://www.synchronizefestival.comhttps://instagram.com/synchronizefesthttps://twitter.com/synchronizefest"
"3na0pYCGCeA","Serunya Koko, Cici, dan Keith Main dan Berenang Bareng | DIARY THE ONSU (14/5/20) P3","2020-05-14T13:22:56Z","UCIohHXwCEKxWCLvAguJ-GjA","TRANS TV Official","24","20.17.05","TRANSTV|TRANS TV|TRANSMEDIA|LIVE STREAMING TRANS TV|TRANS TV LIVE STREAMING|#StayHome|#WithMe|StayAtHome|#dirumahaja|TERBARU|ACARA TRANS TV|TRANS TV LIVE|TRENDIN|VIDEO TRENDING|TRENDING HARI INI|DIARY THE ONSU|RUBEN ONSU|BETRAND|BETRAND PETO","473099","17846","135","1144","https://i.ytimg.com/vi/3na0pYCGCeA/default.jpg","False","False","DIARY THE ONSU===TAYANG SETIAP SENIN - JUMAT PUKUL 18.30 WIB===PART 1: https://youtu.be/XVTERIhfybsPART 2: https://youtu.be/N7zVktto1pUPART 3: https://youtu.be/3na0pYCGCeAPART 4: https://youtu.be/vt3eS_uGgNM===Program reality show “Diary The Onsu” akan mengajak anda semua untuk mengintip langsung keseharian dan kesibukan Ruben Onsu dan keluarga. Mulai dari pagi sampai malam hari,setiap keseruan, ketegangan, kelucuan dan kehebohan yang terjadi diantara Ruben, Sarwendah, dan si bintang cilik Betrand Peto tak ada yang luput dari kamera kami.===WEBSITE - http://www.transtv.co.idTWITTER - https://twitter.com/TRANSTV_CORPFACEBOOK - https://www.facebook.com/TransTVMediaINSTAGRAM - https://www.instagram.com/TRANSTV_CORP#DiaryTheOnsu #DiaryTheOnsu14Mei2020 #NontonDiaryTheOnsuSamaSaya"
"ee3VcHYIo7Y","TOP SCENES FROM RAMBO: FIRST BLOOD - Starring Sylvester Stallone","2020-05-09T17:30:36Z","UCFSILgKCKo35QYGz8Kob51g","StudiocanalUK","1","20.17.05","[none]","1562419","8324","1117","210","https://i.ytimg.com/vi/ee3VcHYIo7Y/default.jpg","False","False","From the Jail Escape scene to Rambo's heartwarming meltdown - we've selected the most iconic scenes from Rambo: First Blood. Comment below your favourite scene and why! A soft-spoken Vietnam vet drifts into a small town looking for no trouble, but finds it in the form of a psychotic local sheriff who finds pleasure in hating him for no reason. After being locked up in the local jail, he escapes into the nearby forest where he becomes a one-man army bent on revenge. When things get out of hand, the vet's ex-Colonel comes in with the military to convince him to give up the stand-off.Yours to own now: https://www.amazon.co.uk/Rambo-First-Blood-DVD/dp/B07HPPY1MD/ref=sr_1_1?dchild=1&keywords=first+blood+dvd&qid=1588955681&sr=8-1"
"OcMifYM83lI","Dota 2 WTF Moments 353","2020-05-13T00:44:30Z","UC18NaGQLruOEw65eQE3bNbg","Dota Watafak","20","20.17.05","dota|dota2|martius|darduin","889172","34991","1176","1692","https://i.ytimg.com/vi/OcMifYM83lI/default.jpg","False","False","GET 25% BONUS with CODE: DWTF1 https://Csgo.netDota 2 fail/win compilationSubmit your clip / Manda tu video: http://dotawatafak.com/Facebookhttps://www.facebook.com/DotaWatafakTwitter:https://twitter.com/Dota2WTF--------------- RampageMusic provided by Monstercat: Tokyo Machine - JOURNEYhttps://www.youtube.com/watch?v=NQy4tG-lYXIhttps://youtube.com/monstercat https://youtube.com/monstercatinstinct--------------- Pango clipMusic provided by Monstercat: Bossfight - Chargehttps://youtube.com/monstercat https://youtube.com/monstercatinstinct---------------Morph + Doom clipTrainwreck Of Electro Swing - A Hat In Time Remixhttps://www.youtube.com/watch?v=2c1iSpk3u1A►https://smarturl.it/TrainwreckRemixDownload on more music stores:Google Play ► https://goo.gl/f4YMa8 Amazon ► https://www.amazon.com/Trainwreck-Ele...iTunes ► https://itunes.apple.com/us/album/tra...---------------Yamajet - Death by Glamour (Yamajet Cyber Disco Remix) | UNDERVEIL THE SEQUELhttps://www.youtube.com/watch?v=iXT_tMJhEK8---------------Music provided byhttps://www.epidemicsound.com/----------------Licensed under Creative Commons: By Attribution 3.0"
"Lqxy9Utl54w","Ayah Angkat Syahrini Bongkar Kisah Cinta Inces sampai Sebut Wanita 'Beragenda'","2020-05-12T11:30:02Z","UCD8TFgJATSV8-PcKhYPFRPg","Grid ID","24","20.17.05","Video Grid.ID|Grid.ID|Grid Network|Selebriti|Berita Artis|Seleb|Berita Selebriti","71302","348","40","189","https://i.ytimg.com/vi/Lqxy9Utl54w/default.jpg","False","False","Grid.ID - Laurens, pria paruh baya bule yang mengaku sebagai Ayah angkat Syahrini semakin berani mengungkapkan sisi lain dari Inces.Hal itu ia ungkapkan melalui akun Instagramnya @liohk.#Syahrini #ReinoBarack #AyahAngkatSyahrini==========================================Baca Berita Lengkapnya di Website : http://www.grid.id/Facebook Grid.ID : https://www.facebook.com/GRIDdotID/Instagram : https://www.instagram.com/grid_id/Twitter : https://twitter.com/grid_id===========================================EDITORIAL OFFICEGramedia Majalah Building Unit I 5th FloorJl. Panjang No. 8A Kebon JerukJakarta 11530Tel : (021) 5330150/5330170 ext. 31170/31171Faks : (021) 5347963Email : redaksigrid@gmail.comADVERTISINGGramedia Majalah Building Unit I 5th FloorJl. Panjang No. 8A Kebon JerukJakarta 11530Tel : (021) 5330150/5330170Email : iklangrid@gramedia-majalah.com#GridID #GridNetwork"
"44MlIiZm8nM","TADINYA MAU TAUSYAH, JADI MARAH GARA GARA PRANK SAMP4H !!!","2020-05-06T06:48:05Z","UCTH6Nwl_6qeZTkwDoKD0szA","Ki Prana Lewu","22","20.17.05","ki prana lewu|jejak spiritual|jejak paranormal|perjalanan Astral|jurnalrisa|film kartun lucu|film kartun|kartun|anime|kartun komedi|komedi|animasi|kartun lucu|animasi lucu|netizen|warganet|warganet life|trending|viral|bigo horor|terekam|kuyang|hantu kartun|hantu lucu|mister angka|video unik|video aneh|cctv|tersembunyi|rahasia|fakta|unik|trans 7|on the spot|terekam kamera|kejadian aneh|aneh tapi nyata|misteri|sarawijayanto|rans|baim paula|dangdut|music","1577202","59663","1072","5436","https://i.ytimg.com/vi/44MlIiZm8nM/default.jpg","False","False","Gengs in bkn bentuk sarkasme atau membenci individu dr mereka,in bentuk prihatin atas perlakuan mreka kpd org lain,agar menjadi pelajaran buat qt semua utk tdk mlakukan tindakan yg bs merugikan org lain,dan jgn prnh meniru stiap adegan dr mereka stau hal yg serupa yg dpt membuat reaksi kemarahan orang lain,dan semoga pembuat vidio sadar dgn kekhilafan yg ia perbuat dan tek mengulangi hal yg sama,jgn benci orgny gengs tp bencilah perbuatanny dan doakan agar mereka menyesal dan tdk berbuat hal yg serupa kembali.Untuk konsultasi dengan Ki Prana Lewu bisa hubungin ke nomer 0818803157 /087889551557 selain dua nomer di atas bisa di pastikan palsu...dan untuk contact person prihal  pengaduan (  penipuan ) , iklan , endorse bs hubungin ke nomer 081808885357email: kipranalewumanagement357@gmail.comTTD Management Ki Prana Lewu#KIPRANALEWU"
