video_id,title,publishedAt,channelId,channelTitle,categoryId,trending_date,tags,view_count,likes,dislikes,comment_count,thumbnail_link,comments_disabled,ratings_disabled,description
"SXfVCR1JGhU","AKHIRNYA DEDDY CORBUZIER KENA PRANK, CINTA NGAKU PACARNYA AZKA","2020-05-15T08:00:11Z","UClm79UMZVmwFv-PVFh6XBiA","Cinta","22","20.17.05","cinta kuya|social eksperimen|prank|beauty|make up|tutorial|fun|uya kuya|hypebest|nike|jordan|korea|traveling|blackpink|exo|bts|cover","3098840","131077","7092","5208","https://i.ytimg.com/vi/SXfVCR1JGhU/default.jpg","False","False","Prank om Deddy malah di tanya-tanya kan jadi bingung jawabnyaBusiness Inquiry /Contact Person Basyid : basyid@creativeindigo.net"
"2Oao-EJnPZc","PRANK KAKAK CINTA TELAT SAHUR SAMPAI NGAMUK! | DIJAMIN ANTI GAGAL","2020-05-16T05:00:11Z","UCMTcqreJj9HY0SEzyn7wzHg","Nino Kuya","22","20.17.05","prank|nino kuya|uya kuya|cinta kuya|sosial eksperimen|viral|trending|hits|warga 62|mr.ganteng|gembel|iphone 11|iphone x|raja prank|raja settingan|hypebeast|ramadhan|sahur","1693791","79535","3588","1849","https://i.ytimg.com/vi/2Oao-EJnPZc/default.jpg","False","False","Pembalasa di mulai..Business Inquiry /Contact Person Basyid : basyid@creativeindigo.net"
"buPEWlguO5k","MY TOP 3 INDONESIAN CHILI","2020-05-15T11:00:12Z","UCepgnl-TtJ8DurHdC6EE22w","Ria SW","24","20.17.05","naknan|bu rudy|parkit","1301582","119580","1267","8693","https://i.ytimg.com/vi/buPEWlguO5k/default.jpg","False","False","Holla!Huaaaaa malu!malu karena keliatan banget ‘bodohnya’ saat dilepas di dapur sendirian hahaha.tapi…YA UDAH LAH YAH.Oh, perkembangan muka aku… Sekarang udah sembuh. Sepertinya benar karena perubahan cuaca dari dingin (Korea) ke panas (Jakarta).Makasih yah buat masukan kalian —  dari yang suruh aku pakai lemon sampai ke bedak Marcks. Apa aku melakukan keduanya? Tentu saja tidak hahahaha. Soalnya aku takut makin parah huaaa.Tau gak, ini udah hari ke 59 aku ada di rumah. Selain bikin aku jadi punya banyak waktu untuk tidur (iya, aku suka banget tidur) kulit aku juga jadi lebih putih.Aku takut kalo self-quarantine berkepanjangan ini akan membuatku terlihat seperti vampire. Padahal aku alien yah…?Tunggu, apa kalian masih aman-aman aja di rumah? Aku harap kalian bisa menghilangkan kejenuhan dengan melakukan hal yang belom pernah kalian coba.Tau gak apa yang sedang aku lakukan selain syuting dan ngedit selama di rumah?SCRAPBOOK!Aku lagi senang mengerjakan ini~ Kegiatan yang udah lama banget aku tinggalkan. Terakhir ngelakuin ini ketika aku masih duduk di bangku sekolah.AAAAA senang sekali~!Aku sampai mau bikin tools dan stiker scrapbook sendiri, tau gak. Tapi apa lah daya, tidak semudah dan semurah yang aku pikirkan hahahaha.Sedangkan di situasi sekarang, kita harus lebih pintar untuk menggunakan uang.Q: Kak ia, strategi penyiaran apa yg diterapkan yg membuat video yg selalu diupload masuk dalam tangga trending?A: Gak ada. Aku hanya punya RAYS dan KAMU (family, para pejuang mimpi dan pendukung) yang luar biasa dan kalian lah yang bikin aku (yang biasa aja) terlihat amazing.***Ok, untuk sekarang sampai sini dulu. Seperti biasa, ketemu 2 minggu lagi yah~Please jaga diri kalian baik-baik.I YELLOW YOU SO MUCH! xoxo,RSW"
"o_9FHjTKh3w","INDIRA KALISTHA MINTA MAAF KLARIFIKASI","2020-05-16T15:49:29Z","UCYk4LJI0Pr6RBDWowMm-KUw","Deddy Corbuzier","24","20.17.05","indira khalista|gritte|maaf|minta maaf","3097801","198962","38078","105573","https://i.ytimg.com/vi/o_9FHjTKh3w/default.jpg","False","False","#indirakalistha #maaf #gritte"
"9ZvpF_dV4Iw","SULE NAWAR MOBIL ANDRE SAMPE NGAMUK???? WAJIB NONTON!!!!","2020-05-11T21:36:55Z","UCZWk_k207M--sLScrLdM3JQ","SULE Channel","24","20.17.05","yt:cc=on|Sule|Sule Prikitiew|sule prikitiw|komedian|komedi|comedy|comedian|host|pembawa acara|pelawak|ovj|ini talkshow|net|sutisna|sos|oesman|oesman77|joke|laugh|humor|stand-up|unyu|tawa|candaan|guyonan|warkop|rizky febian|lucu|funny|jokes|DRM|DR.M|Music|smile|follow me|taubat|andre taulany|parto|nunung|sule dan andre","2250757","56722","2581","3605","https://i.ytimg.com/vi/9ZvpF_dV4Iw/default.jpg","False","False","#SuleChannel#ONTROG#AndreTaulany---Tong hilap, di LIKE, COMMENT, SUBSCRIBE, & SHARE.Langganan SULE Channel Gratis:http://bit.ly/SuleChannelIkuti SULE di media sosial:https://www.facebook.com/stephen.sule.98https://twitter.com/newsuleprikitiwKerjasama YouTube dengan SULE Channel:youtube@drm-indonesia.comCopyright 2020 - SULE Channel Production.SULE CHANNEL on YouTube is under dr.m network, Indonesia's First Certified Official Youtube MCN (Multi Channel Network)https://servicesdirectory.withyoutube.com/directory/pt-digital-rantai-maya-drm"
"LdKJ9HuZktI","STELA DAN ENDANG KENA KARMA","2020-05-16T19:34:49Z","UCfx3oPv3cJm2aCJ7UnhKx8A","Arif muhammad","23","20.17.05","arif muhammad|mak beti|ma beti|mama beti|mamak beti|sketsa|cerita beti|keluarga beti|beti komedi|commedi|dialog medan|merlin vs stela","2189821","167524","2715","25553","https://i.ytimg.com/vi/LdKJ9HuZktI/default.jpg","False","False","Find me on sosial media :Instagram: https://www.instagram.com/arifmuhammaddd_/Facebook:  https://web.facebook.com/arifmuhammaddd/?_rdc=1&_rdrfor bussines Email: arifmuhammadd35@gmail.com"
"OUpGEmubanc","DMS DIRUMAH AJA #1","2020-05-09T15:10:47Z","UCa3k1_nfBeXbf7be6Dcy_vQ","Sara Wijayanto","22","20.17.05","sara wijayanto sara demian demian sara wijayanto|mistik supernatural|supranatural diary sara wijayanto|paranormal|ghost|beauty blogger|beauty tips|dms|diarymisterisara|#diarymisterisara|mualmual|#mualmual|penelusuran","4151048","230260","4363","21574","https://i.ytimg.com/vi/OUpGEmubanc/default.jpg","False","False","“ Kami tidak memaksakan apa yang kami percaya untuk kalian percaya. Kami hanya ingin berbagi cerita “ #DiaryMisteriSara #dirumahaja #mualmualFollow IG for updates! @SaraWijayanto@diarymisterisara@WisnuHardanahttps://www.youtube.com/channel/UCR2g...@_demianaditya_ https://www.youtube.com/user/numagic666Theme song by Alex Lisi: http://youtube.com/c/AlexLisiReal"
"iH2bH1hJkKU","5 Cuplikan Vlog Mengerikan Dari Para Youtubers - Part 11","2020-05-14T13:30:11Z","UC3p_eXknBdGus6jbajYMqVw","Ewing HD","24","20.17.05","ewing|ewing hd|malam jumat|uji nyali|penampakan|kuntilanak|ewing hd hd malam jumat|ewing hd penampakan hantu|ewing squad|mynameisewing|malam jumat ewing|ghost|horror|viral|indonesia|top 5|caught on camera|hantu seram|penampakan hantu|ewing hd malam jumat|cerita seram|misteri|aneh tapi nyata|mengerikan|nyali|cuplikan|vlog|youtube|youtubers|ewingvlog|ewing hd penampakan|malam jumat ewing hd|penampakan setan|ewing hd hantu indonesia|hantu indonesia","913253","40161","1341","3394","https://i.ytimg.com/vi/iH2bH1hJkKU/default.jpg","False","False","Registrasi di Binomo! Dan Dapetin saldo gratis $1000 di akun demo kalian dangunakan kode promosi DIRUMAHAJA untuk mendapatkan bonus 100% di akun riil kamu! Klik https://fazze.cc/lnfFfTHai semua nama gue Ewing dan berikut adalah berbagai macam cuplikan vlog mengerikan beberapa youtubers bagian ke 11. Buat gue sendiri, nomor 5 itu paling mengerikan dan nomor 1 itu paling creepy, apalagi pas bagian kuntilanak merahnya. Tonton juga part lainnya ya!Part 10 : https://www.youtube.com/watch?v=sWLLFYEYrisPart 9 : https://www.youtube.com/watch?v=t1M6sm29tQEPart 8 : https://www.youtube.com/watch?v=IElRCB-N-j8Part 7 : https://www.youtube.com/watch?v=-YsdzvHmu-gPart 6 : https://www.youtube.com/watch?v=DBJ5T1R7_qYPart 5 : https://www.youtube.com/watch?v=u6VTdqINMBQPart 4 : https://www.youtube.com/watch?v=0HXdNqmwpZgPart 3 : https://www.youtube.com/watch?v=mjpFrH12GdkPart 2 : https://www.youtube.com/watch?v=m_oAtvIruqgPart 1 : https://www.youtube.com/watch?v=9pRIoZr-jZ0➖➖➖▶️ PLAYLIST👻 MalamJumat HORROR(Video tentang hal misterius dan mengerikan)https://www.youtube.com/playlist?list=PL44ZLWDerGDIrA002dubu1vDSNmlFte07😱 EmailBerhantu(Video tentang penampakan hantu yang dikirimkan oleh followers Ewing HD) : https://www.youtube.com/playlist?list=PL44ZLWDerGDLV1e_1Qw-426mQQGJBJaUT📸 SembariMaghrib(Video tentang eksplorasi tempat angker ketika maghrib)https://www.youtube.com/playlist?list=PL44ZLWDerGDIkh13up_2NlztQhg2QKaMW🔥 ApiUnggun(Video tentang pembahasan lengkap mengenai hal yang misterius)https://www.youtube.com/playlist?list=PL44ZLWDerGDK-So3G4yLcxGmm-CGzNSIw➖➖➖▶️ SOCIAL MEDIAFacebook: https://www.facebook.com/EwingHDInstagram: https://www.instagram.com/ewing_hd/Website : http://www.ewinghdtv.com/➖➖➖▶️ BUSINESS & ENDORSEPlease kindly email me at : contact@ewinghdtv.com➖➖➖#EwingHD #Vlog #Ghostindonesia Cuplikan Vlog Mengerikan Youtubers Kuntilanak Merah Horror Scary Creepy"
"4dr6pCY4Ddc","Nella Kharisma - Ninggal Tatu [OFFICIAL]","2020-05-13T05:00:14Z","UC2sVRtimSUdDN2myZ6Cf03w","Nella Kharisma Official","10","20.17.05","Nella Kharisma - Ninggal Tatu [OFFICIAL]","1044052","24956","998","6449","https://i.ytimg.com/vi/4dr6pCY4Ddc/default.jpg","False","False","Copyright © 2019 Nella Kharisma OfficialAll rights reserved.Title : Ninggal TatuArtist : Nella KharismaSongwriter : Kuncung MajasemMusic & Video : NK CreativeLocation : Bukit Daun HotelProduction : Nella Kharisma OfficialFull Album Nella Kharisma: https://www.youtube.com/playlist?list=PLQVDVegXmBRqa3g92vhejz6SfPoxtxYlfFollow Instagram Nella Kharisma :https://instagram.com/nellakharisma?igshid=1he4ui1bnjs2xFollow Twitter Nella Kharisma :https://mobile.twitter.com/nellakharisma94Follow Tiktok Nella Kharisma :https://vt.tiktok.com/24maTU/Contact Person For Job :+6285806511128 ( Mas Candra )+6282143138402 ( Cak Rul )Song Lyrick,NINGGAL TATUnengopo ra crito yen kowe wis ra tresnoning kowe malah lungo, ninggal tatu neng dodorasane ati iki koyo keno mowobareng wis ngerti neng mburiku kowe ngeliyojanjine ngancani nganti tekane patining nyatane janjimu kuwi mung kari janjipanase geni ra koyo panase atisakwise ngerti kowe neng aku ngapusikowe tak sayang sayang saiki malah ngilangtresnamu karo aku kuwi mung kiasankowe tak gadang gadang tegane gawe wiranganggonku labuh kowe opo isih kurangINDONESIAkenapa tidak cerita kalau kamus udah tidak cintatapi kamu malah pergi, meninggalkan luka di dadarasanya hati ini seperti kena barabegitu sudah tahu di belakangku kamu menduajanjinya menemani sampai matitapi nyatanya janjimu itu hanya tinggal janjipanasnya api tidak seperti panasnya hatisetelah tahu kamu hanya membohongikukamu ku sayang-sayang, sekarang malah menghilangcintamu denganku aku itu hanya kiasankamu ku harap-harap, teganya membuat maluapa yang sudah ku berikan apa masih kurangYouTube channel managed by MusicYes Digital DistributionFully YouTube CertifiedJoin MusicYeshttps://musicyes.com/Account/Register#NellaKharisma #NinggalTatu #Koplo"
"9Hl44Uxf0-w","PRANK TELEPON ACAK PART 1 | CINTA MINTA TANGGUNG JAWAB DEDDY CORBUZIER","2020-05-13T09:00:11Z","UClm79UMZVmwFv-PVFh6XBiA","Cinta","22","20.17.05","cinta kuya|social eksperimen|prank|beauty|make up|tutorial|fun|uya kuya|hypebest|nike|jordan|korea|traveling|blackpink|exo|bts|cover|deddy corbuzier","1273962","42081","1579","1129","https://i.ytimg.com/vi/9Hl44Uxf0-w/default.jpg","False","False","Guys ngeri ngeri sedap guys aku ngeprank call om Deddy#DiRumahAja #SamaSayaBusiness Inquiry /Contact Person Basyid : basyid@creativeindigo.net"
"omF_SNiIDDM","Keluarga ASIX - Selamat Lebaran (Official Music Video)","2020-05-15T12:00:13Z","UCAiCMyCmExPiCU0CxdfIKtg","Hijau Musik","10","20.17.05","Keluarga ASIX|Selamat Lebaran|Official Music Video|Aurel Hermansyah|Ananng Hermansyah|Lagu Terbaru|Arsy Hermansyah|Ashanty|Azriel|Music Terbaru|Menyambut Ramadhan|Ramadhan Ini|The Hermansyah A6","738178","70939","607","9595","https://i.ytimg.com/vi/omF_SNiIDDM/default.jpg","False","False","#KeluargaASIX #SelamatLebaran #HijauMusikHari Kemenangan yang selalu kita nantikan, akhirnya tiba juga. Suasana bulan Ramadan dan Hari Kemenangan di tahun ini sedikit jauh dari yang kita bayangkan.Namun tak mengapa, selagi masih bisa...Rayakan Hari Kemenangan ini dengan penuh sukacita. Tetap tinggal #dirumahsaja dan memaknai apa itu Hari Raya yang sebenarnya.Selamat Lebaran!Selamat Hari Raya Idulfitri 1441 H."
"KBaHktY6dlY","Event Booyah Ramadhan Berlanjut! Dapatkan Magic Cube dan Total Pulsa Hingga 3 Miliar!","2020-05-12T10:04:07Z","UCM3SMB1jINy_NxH1O01z5gA","Garena Free Fire Indonesia","20","20.17.05","[none]","1132245","47602","3029","6858","https://i.ytimg.com/vi/KBaHktY6dlY/default.jpg","False","False","Hi Survivors!Bersiap dan sambut hari kemenangan dengan hadiah premium dari Event Booyah Ramadhan yang akan berlanjut! Event Booyah Ramadhan akan memberikan kamu banyak hadiah yang lebih menarik lagi loh! Dapatkan THR saat lebaran untuk dapat hadiah Magic Cube, Pulsa hingga 3 Milyar, Legend Gun Skin, dan masih banyak lagi! Event akan berlangsung selama tanggal 15 - 24 Mei 2020, dan Peak Day Event pada tanggal 23 Mei 2020.Kumpulkan semua token lebaran seperti Bedug Token, Hari Raya Star Token, Ketupat Token, dan Light Desert Token untuk ditukarkan dengan semua hadiahnya!Pastikan kamu dapat hadiah pulsa hingga total 3 Milyar ya! Mainkan Eventnya di tanggal 15 - 24 Mei 2020!Yuk bersiap untuk menyambut hari kemenangan dan dapatkan semua hadiahnya hanya di Event Booyah Ramadhan Lebaran!#FreeFire #BooyahRamadhan #Lebaran ••••••••••••••••••••••••••••••••••🔥Free Fire Indonesia Official Channel🔥🎟 Official YouTube: http://www.youtube.com/c/GarenaFreeFireIndonesia🎟 Official Instagram: https://www.instagram.com/freefirebgid/🎟 Official Tournament Page: https://www.facebook.com/FFEsports🎟 Official Tik Tok Channel: https://vt.tiktok.com/rqEW4q/"
"qpiweZfefxo","Blak Blakan Pengakuan Saksi Mata Soal Hubungan Syahrini & Kakek Laurens | Intens Investigasi","2020-05-14T06:00:11Z","UCXxHcPruufr4DrgFqLNnGOQ","Intens Investigasi","24","20.17.05","Intens|Investigasi|Intens Investigasi|berita viral|berita terkini|berita terupdate|berita selebriti|selebritis|artis|Gosip|Kakek Laurens|Syahrini|Hubungan|saksi mata|ayah angkat|bapak angkat|fakta","960100","10022","2755","6964","https://i.ytimg.com/vi/qpiweZfefxo/default.jpg","False","False","Intens Investigasi, tayang setiap hari Senin - Jumat pukul 13.00 WIB Nama Syahrini berada di pusaran pemberitaan karena  kicauan seorang pria tua asal Belanda  yang mengaku sebagai ayah angkat Syahrini. Setelah sempat bungkam  akhirnya sekretaris Syahrini angkat bicara dan membongkar kejadian yang sebenarnya antara Syahrini dan  pria tua yang diketahui bernama Laurens. Seperti apa kesaksian Ita,  sekretaris yang ikut dalam liburan ke luar negeri saat  syahrini bertemu kakek Laurens?Saksikan semua di Intens Investigasi! Jangan lupa Subscribe, Like, Share, dan CommentInstagram : https://www.instagram.com/intensindigo/Facebook : https://www.facebook.com/intensinvestigasi/#Syahrini #KakekLaurens"
"3b8kuho5zLY","Karin React to #Awkarin","2020-05-13T10:00:04Z","UCDs47Uey2EitsrMaPxDXXkw","Karin Novilda","22","20.17.05","[none]","1325500","89249","1094","4277","https://i.ytimg.com/vi/3b8kuho5zLY/default.jpg","False","False","Kali ini aku akan cobabikin video reaction terhadap #Awkarin di TikTok. Karna aku ngga pernah main TikTok juga bikin video reaction sebelumnya. Semoga seru dan kalian suka ya!Kira-kira di video selanjutnya kalian mau aku bikin video apa lagi nih? Atau reaction ke video apa lagi nih? Comment dan subscribe ya!Thank you for watching!Love, Karin."
"2W0oDkRwhog","USAHA MEMBATALKAN PUASA","2020-05-15T13:43:18Z","UCgYmNAhjfv5GYWBOfzp831Q","Maell Lee","23","20.17.05","maelle|maellers|bukan|kaleng|gak ada otak kau|kuretakkan|ginjal|kau|video baru maell lee","813176","31945","826","2263","https://i.ytimg.com/vi/2W0oDkRwhog/default.jpg","False","False","Regist Binomo dan dapatkan bonus $1000 di akun demo kamu!: https://fazze.cc/MAELL_LEE_BINOMOGunakan kode promosi DIRUMAHAJA dan dapatkan bonus 100% di akun RIIL kamu!GAK FOLLOW RETAK GINJAL KAU!!!INSTAGRAM @maell_leehttps://www.instagram.com/maell_lee/@rama_djarothttps://www.instagram.com/rama_djarot/@intanratnajuwitaahttps://www.instagram.com/intanratnajuwitaa/BUSINESS INQUIRIESEmail : maelllee.management@gmail.comTelp : 082210013138 (egy) - 0818951886 (robert)"
"nEPegIadPrk","HAREUDANG | DJ KENTRUNG (Nestapa) | KALIA SISKA ft SKA 86","2020-05-15T11:31:51Z","UCX7RJTce2MLIfE4e8QxRl4g","UYE tone","10","20.17.05","kalia siska reggae|ska 86|reggae terbaru|reggae|ska 86 terbaru|uye tone|ukulele|reggae ska|kentrung|hareudang|hareudang cover kentrung|hareudang tiktok|jirolupat tiktok|ji ro lu pat terlena tiktok|dj hareudang|dj nestapa|dj kentrung|dj slow","343810","11990","291","1611","https://i.ytimg.com/vi/nEPegIadPrk/default.jpg","False","False","HAREUDANG | DJ KENTRUNG (Nestapa) | KALIA SISKA ft SKA 86NESTAPA Official by PASUKAN PERANGhttps://www.youtube.com/watch?v=wNjwdxX3roEDukung karya musik original mereka dengan membeli CD atau membeli pada platform musik yang tersedia.Lagu Lagu Cover Kalia Siska Lainnya Ada disini : https://www.youtube.com/playlist?list...Lagu Lagu Cover SKA 86 Lainnya Ada disini : https://www.youtube.com/playlist?list...BAGIKAN/SHARE VIDEO INI SESUKA KALIAN 😊😊❤️❤️#KaliaSiska #Ska86 #HareudangFollow me (Instagram) :@kaliasiska86https://www.instagram.com/kaliasiska86/@skadelapanenamhttps://www.instagram.com/skadelapane..."
"6W8pvqycRfU","Happy Asmara - Ninggal Tatu (Official Music Video ANEKA SAFARI)","2020-05-10T01:00:14Z","UCmB1_agPlXbbwTCPKEuwEKA","Aneka Safari Records","10","20.17.05","aneka|safari|records|aneka safari records|yt:cc=on|safari records|dangdut koplo|ninggal tatu|ninggal tatu dory harsa|didi kempot|ninggal tatu happy asmara|sampun lilo|full album happy asmara|ninggal tatu viral|kowe tak sayang sayang|saiki malah ngilang|perlahan|ojo goblok mencinta|kowe tak sayang sayang saiki malah ngilang|kowe tak sayang sayang meme|kowe tak sayang sayang lucu|kowe tak sayang sayang viral|koe tak sayang sayang|dory harsa|ninggali tatu","1712046","35058","1193","3016","https://i.ytimg.com/vi/6W8pvqycRfU/default.jpg","False","False","Title: Ninggal TatuArtist: Happy AsmaraAlbum: The Best Aneka Safari - Happy AsmaraSongwriter: Kuncung MajasemVisual: @fotosintesis3112Audio: Bayu OnyonkLokasi: BanyuwangiUntuk Terjemahan Bahasa Indonesia ➡ Aktifkan SUBTITLE ..Siapa yang punya kisah serupa seperti isi lagu ini silahkan cerita ambyarkan kolom komentar ..ning ngopo ra cerito yen kowe wes ra tresnoyen kowe malah lungo ninggal tatu ning dodorasane ati iki koyo keno mowobarang wes ngerti ning mburiku kowe ngeliyojanjine ngancani nganti tekane matining nyatane janjimu kuwi mung kari janjipanase geni ra koyo panase atisak uwise ngerti kowe ning aku ngapusikowe tak sayang-sayang saiki malah ngilangtresnamu karo aku kuwi mung kiasankowe tak gadang-gadang tegane gawe liranganggonku labuh kowe opo seh kurang***Yuk Berlangganan Subscribe Channel Youtube kita yang baru : http://bit.ly/anekasafaribts selamat menikmati ..***Available download & streaming on :iTunes ♪ : coming soon .. Spotify ♪ : coming soon .. Deezer ♪ : coming soon .. Buy on Amazon : coming soon .. Unduh Aplikasi Download Resmi Aneka Safari Digital : http://bit.ly/2I9DNep Other Popular Video From Our Artist :Happy Asmara | http://bit.ly/HappyPlayASRNella Kharisma | http://bit.ly/NellaPlayASRJihan Audy | http://bit.ly/JihanAudyPlayASRVita Alvia | http://bit.ly/VitaAlviaPlayASRDenik Armila | http://bit.ly/DenikArmilaPlayASRVia Vallen | http://bit.ly/ViaVallenPlayASRSyahiba Saufa | http://bit.ly/SyahibaPlayASRLutfiana Dewi | http://bit.ly/LutfianaDewiPlayASRNanda Feraro | http://bit.ly/NandaFeraroPlayASRMahesa | http://bit.ly/MahesaPlayASRMala Agatha | http://bit.ly/MalaAgathaPlayASRIkuti Seleksi Artis Nasional ANEKA SAFARI dengan cara upload video kamu di Youtube dan Instagram jangan lupa sertakan mention @safarirecords dan hashtag #AnekaSafariRecords ***Connect with us:Facebook : https://www.facebook.com/anekasafarirecordsTwitter : https://twitter.com/SafariRecordsIDInstagram : https://www.instagram.com/safarirecords/Contact :Tlp. : +6282333038023 ( Admin )Email : info@anekasafari.comWebsite : www.anekasafari.comCopyright © 2020 Aneka Safari Records. All rights reserved.#HappyAsmara#NinggalTatu#Music#AnekaSafariRecords"
"wp2lGXf5Ti0","22 TRIK DAPUR SUPER BERGUNA","2020-05-13T11:00:26Z","UClIYfCAhMAlacxT0e_sl1uA","Kerajinan 5-Menit","26","20.17.05","proyek diy|kerajinan|howto|tutorial|handcraft|tips|5-menit kerajinan|kerajinan 5 menit|trik|hacks hidup|diy|lakukan sendiri|kegiatan diy|sederhana peretasan hidup|hacks kehidupan mudah|hal-hal yang berguna|lifehacks","1877069","15375","1900","770","https://i.ytimg.com/vi/wp2lGXf5Ti0/default.jpg","False","False","RESEP MEMASAK LEZAT DAN TRIK MENGOLAH MAKANAN LEZATKamu tak perlu pandai memasak untuk mengolah makanan lezat, kamu hanya butuh beberapa alat dan kreatifitas. Jadi, hari ini akan ku tunjukkan cara mengolah makanan lezat dari bahan sederhana dengan instruksi dariku.Agar telur goreng lebih lembut, kocok putih telur saat menggoreng.Lihat juga cara membuat keripik lezat menggunakan kulit lumpia. Potong kecil-kecil, goreng, kemudian taburi garam, lada, paprika, dan rempah apapun yang kamu suka.Pelajari cara membuat brownies menggunakan microwave dengan menuang adonan ke dalam kantong kertas lalu memanggangnya di dalam microwave.Kamu juga bisa memanggang sarapan lezat di dalam oven dengan memasukkan potongan roti ke dalam cetakan kue mangkuk, menambahkan keju, lalu memanggangnya. Kamu juga bisa menambahkan beberapa jenis sayuran dan bumbu tradisional.Tonton hingga selesai dan temukan cara membuat makanan lezat menggunakan mesin pemanggang wafelPenanda waktu:0:36 - Cara membentuk pasta1:08 - Belajar makan menggunakan sumpit2:55 - Trik lezat seputar dapur4:32 - Makanan lezat yang bisa dibuat menggunakan pemanggang wafel7:13 - DIY kue wafel9:11 - Burger raksasa11:09 - DIY oreo raksasa13:29 - DIY nuggest ayam raksasaVideo ini dibuat untuk tujuan hiburan. Kami tidak membuat jaminan mengenai kelengkapan, keamanan, dan keandalan. Setiap tindakan yang Anda ambil berdasarkan informasi pada video ini sepenuhnya menjadi risiko Anda sendiri, dan kami tidak akan bertanggung jawab atas kerusakan atau kerugian apa pun. Menjadi tanggung jawab penonton agar bertindak penuh pertimbangan, kewaspadaan, dan kehati-hatian apabila Anda berencana meniru.Video berikut ini mungkin menampilkan kegiatan yang dilakukan oleh aktor kami dalam lingkungan yang terkendali – harap bertindak penuh pertimbangan, kewaspadaan, dan kehati-hatian apabila Anda hendak meniru.---------------------------------------------------------------------------Berlangganan Kerajinan 5-Menit: https://bit.ly/2Qnqq0zSisi Terang: https://bit.ly/2Nm9iGt123 GO! Indonesian: https://bit.ly/2Qq5iGV123 GO! Challenge Indonesian: https://bit.ly/37ePHQi Sosial Media Kami:Facebook: https://www.facebook.com/Kerajinan-5-Menit-546460062546004/---------------------------------------------------------------------------Musik oleh Epidemic Sound: ​​​​​​​https://www.epidemicsound.com/Materi stok (foto, rekaman, dan lain-lain): https://www.depositphotos.com"
"k8gx-C7GCGU","DAY6 Zombie M/V","2020-05-11T08:59:52Z","UCaO6TYtlC8U5ttz62hTrZgg","jypentertainment","10","20.17.05","JYP Entertainmnet|DAY6|데이식스|DAY6 Jae|DAY6 Young K|DAY6 Sungjin|DAY6 Wonpil|DAY6 Dowoon|DAY6 제이|DAY6 영케이|DAY6 성진|DAY6 원필|DAY6 도운|데이식스 Jae|데이식스 Young K|데이식스 제이|데이식스 영케이|데이식스 성진|데이식스 원필|데이식스 도운|Jae|Young K|Sungjin|Wonpil|Dowoon|제이|영케이|성진|원필|도운|The Book of Us|DAY6 The Book of Us|DAY6 The Book of Us The Demon|DAY6 Zombie MV|데이식스 Zombie 뮤비|The Book of Us The Demon|DAY6 Zombie|DAY6 Zombie Music Video|데이식스 뮤비|DAY6 MV","4897267","669932","2992","60984","https://i.ytimg.com/vi/k8gx-C7GCGU/default.jpg","False","False","DAY6 Zombie M/VListen to DAY6 The Book of Us : The Demon iTunes & Apple Music : https://apple.co/2YR7QCfSpotify : https://spoti.fi/2YR5OSDDAY6 Official YouTube: http://www.youtube.com/c/DAY6OfficialDAY6 Official Facebook: http://www.facebook.com/DAY6OfficialDAY6 Official Twitter: http://www.twitter.com/DAY6OfficialDAY6 Official Fan's: http://fans.jype.com/DAY6DAY6 Official Homepage: http://DAY6.jype.comCopyrights 2020 ⓒ JYP Entertainment. All Rights Reserved."
"XP-J9m-6qpA","LAURENS Tepati Janji Sebar V1de0 Mesraa Dgn SYAHRINI, REINO BARACK Langsung Muram, Murkaa!","2020-05-12T07:19:15Z","UCgvLPvKfnaAMieuItiY0FKw","Azec Fote","24","20.17.05","[none]","1459917","8644","1553","3352","https://i.ytimg.com/vi/XP-J9m-6qpA/default.jpg","False","False","Laurens tepati jani unggah video mesra bersama Syahrini istri Reino Barack yang dulu pernah menjalin asmara dengan Luna Maya teman Raffi Ahmad Nagita Slavina, Ayu Dewi, Bunga Citra Lestari, Melaney Ricardo, Nia Ramadhani, Olla Ramlan. Kali ini, reaksi suami Inces, Reino Barack jadi sorotan karena terlihat muram. Apakah Reino murka? Dalam v1de0, Syahrini tampak sumringah bersandar di pundak Laurens. Adik Syahrini, Aisyahrani, juga terlihat ikut di sesi dinner tersebut.Simak selengkapnya di Azec Fote! _______________________________________________________________Thanks for support us_______________________________________________________________Copyright Disclaimer - Under section 107 of the Copyright Act of 1976- Every Video, Audio, Footage, Image etc in this content under terms of Fair Use, Permitted by Copyright Statute.- Every Content in this Channel for purpose such as Education, News Report, interpretation etc."
"4sRh0lO4224","Cerita Kuntilanak Gunung Gede","2020-05-14T13:13:23Z","UCnrlTmgYcvQLa-m02kLf8gQ","Dzawin Nur","22","20.17.05","[none]","554067","44747","678","6551","https://i.ytimg.com/vi/4sRh0lO4224/default.jpg","False","False","deskripsi"
