video_id,title,publishedAt,channelId,channelTitle,categoryId,trending_date,tags,view_count,likes,dislikes,comment_count,thumbnail_link,comments_disabled,ratings_disabled,description
"KY76wSWgmFo","Happy Asmara - Pamit golek tresno liyo [OFFICIAL]","2020-05-14T05:00:12Z","UCkKwFOqr6CTEwO3frYn7wiQ","DSA RECORD","10","20.17.05","happy salah|happy asmara trending|nella kharisma|nella kharisma official|music yess|dsa record|ambyar|sobat ambyar|didi kempot|pashati|happy asmara terbaru|Danendra Suara Abadi|aku pamit","118798","2540","65","284","https://i.ytimg.com/vi/KY76wSWgmFo/default.jpg","False","False","Happy asmara - Pamit golek tresno liyo [OFFICIAL]Aku PamitVoc. Happy AsmaraCipt. Antok Ilham wAlbum : Happy asmaraProduksi : Dsa RecordInstagram :https://www.instagram.com/dsa_recordklik untuk subscribe :https://www.youtube.com/channel/UCkKwFOqr6CTEwO3frYn7wiQ?sub_confirmation=1klik link di bawah ini untuk mononton video lainnya :Happy asmara - Yang maha mengabulkan [OFFICIAL]https://www.youtube.com/watch?v=Sm4Zzh4LrJ8Happy asmara - Tatu Dj remix[OFFICIAL]https://www.youtube.com/watch?v=RBGBfHvBe0sHappy asmara - Dinggo bukti [OFFICIAL]https://www.youtube.com/watch?v=f07Kw0Om7HIHappy asmara - Nyerang es teh [OFFICIAL]https://www.youtube.com/watch?v=bsc5ZNx3FokHappy asmara - Penipu alus [OFFICIAL]https://www.youtube.com/watch?v=C5BlFSkuMUkHappy asmara - Tatu [OFFICIAL AUDIO]https://www.youtube.com/watch?v=5Cxtovlm_xYHappy asmara - Aku tenang [OFFICIAL]https://www.youtube.com/watch?v=MVF_U0-8dKsHappy asmara - Rela demi cinta [OFFICIAL]https://www.youtube.com/watch?v=5F61m4HRetEHappy asmara - Yakinlah sayang [OFFICIAL]https://www.youtube.com/watch?v=_xyTdekFcksHappy asmara - Nembung Katresnan [OFFICIAL]https://www.youtube.com/watch?v=WLrfXwok2REHappy asmara - Konco Uripku [OFFICIAL]https://www.youtube.com/watch?v=oe3zzDHCrtgHappy Asmara - Welas hang ring kene [OFFICIAL]https://www.youtube.com/watch?v=dlc9kqF6jbINella Kharisma - Ora dolan [OFFICIAL]https://www.youtube.com/watch?v=220dWP-y6TUNella Kharisma - Di rabi mantan [OFFICIAL]https://www.youtube.com/watch?v=F-Tw4IhbgJoNella kharisma - Mendem cinta [OFFICIAL]https://www.youtube.com/watch?v=nRHhzwJlCUINella kharisma - Sayangen aku [OFFICIAL]https://www.youtube.com/watch?v=d_WMuLCVCSk#Akupamit #Happyasmara #DsarecordYouTube channel managed by MusicYes Digital DistributionFully YouTube CertifiedJoin MusicYeshttps://musicyess.com/Account/Register"
"HFvrURKcXYE","SABYAN - YA NABI SALAM ALAYKA | COVER","2020-05-07T02:15:12Z","UCeZA77FZSG4YzBcvBJ9eynA","SABYAN","10","20.17.05","Nissa sabyan|sabyan gambus|ya nabi salam alayka sabyan|nisa sabyan|lagu baru sabyan|sabyan manggung|vlog sabyan|sabyan live|sabyan konser|konser sabyan|ya nabi maher zein|sabyan ya nabi|sabyan lagu corona|ya maulana|tasmauni rabbah|album sabyan|sabyan terbaru|sabyan gambus full album|sabyan karaoke|nissa sabyan terbaru|sabyan cover","798253","64538","463","10407","https://i.ytimg.com/vi/HFvrURKcXYE/default.jpg","False","False","Assalamualaikum wr. wb.Alhamdulillah hari ini Sabyan upload video cover lagu yang berjudul Ya Nabi Salam alaykaTerima kasih banyak terus mendukung Sabyan sampai hari ini.Wassalamualaikum wr. wb.Original Song :Maher Zain - Ya Nabi Salam Alaykahttps://youtu.be/Vqfy4ScRXFQFollow instagram Sabyan Gambushttps://www.instagram.com/sabyan_gambus/Sabyan :Vocal : NissaKeyboard : AyusPerkusi : KamalMusic producer : Ayus & Yeru @yu_yeruMixing & Mastering : My productionMusic performed by : SabyanAdditional musician : Langen dumadiVideo by Sabyan Multimedia!DOP : Fandi @fandy_1288Editor Video : Dawan @dawanrzkDukung kami selalu dengan like, koment, dan subscribe terima kasihUntuk pertanyaan bisnis silahkan hubungi :☎ 021-22321217Manager : 081284950528"
"fJHu9ebxShU","Trai trẻ bị quý bà U50 luộc sạch | Trích phim Vòng Tròn 12 số","2020-05-05T07:35:14Z","UCEYSeei1C8-uKXbRSVR8CsQ","Golden Network Official","24","20.17.05","phim hay viet nam|Phim VIệt|Phim bộ Việt|Phim VIet|Phim tâm lý xã hội|tâm lý xã hội|phim truyền hình|phim hay Viet Nam|phim viet nam|phim việt nam|phim viet nam hay 2020|phim viet nam 2020|phim hay|phim vn|phim viet nam 2020 chieu rap|tieng set trong mua|lý hải|vòng tròn 12 số|vong tron 12 so|chí tài|kim xuân|phim vong tron 12 so|phim hay nhất 2020|phim viet nam hanh dong hay nhat|thu trang|vong tron|cuộc chiến mẹ chồng nàng dâu","4020631","8259","3801","0","https://i.ytimg.com/vi/fJHu9ebxShU/default.jpg","True","False","Vòng Tròn 12 Số  | Chí Tài, Kim Xuân, ca sỹ Lý Hải | Phim Tâm Lý Xã Hội Việt Nam-------------Các diễn viên: Chí Tài, Kim Xuân, Quách Ngọc Ngoan, ca sỹ Lý Hải, Hoàng Thiên Long, Triệu Tú TrâmPhim Vòng Tròn 12 Số xoay quanh cuộc sống gia đình bà Huệ cả hai vợ chồng vì sống một cuộc sống không hòa thuận cho nên đã chọn cách âm thầm ly dị để giải thoát cho nhau. Các tập tiếp theo của bộ phim khán giả sẽ được thấy thêm một nhân vật đặc biệt được chồng bà Huê ủy thác cho bà để nuôi nấng, anh chàng này tên là Thép mồ côi cha mẹ từ nhỏ lang thang đầu đường có chợ từ nhỏ sống lang bạt cùng với những nhóm giang hồ, rất được đàn em kính nể, và trong một lần anh đã cứu chồng bà Huệ thoát chết và vì muốn trả ơn nên đã cưu mang Thép về với gia đình mình. Với ngoại hình điển trai cao ráo phong trần cùng với tính cách nghĩa hiệp Thép sẽ là nhân vật tạo nhiều thiện cảm đến cho khán giả.-----XEM TRỌN BỘ PHIM HAY VIỆT NAM 2020► TRỌN BỘ PHIM HOA HỒNG KHÔNG DÀNH CHO EM: http://bit.ly/HoaHongKhongDanhChoEm► TRỌN BỘ PHIM CUỘC CHIẾN QUÝ ÔNG: http://bit.ly/CuocChienQuyOng► TRỌN BỘ PHIM VÒNG TRÒN 12 SỐ: http://bit.ly/VongTron12So﻿►TRỌN BỘ PHIM KẺ DỐI TRÁ CHÂN TÌNH: http://bit.ly/KeDoiTraChanTinh----- KÊNH PHIM CHÍNH THỨC CỦA GOLDEN NETWORK ẤN SUBSCRIBE NGAY ĐỂ THEO DÕI VIDEO MỚI NHẤT!► Subscribe: http://bit.ly/3aFkHKg► Fanpage: https://www.facebook.com/goldennetworkgroup/© 2020 By Song Vang Production- - - - - - - - - - - - - - - - - - - - - - - - - - - KÊNH PHIM HOẠT HÌNH TRẺ EM, ẤN SUBSCRIBE NGAY ĐỂ THEO DÕI VIDEO MỚI NHẤT!► Subscribe: http://bit.ly/2TAixG5© 2020 By Song Vang Production#Vongtron12so #PhimhayVietNam #phimvn #phimvietnam"
"xdaXGubq9g8","REVIEW DULU SEBELUM DI POTONG-POTONG!!!","2020-05-15T09:14:03Z","UCEkZmgbjV8iVXqDTl7ynw0g","arie perkasa","2","20.17.05","YAMAHA|Yzf-R1|1000cc|4cilinder|Custom|Modifikasi|SAC|Arieperkasa","183647","3255","148","338","https://i.ytimg.com/vi/xdaXGubq9g8/default.jpg","False","False","Review Motor Yamaha YZF-R1, Kira-kira mau dijadiin apa ya??......SUBSCRIBE terus, agar Gagal Kustom Season 2 bisa kita mulai...  ..Video Baru Street Arts Custom Selalu Tayang di Hari SELASA-KAMIS-SABTU loh.......follow instagram sac :https://www.instagram.com/sac_motorcyclesac product :https://www.instagram.com/sac_productsac apparel :https://www.instagram.com/sac_trendsac painting :https://www.instagram.com/sac_paintingsac dewata :https://www.instagram.com/sac.dewatamy personal ig :https://www.instagram.com/korekarie"
"-XC3Dr9m85E","SUCI 4 - PECAH! Stand Up Comedy Dodit Mulyanto: Lingsir Wengi versi Dodit sampai Musik Kaki Lima","2020-05-13T09:02:49Z","UC8zZ084em5pohjs6kk2Bpaw","Stand Up Kompas TV","24","20.17.05","suci 4|stand up comedy|stand up|dodit mulyanto|stand up comedy indonesia|suci kompas tv|stand up kompas tv","978739","15808","409","579","https://i.ytimg.com/vi/-XC3Dr9m85E/default.jpg","False","False","Dodit Wahyudi Mulyanto atau lebih dikenal dengan Dodit merupakan kontestan dari Stand Up Comedy Indonesia (SUCI) 4. Ciri khas yang paling mudah diingat dalam penampilan Dodit saat di panggung adalah pembawaannya yang kalem dan membawa biola, meski kadang tidak dimainkan.---------------------------------------------------------------------------------------------------SUCI 9 akan kembali lagi untuk menemani para pecinta setia Stand Up Comedy Indonesia, setelah vakum selama 1 tahun.Sambil menunggu hadirnya SUCI 9 di layar kaca, tim KompasTV akan menampilkan kembali video-video yang menarik sekaligus mengundang tawa para penonton Stand Up Comedy.SUCI akan bernostalgia melalui tayangan video dari SUCI 1 sampai SUCI 8.Tentunya dengan penampilan dari komika-komika ternama, yang pada waktu itu sedang merintis karier mereka.Untuk para pecinta SUCI yang mau request upload, silakan tinggalkan komen di bawah ya.Follow Stand Up Comedy KompasTV di Instagram: @sucikompastv untuk tahu informasi-informasi terupdate Stand Up Comedy Kompas TV, termasuk jadwal audisi.#DoditMulyanto #SUCI4 #Dodit"
"nVhpfQHEnyE","FILM KOMEDI BULAN RAMADAN (FAUZI ZAIN) PENYESALAN MAS JIJEN MOKEL","2020-05-15T09:57:16Z","UCFa507_wyJw8zagjGmCIhrg","Fauzi zain","23","20.17.05","fauzi zain|mas jijen|mas jijen nelongso|fauzi zain akhir dari sebuah cerita preman|fauzi zain penyesalan|ashar nesu nesu|mas jijen konangan mokel|fauzi zain ditaleni ashar|zidan fauzi zain|dek ashar|korban janji|komedi lucu bulan puasa|prank fauzi zain|ashar prank fauzi zain|pemuda kampung|vlog fauzi zain","87137","4548","66","413","https://i.ytimg.com/vi/nVhpfQHEnyE/default.jpg","False","False","oke bro maaf akhir ini jarang UP video baru , dan semoga video ini menghibur kalian ...•follow INSTAGRAM saya : @_ fauzizainhttp://www.instagram.com/_fauzizain•follow account ke-2 INSTAGRAM:@_mas.jijenhttps://www.instagram.com/_mas.jijen/• FACEBOOK : Fauzi Zainhttps://m.me/yt.fauzizain• jangan lupa SUBSCRIBE channel saya ya : http://www.youtube.com/c/Fauzizain• bussines // W.A : 085852113991• MOHON MAAF KALAU ADA TUTUR KATA KAMI YANG KURANG BERKENAN KAMI MOHON MAAF#fauzizain#ashar#bulanpuasa• JANGAN LUPA LIKE KOMEN & SUBSCRIBE YA , DAN BAGIKAN KETEMAN TEMAN KALIAN ...• TERIMAKASI"
"av2N1O0J39w","ตกลงฉันคิดไปเองใช่ไหม Ost.เพราะเราคู่กัน 2gether The Series - ไบร์ท วชิรวิชญ์","2020-05-15T16:00:05Z","UC_mceLIVkQun_Xcu1KBmfdw","GMMTV RECORDS","10","20.17.05","GMMTV|GMMTV RECORDS|GMMTVRECORDS|gmmtvrecord|gmmtvrecords|คั่นกู|ไบร์ท วชิรวิชญ์|เพราะเราคู่กัน 2gether The Series|2gether The Series|วิน เมธวิน|ไบร์ท วิน|สารวัตร|ไทน์ สารวัตร","1696243","233103","1014","13314","https://i.ytimg.com/vi/av2N1O0J39w/default.jpg","False","False","เพลง ตกลงฉันคิดไปเองใช่ไหม (เพลงประกอบซีรีส์ เพราะเราคู่กัน 2gether The Series)นักร้อง ไบร์ท วชิรวิชญ์เนื้อร้อง / ทำนอง : อัจฉริยา ดุลยไพบูลย์เรียบเรียง : ชลทัศน์ ชาญศิริเจริญกุลExecutive Producer : อัจฉริยา ดุลยไพบูลย์Producer : อัจฉริยา ดุลยไพบูลย์ , ชลทัศน์ ชาญศิริเจริญกุลGuide / Background Vocals :  อัจฉริยา ดุลยไพบูลย์Vocal Director :  อัจฉริยา ดุลยไพบูลย์ , ชลทัศน์ ชาญศิริเจริญกุลAudio / Digital Editor : ชลทัศน์ ชาญศิริเจริญกุลMix - Mastering : ระวี กังสนารักษ์ Digital Download *1232323Spotify | iTunes | JOOX มันคงจะธรรมดา ที่เธอนั้นทำดีกับใครไม่ใช่ว่าฉันเป็นคนสำคัญมันคงตลกใช่ไหมที่ฉันคิดไปไกลอย่างนั้นเธอคงรำคาญฉันมากใช่ไหม ขอโทษเธอจริงๆถ้าฉันเข้าใจผิดไปถามเธอแค่คำเดียว ช่วยตอบมาได้ไหม ตกลงฉันคิดไปเองใช่ไหมผิดที่ฉันคนเดียวใช่ไหมที่เก็บเอาไปคิดว่าเรารักกันตกลงฉันคิดไปเองใช่ไหมบอกกับฉันคำเดียวฉันพร้อมเข้าใจแค่บอกว่าเธอไม่เคยรักกัน มันอาจเป็นความบังเอิญที่เธอนั้นไม่ได้ตั้งใจแต่มันดูเหมือนให้ความสำคัญมันอาจเป็นบางเวลาที่เธอเผลอเข้ามาใกล้กันแต่ทำให้ฉันคิดไปมากมาย ขอโทษเธอจริงๆถ้าฉันเข้าใจผิดไปถามเธอแค่คำเดียว ช่วยตอบมาได้ไหม ตกลงฉันคิดไปเองใช่ไหมผิดที่ฉันคนเดียวใช่ไหมที่เก็บเอาไปคิดว่าเรารักกันตกลงฉันคิดไปเองใช่ไหมบอกกับฉันคำเดียวฉันพร้อมเข้าใจแค่บอกว่าเธอไม่เคยรักกัน ตกลงฉันคิดไปเองใช่ไหมผิดที่ฉันคนเดียวใช่ไหมที่เก็บเอาไปคิดว่าเรารักกันตกลงฉันคิดไปเองใช่ไหมบอกกับฉันคำเดียวฉันพร้อมเข้าใจแค่บอกว่าเธอไม่เคยรักกัน เพราะเราคู่กัน 2gether The Series [Official Trailer]https://www.youtube.com/watch?v=6OQl08Weel4ติดตามซีรีส์ ซีรีส์เพราะเราคู่กัน 2gether The Seriesทุกวันศุกร์เวลา 21.30 น. ทางช่อง GMM25 | 22.30 น. บน LINE TV#คั่นกู #2gethertheseries #GMMTV #GMMTVRECORDS #GMMGRAMMY"
"PRBbq_uhOME","DI JAMIN MENANG BANYAK - AWEWE SUNDA | FIKSI","2020-05-12T08:30:04Z","UC2GTptoFm8KeEMII4XtTIXA","FIKSI","23","20.17.05","Fiksi aunurofik|fiksi|tutorial|mang dana|sunda|urang sunda|bahasa sunda|orang sunda|youtuber sunda|kamus sunda|belajar bahasa sunda|film pendek sunda|bodor sunda|bobodoran|komedi|lucu|ngakak|humor|fiksi sunda|pantun sunda|si kakang|youtuber bandung|film sunda|adik kakak lieur|SUNDA UNIK|nama orang sunda|ramadhan|ciri khas orang sunda|KOMEDI INDONESIA|cewek sunda|geulis|menang banyak|mojang bandung|generasi125|menang banyak nih|yamaha|yamaha jabar","189953","11249","121","4314","https://i.ytimg.com/vi/PRBbq_uhOME/default.jpg","False","False","DI JAMIN MENANG BANYAK POPOKNAcoba tulis menang banyak versi kalian di komentar...semoga terhibur...FOR BUSINESS : violla.minory@gmail.cominstagram : @fiksiaunurofikhttps://www.instagram.com/fiksiaunurofik/?hl=idinframe :GIRI EGGIhttps://www.youtube.com/user/mistergodahttps://www.instagram.com/girieggi/DELISAhttps://www.instagram.com/delisaherlina_/?hl=idDEALEXYhttps://www.instagram.com/dealexyramona/?hl=idDEKIhttps://www.instagram.com/deki.muhammadfr/ HUSEIN NASIMOVhttps://www.youtube.com/channel/UCaHhpa--zSRk_6vWhVaXI2A-DUGDUGhttps://www.instagram.com/_dugspeed/- PANJI https://www.instagram.com/zivan05/ORDER BAJU URANG SUNDADISINIhttp://Shopee.co.id/budaksunda.merchhttps://www.instagram.com/budaksunda.merch/?hl=idSELAIN AKUN INSTAGRAM DAN SHOPEE BUDAKSUNDAMERCH DI JAMIN PALSUSALAM SUNDA SAMPURASUN...#fiksi #urangsunda #menangbanyak"
"x2ZMuPgy2Y0","Eitaro ft YoungLex - Air Mata Dunia ( Official Video lyrics )","2020-05-12T10:00:14Z","UC6YIMDrkBI8qaTuvIvcuZgA","Eitaro Nonaka","10","20.17.05","eitaro|younglex|airmatadunia|eitaro nonaka|hiphop|hiphopindo","193592","13150","459","1074","https://i.ytimg.com/vi/x2ZMuPgy2Y0/default.jpg","False","False","Official lyrics video of Air Mata DuniaLyrics by Eitaro Produced by @indoskullboyEditor By DodialfayedDirected By Eky Mekyrecording Mas Rendra bapaknya keenan#eitaro #younglex #airmatadunia"
"K2eniw7wm8k","Didi Kempot feat. Happy Asmara - Ati Dudu Wesi (Official Video Lyric)","2020-05-06T03:10:43Z","UCWj3Uo_9kPMJp3HHANYjNzQ","SKI Records","10","20.17.05","ski records|lagu dangdut terbaru|dangdut modern|full album|dangdut full album|SKI Records|Didi Kempot|Yuni Shara|Lyric Video|Full Album Didi Kempot|Video Didi Kempot|Dangdut|Music Of Indonesia|Full Album|Happy Asmara","938897","14573","359","974","https://i.ytimg.com/vi/K2eniw7wm8k/default.jpg","False","False","Artis    : Didi Kempot feat. Happy AsmaraTitle     : Ati Dudu WesiCipt      : Gendru NugrahaLabel   : SKI Records----------------------------------------------------------------------------------------------------------------------------------------------Jelang akhir hayatnya, Didi Kempot terus aktif membuat karya. Satu bulan terakhir, Didi membuat dua lagu bersama SKI Records yang bertajuk Kapusan Janji dan Ati Dudu Wesi.Produser SKI Records, Achmad Yusuf, mengungkapkan, dua lagu tersebut sebenarnya belum hendak rilis dalam waktu dekat. Sebab, proses penggarapan video klip masih terkendala pandemi COVID-19.-------------------------------------------------------------------------------1.Didi Kempot feat. Yuni Shara - Kapusan Janji : https://www.youtube.com/watch?v=9MUh3SYzG5Q2.Didi Kempot feat. Happy Asmara - Ati Dudu Wesi : https://www.youtube.com/watch?v=K2eniw7wm8k3.Didi Kempot - Stasiun Balapan : https://www.youtube.com/watch?v=fcDSgupZQ2E4.Didi Kempot - Jambu Alas : https://www.youtube.com/watch?v=Sx38jFc_NNM5.Didi Kempot - Cucak Rowo : https://www.youtube.com/watch?v=6yJIJ-usTtg6.Didi Kempot - Cidro : https://www.youtube.com/watch?v=_sa4fJB4Cpw7.Didi Kempot feat. Dewi Anjar Angin-Angin - Keong Sawah  : https://www.youtube.com/watch?v=k-shq14ci3w8.Didi Kempot - Buto Terong : https://www.youtube.com/watch?v=g4Y6-skK9Do9.Didi Kempot - Sekonyong Konyong Koder : https://www.youtube.com/watch?v=uYwfyF1Vzos10.Didi Kempot - Tanjung Mas Ninggal Janji : https://www.youtube.com/watch?v=jyMeogZDrv811.Didi Kempot - Sewu Kutho : https://www.youtube.com/watch?v=zu5JmDj5SKE12.Didi Kempot - Parangtritis  : https://www.youtube.com/watch?v=WnfLYN1lqtc&list=PLdm4rq0qRTC51apcf1dOsmuGlAJEN4DAF&index=11&t=0s13.Didi Kempot - Pingin Ngombe : https://www.youtube.com/watch?v=AoCGh0xqIYc&list=PLdm4rq0qRTC51apcf1dOsmuGlAJEN4DAF&index=14&t=0s14.Didi Kempot - Ojo Sujono : https://www.youtube.com/watch?v=yIIR4az3gjg&list=PLdm4rq0qRTC51apcf1dOsmuGlAJEN4DAF&index=15&t=0s15.Didi Kempot - Kuncung : https://www.youtube.com/watch?v=-fADMq8XPKY&list=PLdm4rq0qRTC51apcf1dOsmuGlAJEN4DAF&index=16&t=0s16.Didi Kempot - Terminal Tirtonadi : https://www.youtube.com/watch?v=Uc7dXXpT6cE&list=PLdm4rq0qRTC51apcf1dOsmuGlAJEN4DAF&index=17&t=0sCopyright©SKI Records All rights reserved"
"9homnIHarps","The Best Of Capital's Summertime Ball with Barclaycard | Capital","2020-05-16T18:10:11Z","UCZzwjZPc6R_PbnDgFVMwlvQ","Capital FM","10","20.17.05","capital summertime ball|capitals summertime ball|capital fm summertime ball|capital fm|summertime ball|capitalstb|best of capital's summertime ball|bestofcapitalstb|one direction capital summertime ball|ariana grande live|one direction live|shawn mendes live|camila cabello live|capital fm radio|justin bieber live|little mix live|little mix capital summertime ball|capital fm stb|calvin harris live|david guetta live|jonas brothers live|busted live|psy live","419718","23568","267","1090","https://i.ytimg.com/vi/9homnIHarps/default.jpg","False","False","Enjoy Capital's Summertime Ball with Barclaycard from your sofa! Roman Kemp, Sonny Jay, Sian Welby and Jimmy Hill celebrate 11 years of the UK's Biggest Summer Party, reliving the most iconic performances from the world's biggest artists in this two-hour live show:- Anne-Marie- Ariana Grande- Bruno Mars- Calvin Harris- Camila Cabello- Coldplay- David Guetta- Ed Sheeran- Jax Jones- Jess Glynne- Jonas Brothers- Justin Bieber- Katy Perry- Little Mix- One Direction- Pharrell Williams- PSY- Robbie Williams- Rita Ora- Shawn Mendes- Stormzy- TinieSubscribe: http://bit.ly/SubscribeToCapitalFMGet involved with the UK's No. 1 Hit Music Station!Capital’s Jingle Bell Ball 2019: https://capitalfm.co/JBB19VideosChats With The Stars: https://capitalfm.co/InterviewsQuizface: https://capitalfm.co/QFFinish the Lyric: https://capitalfm.co/FTLyricFollow us!Website: http://www.capitalfm.comInstagram: http://www.instagram.com/CapitalOfficialFacebook: http://www.facebook.com/CapitalFMTwitter: http://twitter.com/CapitalOfficialTikTok: https://www.tiktok.com/@capitalofficialWelcome to the official YouTube channel for the UK's No.1 Hit Music Station. Make sure you subscribe to get all your updates on your favourite celebrities, giveaways and live music sessions from the biggest artists in the world!Subscribe: http://capitalfm.co/Subscribe"
"YoTQsnSiKXE","🔥 5 BARANG UNIK BERFAEDAH BIKIN HERAN","2020-05-12T09:15:00Z","UC4kX-3qbf9bru_PSmxBF_xg","okkyjem","24","20.17.05","5 barang unik berfaedah|okkyjem|alat unik berfaedah|aneh tapi nyata|unik dan keren|ide kreatif|video unik|alat unik|terbaru|unik|kreatif|indonesia|unik dan lucu|unik berfaedah|keren|ane","266527","34139","1902","2361","https://i.ytimg.com/vi/YoTQsnSiKXE/default.jpg","False","False","Belanja Hemat disini http://tkp.me/serbaserbuokkyjemBeli barangnya murah di sini:1. Gelas Portable  ► https://t.productlink.io/b614q8 Rp.11.0002.  Fidget Toy Desktop  ►   Rp.57.0003.  Penghapus Tinta Pena  ► Rp.13.0004.  Alat Pijat Digital  Versi Baru ► https://t.productlink.io/b614qk Rp.68.0005. Headset AirPods Raksasa  ►  Rp228.000•••••••••••••••••••••••••••••••••••••••••••••••••••••••Business inquiries: okkyjem@gmail.com•••••••••••••••••••••••••••••••••••••••••••••••••••••••Bantu okkyjem mencapai 2.000.000 subscribersSubscribe ► https://www.youtube.com/channel/UC4kX-3qbf9bru_PSmxBF_xg?sub_confirmation=1Follow Instagram ► https://www.instagram.com/okkyjem"
"j3o6RLBehlc","REAL VS CHOCOLATE FOOD CHALLENGE || Last To STOP Eating Wins! Taste Test by 123 GO! CHALLENGE","2020-05-15T14:00:28Z","UC_O-vmjpkom1m5shISID94g","123 GO! CHALLENGE","22","20.17.05","challenge|challenges|prank|pranks|fun|funny|123 go|123go|DIY|123 go challenge|123go challenge","2999553","35314","4013","2273","https://i.ytimg.com/vi/j3o6RLBehlc/default.jpg","False","False","Attention all chocoholics!Looks like we’ve got a new challenge on our hands!One of these mystery plates has a chocolate treat and the other, well, you’ll see :)Let’s put your love for the chocolate to the test with this delicious chocolate challenge!!Be sure to share this challenge with your fellow chocolate lovers! And don’t forget to subscribe to 123 GO! CHALLENGE’s YouTube page so you never miss out on our awesome content!#123GO #chocolatevsreal #foodchallenge Music by Epidemic Sound: https://www.epidemicsound.com/Stock materials:https://www.depositphotos.comhttps://www.shutterstock.comhttps://elements.envato.com"
"Hw5CzhLOB4I","GUE YAKIN KALIAN GABISA TAHAN JUGA !! - Try Not to Beatbox,Sing,And Dance","2020-05-15T09:30:05Z","UCchxBID9GsRoKShuUFkEdBw","Ewok","24","20.17.05","Ewok|beatbox|ewok beatbox|indonesia beatbox|swissbeatbox|berywam beatbox|france beatbox|mb14|tyr not to beatbox|susah|alig|hard beatbox|beatbox drop|tomazacre beatbox|soso beatbox","74439","3228","108","419","https://i.ytimg.com/vi/Hw5CzhLOB4I/default.jpg","False","False","susah banget asli buat nahan euy gabisa gue mah begini !!original video : https://www.youtube.com/channel/UC0TTMkUHfneyKHP7yPdq4bASubscribe Channel QorryWok : https://www.youtube.com/channel/UCa72B6p9w_K3lqc9-WShl6gWebsite : http://ewokbeatbox.com/Merch Ahay : https://www.instagram.com/ahay323/?hl=idSocial Media:Instagram - https://www.instagram.com/ryanandhara/?hl=idTwitter - @ryanandharaFacebook - http://facebook.com/ahaywokemail - ewokbeatbox@gmail.com"
"cXp7-YQD8VE","SETAN TAUBAT Eps 12 - RAHASIA YUSUF TERBONGKAR","2020-05-14T09:00:15Z","UC4tS4Q_Cno5JVcIUXxQOOpA","Ricis Official","24","20.17.05","riaricis|squishy|mainan|hijab|vlog|slime|lol|lolsurprise|funny|ngakak|kocak|lucu|viral|trending|indonesia|daily|rumah|ricis","1097595","107970","595","4878","https://i.ytimg.com/vi/cXp7-YQD8VE/default.jpg","False","False","TRAILER https://youtu.be/XNJ0Jnfv0nsEPS 1 https://youtu.be/ggMA9fuiv7keps 2 https://youtu.be/d7lTrncT7qoeps 3 https://youtu.be/MfAaSUO9hN8eps 4 https://youtu.be/z4assS6l7hQeps 5 https://youtu.be/lH_31diYz0Meps 6 https://youtu.be/DMbKsDHfvxweps 7 https://youtu.be/OgbibPzPgtYeps 8 https://youtu.be/owx543FOnWUeps 9 https://youtu.be/AZAHvZTArpMeps 10 https://youtu.be/Tbi9sdVnOAseps 11 https://youtu.be/aGrZOqoAYU0Contact business : ricismanagement@gmail.comSubscribe RUMAH RICIShttps://www.youtube.com/channel/UCNrN1jrDHKE4lCD-BKa9pog@riaricis1795https://www.instagram.com/riaricis1795@rumah.ricishttps://www.instagram.com/rumah.ricisHIJAB BY @ricisbykhayrahttps://www.instagram.com/ricisbykhayra"
