video_id,title,publishedAt,channelId,channelTitle,categoryId,trending_date,tags,view_count,likes,dislikes,comment_count,thumbnail_link,comments_disabled,ratings_disabled,description
"N2dsnGc7TFk","Raiden X 찬열 CHANYEOL 'Yours (Feat. 이하이, 창모)' MV","2020-05-12T09:00:00Z","UCEf_Bc-KVd7onSeifS3py9g","SMTOWN","10","20.17.05","레이든|찬열|이하이|창모|엑소|Yours|Raiden|CHANYEOL|LeeHi|LEE HI|CHANGMO|EXO|Scream Records|MV|I'll be yours","4760937","839441","2439","149087","https://i.ytimg.com/vi/N2dsnGc7TFk/default.jpg","False","False","Raiden X CHANYEOL’s new single Yours (Feat. LeeHi, CHANGMO) is out!Listen and download on your favorite platform: http://smarturl.it/RDCY_YoursScreaM Records Officialhttps://www.youtube.com/SMScreaMRecordshttps://www.facebook.com/ScreaMRecordsSMhttps://www.instagram.com/screamrecordsEXO Officialhttp://exo.smtown.comhttp://www.youtube.com/weareoneEXOhttp://www.facebook.com/weareoneEXOhttp://www.instagram.com/weareone.exohttp://twitter.com/weareoneEXO#Raiden #CHANYEOL #Yours #찬열 #이하이 #창모 #LeeHi #CHANGMORaiden X 찬열 CHANYEOL 'Yours (Feat. 이하이, 창모)' MV ℗ SM Entertainment, Scream Records"
"Y3cTYNMmfQ4","Perhatian! Gak Pake Bohong, Youtuber Ferdian Paleka Minta Maaf ke Masyarakat | tvOne","2020-05-08T10:39:58Z","UCER4rvDnRBPr_ncYW4UCZjg","tvOneNews","25","20.17.05","tvone|tvonenews|tv one|tvone live|tv one live|berita terbaru|news|berita|tvone terbaru|tv one terbaru|tvone update|news live|live report|berita terkini|news update|berita update|tv one update|berita terbaru hari ini|tvonenews.com|berita viral|ferdian paleka|ferdian paleka minta maaf","3824922","46449","2825","21876","https://i.ytimg.com/vi/Y3cTYNMmfQ4/default.jpg","False","False","Jakarta, tvOnenews.com - Polisi mengamankan YouTuber Ferdian Paleka alias Ferdiansyah (21) dan temannya, M Aidil (21) saat mereka keluar dari Pelabuhan Merak. Pelaku diamankan tim khusus Reserse Kriminal Umum Polda Jabar dan Resmob Polrestabes Bandung di KM 19 Tol Jakarta-Merak, Tangerang, Jumat (8/5/2020) dini hari. Sore tadi, Polrestabes Bandung melakukan konferensi pers terkait penangkapan tersebut. Para pelaku pun dihadirkan di hadapan media. Tampak ketiganya baik Ferdian, Aidil, dan Tubagus Fahhdinar Achyar (20) mengenakan baju tahanan berwarna orange. Ketiga pelaku yang mengenakan masker itu terlihat tertunduk dan bergeming."
"PUeCpoWE2YY","❗Viral❗ Ferdian Paleka Ngasih Sampah, Ammar Irish Ngasih Cinta","2020-05-08T20:30:15Z","UCZDmLXjwoAHyfx8byAbpP5g","Aish TV","24","20.17.05","aish tv|rian adrians|ladislao|ammar zoni|irish bella|aishtv|ibel|viral|trending|atta|ricis|aurel|deddy corbuzier|news|vlog|artis|ferdinan|paleka|ferdinan paleka|prank batu bata|prank waria|bandung|prank sampah|sampah|ferdian|ferdian paleka|prank ferdian paleka|indonesia trending|aish tv terbaru","1962976","91507","2209","6139","https://i.ytimg.com/vi/PUeCpoWE2YY/default.jpg","False","False","Prank sampah rendahkan waria, Ammar & Irish semangati waria butuh sembako---follow instagram kita:https://www.instagram.com/ammarzoni/https://www.instagram.com/_irishbella_/"
"qkHrEXttNaQ","PREMAN PENSIUN 4 - Bos Preman Akhirnya Turun Tangan Langsung [09 Mei 2020]","2020-05-09T15:16:28Z","UCzTsWuCdVP_vehWyGwPcS3Q","RCTI - LAYAR DRAMA INDONESIA","24","20.17.05","Sinetron|Sinetron RCTI|Full Episode|RCTI","2197186","14805","741","1311","https://i.ytimg.com/vi/qkHrEXttNaQ/default.jpg","False","False","Yuk saksikan full episode seluruh program RCTI, klik http://bit.ly/RCTIplusSubscribe our channel:Youtube RCTI Layar Drama Indonesia http://bit.ly/LayarDramaIndonesiaCheck Our Official WebsiteWebsite: https://bit.ly/2yFOfXP Twitter: https://bit.ly/1GxQZ9sFacebook: https://bit.ly/1dvz1auInstagram: https://bit.ly/2OUKyaG"
"xgjpqjMAR7Y","[🔴LIVE] Penampakan Dari Dalam Peti Mati","2020-05-13T17:21:59Z","UC3p_eXknBdGus6jbajYMqVw","Ewing HD","24","20.17.05","ewing|ewing hd|malam jumat|uji nyali|penampakan|kuntilanak|ewing hd hd malam jumat|ewing hd penampakan hantu|ewing squad|mynameisewing|malam jumat ewing|ghost|horror|viral|indonesia|top 5|caught on camera|hantu seram|penampakan hantu|ewing hd malam jumat|cerita seram|misteri|aneh tapi nyata|mengerikan|nyali|cuplikan|vlog|youtube|youtubers|ewingvlog|ewing hd penampakan|malam jumat ewing hd|penampakan setan|ewing hd hantu indonesia|hantu indonesia","368449","11999","522","745","https://i.ytimg.com/vi/xgjpqjMAR7Y/default.jpg","False","False","Multistreaming with https://restream.io/?ref=y8nynHai semua nama gue Ewing dan selamat datang di Live Streaming EWING HD. Semoga live streaming ini berjalan lancar tanpa hambatan ya. Amin.😇Dalam sesi live streaming ini, selama satu jam gue akan membacakan email dari para #EwingSquad mengenai cerita, foto, video penampakan hantu yang mereka kirimkan ke malamjumat@ewinghdtv.comJanganlah khawatir kalau kalian ketinggalan sesi live streaming ini karena tayangan ulangnya akan diupload sehari setelah sesi live streaming.Setiap bulannya akan ada video dengan durasi singkat yang berisi rangkuman dari sesi live streaming ini. So stay tune terus di Ewing HD ya.Jangan lupa join Discord #EwingSquadhttps://discord.gg/rEnNYjH➖➖➖➖➖SYARAT DAN KETENTUAN MENGIKUTI LIVE STREAMING #MalamJumat1. Fokus dari sesi live streaming ini adalah menghibur, jadi jangan baper.2. Kalau gue memutuskan bahwa foto dan atau video kiriman kalian adalah hoax atau rekayasa ya itu pendapat subjektif gue, jadi jangan baper.3. Gue akan skip cerita foto video yang menurut gue tidak jelas, jadi jangan baper.4. Gue akan membaca cepat email yang tulisannya panjang demi durasi sesi live streaming, jadi jangan baper.5. Dengan menonton atau mengikuti sesi live streaming itu artinya kalian sudah menyetujui syarat dan ketentuan diatas, jadi jangan baper.➖➖➖➖➖OPEN DONATIONPaypall 💸 : https://streamlabs.com/ewingplayingBCA 💸 : 6630476061 an Hujwiriawan EwingGopay : 6285211297745 an EwingThank you very much! ➖➖➖➖➖ Change log, 11 Desember 2019 :1. #MalamJumatLive berubah nama menjadi #EmailBerhantu2. Jumlah email yang tadinya 50 menjadi 30 dikarenakan keterbatasan pita suara gue3. Kualitas email yang dipresentasikan ditingkatkan. Tidak akan ada lagi bocah pixelate, penampakan tipis tipis, dan sejenisnya.➖➖➖➖➖SOCIAL MEDIAFacebook: http://bit.ly/EwingHDFacebookTwitter: http://bit.ly/EwingHDTwitterInstagram: http://bit.ly/EwingHDInstagramLinkedin : http://bit.ly/EwingHDlinkedinPodcast : http://bit.ly/EwingHDPodcastBlog : http://bit.ly/BlogEwingWebsite : http://www.ewinghdtv.com/BUSINESS/Sponsor/EndorseEmail : contact@ewinghdtv.com"
"dS3LwadCRu0","DUET LUCU! UAS dan Ustadz Wijayanto, Orang Celaka Dunia Akhirat | Indahnya Ramadhan tvOne (9/5/2020)","2020-05-09T08:00:14Z","UCasMZGvChuKk6mIKIsCICJw","religiOne","27","20.17.05","tvone|tvonenews|religione|damai indonesiaku|damai indonesiaku tvone|rumah mamah dedeh tvone|assalamualaikum nusantara tvone|dakwah pendek|uas|tabligh|kajian islam|dakwah islam|ustadz abdul somad|tvonenews.com|ustadz wijayanto|orang yang celaka|celaka dunia akhirat|poligami|wabah corona|Syekh Ali Jaber|DUET LUCU! UAS dan Ustadz Wijayanto|Orang Celaka Dunia Akhirat | Indahnya Ramadhan tvOne|Celaka Dunia Akhirat|religione tvone|indahnya ramadhan tvone","652267","13101","807","838","https://i.ytimg.com/vi/dS3LwadCRu0/default.jpg","False","False","Jakarta, tvOnenews.com - DUET LUCU! UAS dan Ustadz Wijayanto, Orang Celaka Dunia Akhirat | Indahnya Ramadhan tvOne (9/5/2020)Ceramah Lucu Ustadz Abdul Somad dan Ustadz Wijayanto tentang bagaimana orang yang beribadahpun akan celaka jika melakukannya dengan keadaan riya ataupun sombong, adapula ilmu yang tidak bermanfaat membuat kita termasuk orang celaka. Maka celakalah mereka yang hatinya telah membatu untuk mengingat Allah. Mereka itu dalam kesesatan yang nyata.(Az-Zumar 22).Yuk simak video diatas selengkapnya yang akan dipaparkan oleh ustadz tercinta kita Ustadz Abdul Somad dan Ustadz Wijayanto untuk menambah keimanan dan ketaqwaan kita serta menjauhkan kita dari neraka janaham Alllah SWT, ilmu dapat hati tenang stres hilang.#OrangCelaka #UAS #CeramahLucu #IlmuDapatStresHilang #religiOne #IndahnyaRamadhan #DuetLucu #UstadzWijayanto #Poligami #BahagiaDuniaAkhirat"
"pE49WK-oNjU","Ariana Grande & Justin Bieber - Stuck with U (Official Video)","2020-05-08T04:00:09Z","UC0VOyT2OCBKdQhF3BAbZ-1g","ArianaGrandeVevo","10","20.17.05","Ariana|Grande|Justin|Bieber|Stuck|with|Universal|Records|Pop","39090656","2532498","53703","100783","https://i.ytimg.com/vi/pE49WK-oNjU/default.jpg","False","False","SB Projects along with longtime clients Ariana Grande and Justin Bieber release “Stuck with U” to benefit First Responders Children’s Foundation: https://stuckwithu.lnk.to/agjbPVIn response to the COVID-19 crisis and to help further bolster relief efforts, all net proceeds from the streams and sales of “Stuck with U” will be donated to First Responders Children’s Foundation to fund grants and scholarships for children of healthcare workers, emergency medical technicians (EMTs), paramedics, police officers and firefighters serving at the front lines during the global pandemic. That means that by listening, watching, and sharing – you are helping to support families in need. If you would like to make an additional contribution to First Responders Children's Foundation, click the donate button. Thank you to all the fans, friends and first responders who participated.Created & directed by: Rory Kramer, Alfredo Flores, Ariana Grande, Justin Bieber, Scooter Braun Lyrics:I’m not one to stick aroundOne strike and you’re out babyDon’t care if I sound crazyBut u never let me down No, noThat’s why when the sun’s up I’m stayinStill laying in your bed sayinOoh, ooh, ooh, oohGot all this time on our handsMight as well cancel our plansI could stay hereFor a LifetimeSo lock the door, and throw out the keyCan’t fight this no more, it’s just u and meAnd there’s nothin I, nothin I I can doI’m stuck with uStuck with uStuck with uSo go ahead and drive me insaneBaby run your mouth, I still wouldn’t changeBeing stuck with uStuck with uStuck with uI’m stuck with u Stuck with uStuck with u babyThere’s nowhere we need to beNo, no, noIma get to know u betterKinda hope we’re here foreverThere’s nobody on the streetsAnd if u told me the world’s endinAin’t no other way that I can spend it[Pre-Chorus 2]Ooh, ooh, ooh, oohGot all this time in my handsMight as well cancel our plansI could stay hereForeverSo lock the door, and throw out the keyCan’t fight this no more, it’s just u and meAnd there’s nothin I, nothin II can doI’m stuck with uStuck with uStuck with uSo go ahead, and drive me insaneBaby run your mouth, I still wouldn’t tradeBeing stuck with u Stuck with uStuck with uI’m stuck with uStuck with uStuck with uOh-oh-oh-ohBaby come take all my timeGo on make me lose my mindWe got all that we need here tonightLock the door, and throw out the keyCan’t fight this no more, it’s just u and meAnd there’s nothing INothing I’d rather doI’m stuck with uStuck with uStuck with uSo go ahead and drive me insaneBaby run your mouth, I still wouldn’t trade all thisLovin u, hatin u, wantin uI’m stuck with uStuck with uStuck with uStuck with uStuck with uStuck with u#StuckwithU #ArianaGrande #JustinBieberMusic video by Ariana Grande, Justin Bieber performing Stuck with U. © 2020 Silent Records Ventures, LLC, Def Jam Recordings, a division of UMG Recordings, Inc., and Republic Records, a division of UMG Recordings, Inc.http://vevo.ly/7lAqPq"
"n_Cf6OWYq7A","MOP MUSIC S4 | BETRAND PETO PUTRA ONSU - COVER KASIH PUTIH (TRIBUTE TO GLENN FREDLY)","2020-05-10T03:00:14Z","UCrrimexxJpH-zLIrg_IPV_w","MOP Channel","24","20.17.05","[none]","729952","71491","334","33257","https://i.ytimg.com/vi/n_Cf6OWYq7A/default.jpg","False","False","Track List:Betrand Peto Putra Onsu - Kasih Putih (Cover Glenn Fredly)-----------------------------------------------------------------------------------------------------------MOP Music kali ini tampil berbeda dengan persembahan Spesial Tribute to Glenn Fredly. Semoga melalui persembahan Betrand Peto Putra Onsu untuk Bung Glenn Fredly ini, kita bisa menjadikan beliau sebagai seorang seniman yang akan selalu kita kenang kebaikan dan karya-karyanya. Bahwa selama hidupnya Bung Glenn Fredly selalu memberikan karya-karya terbaiknya kepada kita semua. Yuk saksikan MOP Music setiap hari Minggu pukul 10.00 WIB pastinya cuma di MOP Channel!#betrandpeto #betrandpetoputraonsu #kasihputih #glennfredly #yoviewidianto #tengkushafick #tributetoglenn #cover #mopmusic #mopchannel #rubenonsu-----------------------------------------------------------------------------------------------------------Untuk program-program MOP Channel lainnya silahkan klik link berikut https://www.youtube.com/channel/UCrri...Untuk Episode MOP Music lainnya silahkan klik link berikuthttps://www.youtube.com/watch?v=1xEKA...Follow IGMOP Channel https://www.instagram.com/mopchannel/MOP Music https://www.instagram.com/mopmusic_mop/"
"v7YyVwN70qc","KALIAN LEBIH BERMORAL! | DEBAT KUSIR COMEBACK","2020-05-12T13:13:26Z","UC15VpzK4og3NLmCVZQOroFw","Majelis Lucu","23","20.17.05","majelis lucu indonesia|majelis lucu|standup|standup comedy|jokes|lawak|kocak|lucu|tretan muslim|coki pardede|adriano qalbi|patrick effendy|comic|open mic|goblok|joshua suherman|dono pradana|ananta rispo|rigen rakelna|dani aditya|ngakak|sensor|hiya|golongan kami|umat lucu|MLI|SUCI|SUCA|komika|standup comedian|ferdian paleka|youtuber|youtuber reaction|penjara|ditangkap|2020|berita terbaru ferdian paleka","546025","46093","713","9126","https://i.ytimg.com/vi/v7YyVwN70qc/default.jpg","False","False","-------Terima Kasih, dengan menononton video ini, anda sudah membuat kami lebih kaya sedikit! Jangan lupa sebarkan, like dan SUBSCRIBE... Jadilah bagian dari komedi Indonesia yang sudah pasti Lucu...www.majelislucuindonesia.com#PrankSampah #FerdianPaleka #AttaHalilintar"
"u1C-Pv7Irtg","In Memoriam Sang Maestro Didi Kempot (Part 3) | Satu Jam Lebih Dekat tvOne","2020-05-07T11:32:38Z","UCYfblrhI1-tr6leVANholgQ","Talk Show tvOne","25","20.17.05","tvone|tv one|tvonenews|talkshow tvone|etalkshow|fakta tvone|dua sisi tvone|politik|sosial|ekonomi|indonesia|dialog|debat|berita|news|berita terbaru|berita viral|berita terkini|tvone hari ini|news update|apa kabar indonesia|tv one live|ilc terbaru|live tv one|tvonenews.com|tvone live|didi kempot","1798751","15136","688","679","https://i.ytimg.com/vi/u1C-Pv7Irtg/default.jpg","False","False","Jakarta, tvOnenews.com - Didi Kempot (lahir di Surakarta, 31 Desember 1966 - meninggal 5 Mei 2020 pada umur 53 tahun). Adalah seorang penyanyi dan penulis lagu campursari dari Surakarta. Didi Kempot merupakan putra dari seniman tradisional terkenal, Ranto Edi Gudel yang lebih dikenal dengan Mbah Ranto.Didi Kempot merupakan adik kandung dari Mamiek Prakoso, pelawak senior Srimulat. Publik mengenal Didi Kempot sebagai maestro campursari dan penulis lagu yang populer, ia memulai karirnya sebagai musisi jalanan di kota Surakarta sejak tahun 1984 hingga 1986, kemudian mengadu nasib ke Jakarta pada tahun 1987 hingga 1989.Kini Didi Kempot banyak diminati oleh kalangan muda dari berbagai daerah yang menyebut diri mereka sebagai Sadboys dan Sadgirls yang tergabung dalam Sobat Ambyar dan mendaulat Didi Kempot sebagai Godfather of Broken Heart dengan panggilan Lord Didi. Julukan itu berawal dari lagu-lagu Didi Kempot yang hampir semuanya menceritakan tentang kesedihan dan kisah patah hati."
"CB6ucDWxKwY","In Memoriam Sang Maestro Didi Kempot (Part 2) | Satu Jam Lebih Dekat tvOne","2020-05-07T11:18:22Z","UCYfblrhI1-tr6leVANholgQ","Talk Show tvOne","25","20.17.05","tvone|tv one|tvonenews|talkshow tvone|etalkshow|fakta tvone|dua sisi tvone|politik|sosial|ekonomi|indonesia|dialog|debat|berita|news|berita terbaru|berita viral|berita terkini|tvone hari ini|news update|apa kabar indonesia|tv one live|ilc terbaru|live tv one|tvonenews.com|tvone live|didi kempot","1267757","9005","433","353","https://i.ytimg.com/vi/CB6ucDWxKwY/default.jpg","False","False","Jakarta, tvOnenews.com - Didi Kempot (lahir di Surakarta, 31 Desember 1966 - meninggal 5 Mei 2020 pada umur 53 tahun). Adalah seorang penyanyi dan penulis lagu campursari dari Surakarta. Didi Kempot merupakan putra dari seniman tradisional terkenal, Ranto Edi Gudel yang lebih dikenal dengan Mbah Ranto.Didi Kempot merupakan adik kandung dari Mamiek Prakoso, pelawak senior Srimulat. Publik mengenal Didi Kempot sebagai maestro campursari dan penulis lagu yang populer, ia memulai karirnya sebagai musisi jalanan di kota Surakarta sejak tahun 1984 hingga 1986, kemudian mengadu nasib ke Jakarta pada tahun 1987 hingga 1989.Kini Didi Kempot banyak diminati oleh kalangan muda dari berbagai daerah yang menyebut diri mereka sebagai Sadboys dan Sadgirls yang tergabung dalam Sobat Ambyar dan mendaulat Didi Kempot sebagai Godfather of Broken Heart dengan panggilan Lord Didi. Julukan itu berawal dari lagu-lagu Didi Kempot yang hampir semuanya menceritakan tentang kesedihan dan kisah patah hati."
"pnynui2EyaQ","Billy Syahputra & Amanda Manopo - PDKT? | Selebrita Siang 13/05/20","2020-05-13T06:52:33Z","UC4tpqQ4Ti9XoC0g0CLM0TFA","Selebrita7. com","24","20.17.05","selebrita|selebrita7|hot gosip|trans7|reality artis|kasus artis|gosip hari ini","345459","3442","133","551","https://i.ytimg.com/vi/pnynui2EyaQ/default.jpg","False","False","Program yang menayangkan info terkini dari selebritis indonesia.Berita seputar kegiatan artis maupun gosip artis, kami sajikan hanya di Selebrita. -------Selebrita Pagi dan Siang                     : Senin - Jumat pukul 07.30 & 10.30 WIB Selebrita Pagi dan On The Weekend : Sabtu & Minggu 07.30 & 11.00 WIBSeleb Expose                                          : Sabtu & Minggu 15.00 WIBhanya di Trans7-------Follow usTwitter: @Selebrita7Instagram :@Selebrita7 Youtube : Selebrita7"
"us9E-RMJFvE","Youtuber Ferdian Paleka Pura-pura Minta Maaf, Polisi Menangkap Rekan Pelaku - iNews Sore 04/05","2020-05-04T14:28:58Z","UCoSkllfpgmFHtbVK835QaQg","Official iNews","24","20.17.05","iNews|Berita Terkini|Breaking News|TV Berita|Berita Indonesia|Info Indonesia|Special Report|Live Streaming|Hotman Paris Show|CNN Indonesia|Kompas TV|TV One|Metro TV|Mata Najwa|ILC|Full|prank|ferdianpaleka|youtuber","6311232","72470","7339","22657","https://i.ytimg.com/vi/us9E-RMJFvE/default.jpg","False","False","Tanggal Tayang: 04/05/2020Program berita harian yang menyajikan Informasi tercepat dan teraktual secara detail dari berbagai bidang secara LIVE, mulai dari peristiwa politik, hukum, sosial, budaya, ekonomi, dan olah raga, baik dari dalam ataupun luar negeri. Terdapat laporan langsung tim liputan handal kami dari tempat peristiwa yang bisa dijadikan sumber referensi informasi Anda. Dipandu oleh para host yang menarik, dengan gaya santai dan ringan. Saksikan iNews Pagi, iNews Siang, iNews Sore, dan iNews Malam, hanya di iNews agar Anda tidak tertinggal informasi.Subscribe iNews Official Youtube Channel:https://www.youtube.com/OfficialiNews?sub_confirmation=1Follow Our Official Twitter: https://twitter.com/OfficialiNewsTVCheck Our Official Website: https://www.inews.idLike Our Official Facebook: https://www.facebook.com/OfficialiNewsFollow Our Official Instagram: https://www.instagram.com/officialinewstvSaksikan info berita terkini di:iNews Pagi: Senin – Jumat Pukul 06.00 - 07.30 WIB | Sabtu – Minggu Pukul 04.30 - 06.30 WIBiNews Siang: Senin – Jumat Pukul 12.00 - 13.30 WIB | Sabtu – Minggu Pukul 11.00 - 12.30 WIBiNews Sore: Setiap Hari Pukul 17.30 - 19.00 WIB |  Sabtu - Minggu Pukul 16.30 - 18.00 WIBiNews Malam: Senin – Jumat 21.00 - 22.00 WIBSabang, Lampung, Pelaihari, Banjarmasin, Masohi - 50 UHF | Lhokseumawe, Jabodetabek - 30 UHF | Banda Aceh - 40 UHF | Medan, Pontianak, Semarang - 45 UHF | Pematang Siantar - 58 UHF | Pekan Baru - 48 UHF | Tanah Datar, Bukit Tinggi, Palangkaraya - 33 UHF | Padang, Cirebon - 31 UHF | Batam, Samarinda - 61 UHF | Palembang, Kendari - 44 UHF | Pangkal Pinang - 37 UHF | Bengkulu, Merauke - 24 UHF | Bandung - 22 UHF | Tasikmalaya - 52 UHF | Magelang - 54 UHF | Surabaya - 62 UHF | Denpasar - 53 UHF | Mataram - 38 UHF | Kupang, Gorontalo 56 UHF | Makassar - 51 UHF | Mamuju - 28 UHF | Tarakan - 41 UHF | Palu - 45 UHF | Manado - 26 UHF | Ternate, Manokwari - 34 UHF | Indovision -Channel 83 |Top TV - Channel 83 | Okevision - Channel 101"
"xoTeXZO1RrY","Padahal Sering Dipakai Tapi Ternyata Selama Ini Salah Cara Penggunaannya","2020-05-14T05:30:10Z","UCgiO267R4Qo-SJF2UzH5ccQ","The Shiny Peanut","24","20.17.05","mcdonalds|mcflurry|cutter|pengupas sayur|mcd|tim smith|minuman kaleng","594342","17359","597","880","https://i.ytimg.com/vi/xoTeXZO1RrY/default.jpg","False","False","For business inquiries please contact : theshinypeanut.official@gmail.comFollow Instagram tsp : https://www.instagram.com/tsp_id/For copyright matters please contact us at: theshinypeanut.official@gmail.comDisclaimer- Some contents are used for educational purpose under fair use. Copyright Disclaimer Under Section 107 of the Copyright Act 1976, allowance is made for fair use for purposes such as criticism, comment, news reporting, teaching, scholarship, and research. Fair use is a use permitted by copyright statute that might otherwise be infringing. Non-profit, educational or personal use tips the balance in favor of fair use."
"jpsvo1ai9qM","PREMAN PENSIUN | Murad & Pipit Mau Membantu Cecep, Melawan Darman!","2020-05-15T08:50:58Z","UC0PDovAfG07_dcQvlVtblOg","MNC Pictures","1","20.17.05","MNC|Picture|mnc picture|PREMAN PENSIUN|LUCU|SITKOM|KANG MUS|RCTI|LAYAR DRAMA|BANDUNG|PREMAN|PASAR","193810","851","45","137","https://i.ytimg.com/vi/jpsvo1ai9qM/default.jpg","False","False","PREMAN PENSIUN 4 tayang setiap hari mulai pukul 04.00 WIB dan 19.00 WIB di RCTI!Ikuti informasi terupdate seputar sinetron PREMAN PENSIUN di:Instagram: https://www.instagram.com/mnc_pictures/Twiter: https://twitter.com/MNC_Pictures Facebook: https://www.facebook.com/mncpictures/Hashtag: #PREMANPENSIUN4"
"-laOmPdPUTI","Happy Asmara - Tekan Semene [OFFICIAL]","2020-05-16T13:00:12Z","UCNOLcOWgKQrd71FW8pqG4yw","Milady Record Official","10","20.17.05","milady record|record lable|indonesia|lagu dangdut|konser musik|duta nirwana|Milady Record","131252","5446","90","1023","https://i.ytimg.com/vi/-laOmPdPUTI/default.jpg","False","False","Official Music VideoTitle : Tekan SemeneArtist : Happy AsmaraSongwritter : Hasan AftershineArr    : SamiremenAlbum : SingleCopyright © 2020 Milady Record. All rights reserved.YouTube channel managed by MusicYes Digital DistributionFully YouTube CertifiedJoin MusicYeshttps://musicyess.com/Account/Register#HappyAsmara #TekanSemene #Dangdut"
"0tAAhl1ZlJA","PREMAN PENSIUN 4 - Kang Mus Sepertinya Marah Besar Sama Cecep [16 Mei 2020] Part 3","2020-05-16T13:41:42Z","UCzTsWuCdVP_vehWyGwPcS3Q","RCTI - LAYAR DRAMA INDONESIA","24","20.17.05","Sinetron|Sinetron RCTI|Full Episode|RCTI","1012653","8534","396","1795","https://i.ytimg.com/vi/0tAAhl1ZlJA/default.jpg","False","False","Yuk saksikan full episode seluruh program RCTI, klik https://bit.ly/PremanPensiun4RCTIPlusSubscribe our channel:Youtube RCTI Layar Drama Indonesia http://bit.ly/LayarDramaIndonesiaCheck Our Official WebsiteWebsite: https://bit.ly/2yFOfXP Twitter: https://bit.ly/1GxQZ9sFacebook: https://bit.ly/1dvz1auInstagram: https://bit.ly/2OUKyaG"
"sQ9rYhCvmo0","Tak Mungkin Kembali - Dory Harsa [OFFICIAL]","2020-05-11T12:35:32Z","UCd4Ob_VMkL2ogcBIGzOT2Nw","Dory Harsa Music","10","20.17.05","Dory Harsa - Tak Mungkin Kembali [OFFICIAL]|dory harsa|sak ora orane|Dory kendang|dory harsa nella kharisma|nella kharisma|dory kriyuk-riyuk|sobat ambyar|nangiso tak kendangi|sad boys|sad girl|lord didi kempot|god father of broken heart|nella lovers|kendang didi kempot|dory harsa ninggal tatu|ninggal tatu|kangen nickerie|dory lare jawi|dory kendang didi kempot|dory harsa kangen nickerie|dory harsa ig|dory harsa nangis|dory didi kempot|wis cukup","682702","31331","414","3264","https://i.ytimg.com/vi/sQ9rYhCvmo0/default.jpg","False","False","Dan akhirnya, selalu ada batas untuk tiap perjalanan. Selalu ada kata selesai untuk setiap yang dimulai, dan selalu ada permulaan baru untuk tempat yang lebih indah dalam damai. Tak Mungkin KembaliTak pernah sedikitpun terbayangkanKu harus kehilanganmuKehilangan senyum indah di bibirmuHangatnya pelukmu, saat bersamamuDan kini semuanya t’lah terjadiKau pergi tinggalkan akuKau pergi meninggalkan aku sendiriTak mungkin kembali, kembali di sisiChorus:Tanpamu..Duniaku terasa sepiMengapa kau pergi secepat iniMembuatku sedihReff:Kumohon Tuhan berikanku waktuUntuk bertemu dengannyaWalau untuk sekejap sajaDan mungkin bila harus ku berikanSeparuh nyawaku untuknyaAgar aku bisa tetap bersamanyaTitle : Tak Mungkin KembaliHarsa Management ProductionSinger : Dory HarsaSongwriter : Dhe BazMusic & Video : Harsa Media Harsa Management 0812-2522-1121 (Job Music)0813-2736-1331 Social Media:Instagram: https://www.instagram.com/doryharsa/Twitter: https://twitter.com/dory_harsaTiktok: https://www.tiktok.com/@doryharsafanspage facebook: https://www.facebook.com/doryharsa/YouTube channel managed by MusicYesDigital Distribution Fully YouTube CertifiedJoin MusicYes https://musicyes.com/Account/Register#DoryHarsa #TakMungkinKembali #Music"
