video_id,title,publishedAt,channelId,channelTitle,categoryId,trending_date,tags,view_count,likes,dislikes,comment_count,thumbnail_link,comments_disabled,ratings_disabled,description
"FUcnWC1m5O8","Vita Alvia - Ku Puja Puja (Official Music Video ANEKA SAFARI)","2020-06-20T01:00:13Z","UCmB1_agPlXbbwTCPKEuwEKA","Aneka Safari Records","10","20.28.06","aneka|safari|records|aneka safari records|yt:cc=on|safari records|lagu dangdut terbaru|vita|alvia|ku puja puja|ku puja puja cover|ku puja puja dj|ku puja puja koplo|ku puja puja ipank|ku puja puja remix|ku puja puja lirik|goyang fanta|dj kentrung|dj kentrung koplo|vita alvia terbaru 2020|vita alvia dj|vita alvia full album|dj perlahan slow full bass vita alvia|dj remix vita alvia ninggal tatu|vita alvia lilakno lungaku|vita fanta|ku puja puja fanta","1582976","25843","1589","3133","https://i.ytimg.com/vi/FUcnWC1m5O8/default.jpg","False","False","tunggu deh sampai kendang koplo nya bunyi banyak kejutan di setengah video kebelakang .. hehehe ..Terima kasih untuk kalian yang setia bersama musik produksi ANEKA SAFARI yukk jangan lupa subscribe dan aktifkan loncengnya ya !! Jangan mampir lapak lain yahh .. jangan kemana mana disini ajah .. hehehe ..Title: Ku Puja Puja Artist: Vita AlviaAlbum: The Best Aneka Safari - Vita AlviaSongwriter: IpankUntuk Terjemahan Bahasa Indonesia ➡ Aktifkan SUBTITLE ..Siapa yang punya kisah serupa seperti isi lagu ini silahkan cerita ambyarkan kolom komentar ..***Yuk Berlangganan Subscribe Channel Youtube kita yang baru : http://bit.ly/anekasafaribts selamat menikmati ..***Available download & streaming on :iTunes ♪ : coming soon .. Spotify ♪ : coming soon .. Deezer ♪ : coming soon .. Buy on Amazon : coming soon .. Unduh Aplikasi Download Resmi Aneka Safari Digital : http://bit.ly/2I9DNep Other Popular Video From Our Artist :Happy Asmara | http://bit.ly/HappyPlayASRNella Kharisma | http://bit.ly/NellaPlayASRJihan Audy | http://bit.ly/JihanAudyPlayASRVita Alvia | http://bit.ly/VitaAlviaPlayASRDenik Armila | http://bit.ly/DenikArmilaPlayASRVia Vallen | http://bit.ly/ViaVallenPlayASRSyahiba Saufa | http://bit.ly/SyahibaPlayASRLutfiana Dewi | http://bit.ly/LutfianaDewiPlayASRNanda Feraro | http://bit.ly/NandaFeraroPlayASRMahesa | http://bit.ly/MahesaPlayASRMala Agatha | http://bit.ly/MalaAgathaPlayASRIkuti Seleksi Artis Nasional ANEKA SAFARI dengan cara upload video kamu di Youtube dan Instagram jangan lupa sertakan mention @safarirecords dan hashtag #AnekaSafariRecords ***Connect with us:Facebook : https://www.facebook.com/anekasafarirecordsTwitter : https://twitter.com/SafariRecordsIDInstagram : https://www.instagram.com/safarirecords/Contact :Tlp. : +6282333038023 ( Admin )Email : info@anekasafari.comWebsite : www.anekasafari.comCopyright © 2020 Aneka Safari Records. All rights reserved.#VitaAlvia#KuPujaPuja#Ipank#Music#AnekaSafariRecords========================================Licensed to YouTube by IDE (Music)This channel & Video optimized by IDE OptimizationLicense your music here: https://smarturl.id/idemusicOptimize your video now: https://smarturl.id/optimize"
"9FLLQHySMpI","DEBAT PANAS! Ketum GNPF Ulama vs Hendri Satrio Soal Insiden Pembakaran Bendera PDIP","2020-06-26T13:57:11Z","UCRVhCi6T_-Ogs9MPDh3kX1w","Apa Kabar Indonesia tvOne","25","20.28.06","tvone|tvonenews|tv one|tvone live|tv one live|berita terbaru|news|berita|tvone terbaru|tv one terbaru|tvone update|tv one update|tvonenews.com|apa kabar indonesia|apa kabar indonesia tvone|apa kabar indonesia malam|apa kabar indonesia pagi|aki pagi tvone|aki malam tvone|akip|akim|talkshow tvone|talk show tv one|berita terkini","159130","1118","186","2382","https://i.ytimg.com/vi/9FLLQHySMpI/default.jpg","False","False","Apa Kabar Indonesia - Jakarta, tvOnenews.com - Insiden pembakaran bendera PDI Perjuangan oleh massa aksi tolak RUU Haluan Ideologi Pancasila (HIP) di depan Gedung DPR pada Rabu (24/6) berbuntut panjang.Ketua Umum PDIP Megawati Soekarnoputri secara langsung menginstruksikan seluruh kadernya untuk merapatkan barisan dan siap siaga. PDIP memilih mengedepankan proses hukum atas kejadian itu.Apa Kabar Indonesia Malam tvOne (26/6/2020) mengangkat tema Bendera Partai Dibakar, Banteng Meradang."
"WHEthsO7T7w","We Are Liverpool. Champions of England.","2020-06-25T21:10:51Z","UC9LQwHZoucFT94I2h6JOcjw","Liverpool FC","17","20.28.06","Liverpool FC|LFC|Liverpool|Anfield|Melwood|Liverpool Football Club|premier league|champions|we are liverpool|premier league champions|EPL|Premier League|Klopp|Jurgen Klopp|YNWA","2240726","152307","2523","17448","https://i.ytimg.com/vi/WHEthsO7T7w/default.jpg","False","False","After a 30 year wait, Jürgen Klopp's Liverpool are Premier League Champions. Enjoy more content and get exclusive perks in our Liverpool FC Members Area, click here to find out more: https://www.youtube.com/LiverpoolFC/joinSubscribe now to Liverpool FC on YouTube now and get notified when new videos land: https://www.youtube.com/subscription_center?add_user=LiverpoolFC"
"racmy7Y9P4M","Bring Me The Horizon - Parasite Eve (Official Video)","2020-06-25T19:00:11Z","UCUmC7gXciukRv73CQRQ5QGQ","BMTHOfficialVEVO","10","20.28.06","Bring me the horizon|BMTH|Bring me the horizon parasite eve|bring me the horizon parasite eve lyrics|bring me the horizon parasite eve video|parasite eve|bring me the horizon go to|Bring me the horizon ludens|ludens|sugar honey ice tea|mantra|bring me the horizon suagr honey ice tea|bring me the horizon mantra|bring me the horizon live|bring me the horizon interview|bring me the horizon sleepwalker|bring|the|horizon","2604818","239380","5757","17763","https://i.ytimg.com/vi/racmy7Y9P4M/default.jpg","False","False","Bring Me The Horizon – Parasite Eve (Official Video) Listen to ‘Parasite Eve’ Spotify: http://bmthorizon.co/ParasiteEve/spotify?IQid=YTApple music: http://bmthorizon.co/ParasiteEve/applemusic?IQid=YTiTunes: http://bmthorizon.co/ParasiteEve/itunes?IQid=YTYouTube Music: http://bmthorizon.co/ParasiteEve/youtubemusic?IQid=YTAmazon Music: http://bmthorizon.co/ParasiteEve/amazonmusic?IQid=YT Deezer: http://bmthorizon.co/ParasiteEve/deezer?IQid=YTFollow Bring Me The Horizon: https://instagram.com/bringmethehorizonhttps://twitter.com/bmthofficial https://facebook.com/bmthofficial https://youtube.com/user/BMTHchannelNewsletter: http://bmthorizon.co/newsletterWatch the making of Parasite Eve in lockdown:http://bmthorizon.co/BMTH8http://bmthorizon.co/00BMTHS2Parasite Eve merch: http://bmthorizon.co/horizonsupply credits:directed & edited by oliver sykesdirector of photography: brian cox camera assistant: alissa sallesgaffer: lee brinkleybehind the scenes: harri charlila camera operator: kevin garciala lighting technician:  rory o'connell Lyrics:i’ve got a fever, don't breathe on mei'm a believer of nobodywon't let me leave 'cause I've seen somethinghope I don't sneeze, I don't…really we just need to fear somethingonly pretending to feel somethingi know you're dying to runi want to turn you aroundplease remain calmthe end has arrivedwe cannot save youenjoy the ridethis is the momentyou’ve been waiting fordon’t call it a warningthis is a warit’s the parasite evegotta feeling in your stomach, ‘cause you know that it’s coming for youleave your flowers and grievedon’t forget what they told youwhen we forget the infectionwill we remember the lessonif the suspense doesn’t kill yousomething else will movei heard they need better signalput chip and pins in the needlesquarantine all of those secrets in that black hole you call a brain before it’s too late you can board up your windowsyou can lock up your doorsbut you can’t keep washing your hands of this shit any morewhen all the king’s sources and all the king’s friends don’t know their arses from their pathogenswhen life is a prison and death is a doorthis ain’t a warningthis is a war#BringMeTheHorizon #ParasiteEve #BMTHParasiteEve #BringMeTheHorizonParasiteEveVideo"
"HdZdxocqzq4","SEVENTEEN (세븐틴) 'Left & Right' Official MV","2020-06-22T09:00:02Z","UC3IZKseVpdzPSBaWxBxundA","Big Hit Labels","10","20.28.06","세븐틴|SEVENTEEN|플레디스|PLEDIS|헹가래|Henggarae","29641575","1165253","10437","234992","https://i.ytimg.com/vi/HdZdxocqzq4/default.jpg","False","False","SEVENTEEN (세븐틴) 'Left & Right' Official MV세븐틴 7번째 미니 앨범 [헹가래]는 정규 3집 [An Ode]에서 마주했던 ‘두려움’의 감정에서 벗어나 ‘꿈’을 가지고 다시 한번 새로운 세상으로 함께 나아가자는 힘찬 에너지를 담았으며 꿈을 향해 도전하는 청춘에게 응원의 메시지를 전하는 앨범이다.이번 앨범을 통해 세븐틴은 갈림길에 서서 고민하는 청춘들의 아픔을 표현하기보다는 세븐틴만의 발상으로 그들에게 먼저 손을 내밀며 응원하고, 열정적인 에너지로 스며들게 하며 명랑하고 톡톡 튀는 색다른 매력을 선보일 예정이다. 세븐틴만의 색으로 담아낸 청춘들의 힐링 앨범 [헹가래]의 타이틀곡 ‘Left & Right’는 2000년대 힙합 장르를 고안하여 2020년의 사운드로 새롭게 재탄생 시킨 곡으로 왼쪽, 오른쪽 그 어디에도 출구가 없다고 느끼는 이들에게 긍정적으로 “두려움 없이 힘차게 나가자”라고 응원의 목소리를 외치며 파워풀한 에너지를 선사한다.SEVENTEEN’s 7th Mini Album [Heng:garae], is an energetic album that breaks away from the emotion of fear, which was expressed through the 3rd Album [An Ode], and urges you to dream and run toward a new world together. The album aims to deliver a message of encouragement for the youth, as they work toward their dreams.Rather than expressing the hardships of the youth facing a fork in the road, SEVENTEEN lends a hand of support in their own way by exuding a cheerful and unique charm with passionate energy.[Heng:garae] is a healing album for the youth that illustrates the unique colors of SEVENTEEN. The title track ‘Left & Right,’ inspired by the hip-hop genre from the 2000’s, recreated a 2020 sound with powerful energy. The track encourages those who feel there is no escape whether they turn left or right, sending a message to stay positive and to “move forward boldly without fear.”#SEVENTEEN #세븐틴#헹가래 #Henggarae#Left_n_RightSEVENTEEN Official Homepage: http://www.seventeen-17.comSEVENTEEN Official Facebook: https://www.facebook.com/seventeennewsSEVENTEEN Official Twitter: https://twitter.com/pledis_17SEVENTEEN Official Instagram: http://www.instagram.com/saythename_17SEVENTEEN Official Fancafe: http://cafe.daum.net/pledis-17SEVENTEEN Official Weverse: https://www.weverse.io/seventeen"
"KVsRHth92Jw","BLACKPINK - 'How You Like That' M/V MAKING FILM","2020-06-27T00:00:02Z","UCOmHUn--16B90oW2L6FRR3A","BLACKPINK","10","20.28.06","YG Entertainment|YG|와이지|K-pop|BLACKPINK|블랙핑크|블핑|제니|로제|리사|지수|Lisa|Jisoo|Jennie|Rosé|BLINK|블링크|How You Like That|BLACKPINK How You Like That|블랙핑크 How You Like That|HYLT|BLACKPINK HYLT|블랙핑크 HYLT|M/V MAKING FILM|뮤비 메이킹|블핑 뮤비|블랙핑크 뮤비 메이킹|HYLT MV MAKING|MAKING FILM","13520204","1748700","23961","44373","https://i.ytimg.com/vi/KVsRHth92Jw/default.jpg","False","False","#BLACKPINK #블랙핑크 #HowYouLikeThat #PreReleaseSingle #MV_MAKING #YG"
"cfYhBLDWlvw","Andmesh - Sampai Tua Nanti (Official Music Video)","2020-06-26T03:00:13Z","UCYJo04cZFlwL3XNnJ8aYtTw","HITS Records","10","20.28.06","HITS Records|sampai tua nanti|top hits|cover lagu|angga candra|lagu terbaru andmesh|hits records|lagu pop|lagu galau|cinta luar biasa|hanya rindu andmesh|andmesh kamaleng|live performance|andmesh hanya rindu|ku mau dia|terimalah lagu ini dari orang biasa","786883","62198","377","2894","https://i.ytimg.com/vi/cfYhBLDWlvw/default.jpg","False","False","Sampai Tua Nanti single terbaru dari Andmesh, menceritakan hubungan 2 sepasang kekasih yang mengingat masa lalu mereka, hubungan yang tak lengkang oleh waktu, siapa nih yang gak sengaja habis lihat video ini, tiba - tiba ingat masa - masa PDKT atau pacaran nih hehehe ?Streaming on Spotify: https://smarturl.it/CintaLuarBiasa/spotifyDownload on Apple Music: https://smarturl.it/CintaLuarBiasa/applemusicStream on Joox: https://smarturl.it/CintaLuarBiasa/jooxHa- aa-aaU-uu -uuKau t'rimaku apa adanyaWalauku banyak kekuranganMemang sulit tuk dapatkanmuTak mudah juga tuk lepaskanmuOh, percayalah sayangHatiku ini hanya untukmuBerjalanlah bersamakuKita nikmati indahnyaCintaSayangkuCintakuKuberuntung jadi pemilik hatimuKusayang kamuKucinta kamuKuberjanji tak akan permainkanmuTetap bersamaku sayangSampai tua nantiHu-uu-uHa-ohOh, percayalah sayangHatiku ini hanya untukmuBerjalanlah bersamakuKita nikmati indahnya cintaSayangku (sayangku)Cintaku (cintaku)Kuberuntung jadi pemilik hatimuKusayang kamu (sayangku)Kucinta kamu (cintaku)Kuberjanji tak akan permainkanmuTetap bersamaku sayangSampai tua nantiHo -oh (segalanya untukku sayang)(Sampai tua, selamanya dirimu sayang) Hu uu-uu(Tua nanti) nana-na na naHu-uu oh-ohhSayangku (sayangku)Cintaku (cintaku)Kuberuntung jadi pemilik hatimu (milik hatimu)Kusayang kamu (sayangku)Kucinta kamu (cintaku)Kuberjanji tak akan permainkanmuOh sayangku (sayangku)Cintaku (cintaku)Kuberuntung jadi pemilik hatimu (milik hatimu)Kusayang kamu (sayangku)Kucinta kamu (cintaku)Kuberjanji tak akan permainkanmuTetap bersamaku sayangSampai tua nantiHi-uhOh oo oo(Tetap bersamaku sayang)Sampai tua nantiTetaplah bersamakuExecutive Producer By Lina Priscilla for Hits RecordsA&R : Keke Kananta Song & Lyrics : Andmesh KamalengArranger : Aldi Nada PermanaMixing & Mastering : Aldi Nada PermanaVocal Director : IrvnatEngineer : Aldi Fachrobby @ Bro’s StudioPublishing : PT. Star Cipta MusikindoVideo Production by KAUSADirector: Isdam AtrahadenaCreative Director: Vega PrabumiVenue: Glamping Lakeside Music Video Supervisor : Gilang RamadhanBehind The Scene Coordinator : Arga NalendraTalents : Vannes  (ig : @nvannes)Subscribe Our Channel, Please Click This: http://goo.gl/sCxygACatch us on SNS :https://twitter.com/HITSRechttps://www.facebook.com/HitsRecordsofficialhttps://instagram.com/hits_recordsOfficial Site: www.hitsrecords.co.idDon't re-upload our content but you can share our video. © 2020 Copyrights & Trademark by HITS RECORDS"
"PfarlIhl4uo","『ウルトラマンＺ』第2話「戦士の心得」-公式配信- ULTRAMAN Z Episode 2 -Official-","2020-06-27T00:28:11Z","UC5PBnSG7C0WXp5gjd4bzKtw","ウルトラマン公式 ULTRAMAN OFFICIAL by TSUBURAYA PROD.","1","20.28.06","ウルトラマンＺ|ULTRAMAN Z|田口 清隆|平野 宏周|松田 リマ|橋爪 淳|黒木 ひかり|青柳 尊哉|野田 理人|小倉 久寛|ウルトラマンゼロ|ULTRAMAN ZERO|赛罗奥特曼|อุลตร้าแมนซีโร่|ウルトラマンジード|ULTRAMAN GEED|捷德奥特曼|อุลตร้าแมนจี๊ด|セブンガー|濱田 龍臣|ウインダム|遠藤正明|玉置成実|畠中祐|宮野真守|福原かつみ|かっこいい|楽しい|メカ|ロボット|かわいい","694149","18966","387","3269","https://i.ytimg.com/vi/PfarlIhl4uo/default.jpg","False","False","【subscribe】→ http://m-78.jp/ultrach/公式映像を配信中！Ch登録-はこちらをClick！★STORY↓ストレイジの新たなミッション。それは自在に姿を消す透明怪獣ネロンガの討伐だ。セブンガーの電気を吸収するネロンガに苦戦するハルキ。ストレイジはネロンガを倒すために新たな作戦を立案する。果たしてハルキは、そしてゼットはネロンガを攻略することができるのか！？#ウルトラマンＺ #ウルトラマンゼロ■━━━━━━━━━━━━━━━━━■　 ウルトラマンスタンプ・チャレンジ ■━━━━━━━━━━━━━━━━━■　スタンプ、壁紙、時々商品GET⁉集めて得するスマホスタンプカード登場！☆　YouTube 見逃し配信限定で　☆＼＼ 月替わりスタンプGET！ ／／=============================▼【6月スタンプ配信中】▼下記URLをクリックしてスタンプスアプリをダウンロード！https://stamp.sc/dp?s=na&d=9f98b9edff28f55d805c&p=0※登録済の方はそのままスタンプGETできます。※楽しみ方は登録ページ下部をご参照ください！"
"gbhRr0RYDMw","BINTANG EMON DARI GA SENGAJA SAMPE NARKOBA🔴","2020-06-17T05:05:11Z","UCYk4LJI0Pr6RBDWowMm-KUw","Deddy Corbuzier","24","20.28.06","bintang emon|novel baswedan|ga sengaja|klarifikasi|lucu|komedi|kasus|deddy corbuzier","10144152","597720","8457","53047","https://i.ytimg.com/vi/gbhRr0RYDMw/default.jpg","False","False","#bintangemon #narkoba"
"fSv6UgCkuTU","「一席一果」——怒江边上的荔枝【滇西小哥】","2020-06-24T12:07:00Z","UCQG_fzADCunBTV1KwjkfAQQ","滇西小哥 Dianxi Xiaoge","22","20.28.06","Ms Dianx|Điền Tây Tiểu Ca|雲南|雲南美食|鄉間美食|云南|云南美食|乡间美食|dianxixiaoge|滇西小哥|荔枝|Litchi|Lychee","4656073","114749","3208","5862","https://i.ytimg.com/vi/fSv6UgCkuTU/default.jpg","False","False","怒江让云南这个地方多了一份神奇，怒江边上能种很多热带的水果，荔枝，芒果，香蕉，鸡蛋果等等。酷热的夏天，去采了些晶莹剔透的荔枝，做一些我家里人没有吃过的菜，水晶荔枝虾球、冰爽荔枝啤酒、荔枝脆皮烤鱼......这个新鲜的味觉体验，既解暑又满足～※Click cc on the lower right menu to choose your subtitle language.Salween River adds a magical touch to Yunnan with multiple tropical fruits growing alongside the riverbank, such as lychees, mangoes, bananas and egg fruits (canistel) I picked some lychess during the hot summer and made dishes rare to my families. I made shrimp balls with crystal lLychees, refreshing lychee beer and roast fish with lychees. The novel taste of lychee dishes drives the hotness away and is very satisfying.大家好！我是滇西小哥，一个地道的云南妹子，如果你喜欢我的视频，请持续关注我的频道，我会在不同的平台分享我的生活，以及云南特色美食，祝你们天天开心，每天都有美食相伴～YouTube【滇西小哥 Dianxi Xiaoge】▶️https://bit.ly/2MH1T5NFacebook【滇西小哥 Dianxi Xiaoge】 ▶️https://bit.ly/2TsGflrInstagram【dianxixiaoge_apenjie】▶️https://bit.ly/2WagkzeMusic Production▶@Sam Lin Music  #滇西小哥 #DianxiXiaoge #ĐiềnTâyTiểuCa"
"jmqNoTDiUi4","Happy Asmara - Banyu Moto [OFFICIAL]","2020-06-23T01:00:17Z","UCkKwFOqr6CTEwO3frYn7wiQ","DSA RECORD","10","20.28.06","banyu moto dory harsa|banyu moto nella kharisma|banyu moto sleman receh|banyu moto|banyu moto safira inema|banyu moto vita alvia|ku puja puja|denny caknan|happy salah|happy asmara dalan liyane|happy asmara trending|nella kharisma|nella kharisma official|music yess|dsa record|nella lover|ambyar|sobat ambyar|Danendra Suara Abadi","541984","8884","302","547","https://i.ytimg.com/vi/jmqNoTDiUi4/default.jpg","False","False","Happy asmara - Banyu moto [OFFICIAL]Banyu motoVoc. Happy AsmaraCipt. Heri Marwanto (Sleman Receh)Arranger : DFA musicAlbum : Happy asmaraProduksi : Dsa RecordInstagram :https://www.instagram.com/dsa_recordklik untuk subscribe :https://www.youtube.com/channel/UCkKwFOqr6CTEwO3frYn7wiQ?sub_confirmation=1Lirik :Banyu MotoTembang iki tak gaweMung kanggo koweSing paling tak tenaniNganti saikiTumetese banyu moto ikiSing dadi saksiSumpah lan janjiSehidup semati ReffSampai kapan kan kau buktikanTresno tulus yo mung kanggo awakkuSampai mati kan ku pastikanMergo mung kowe sing tak tresnani tekane mati Cahyo lintang ing wengi Gawe anyeme atiTambah nggegowo roso kangen Mring sliramu, tresnakuklik link di bawah ini untuk menonton video lainnya :Happy asmara - Yang maha mengabulkan [OFFICIAL]https://www.youtube.com/watch?v=Sm4Zzh4LrJ8Happy asmara - Tatu Dj remix[OFFICIAL]https://www.youtube.com/watch?v=RBGBfHvBe0sHappy asmara - Dinggo bukti [OFFICIAL]https://www.youtube.com/watch?v=f07Kw0Om7HIHappy asmara - Nyerang es teh [OFFICIAL]https://www.youtube.com/watch?v=bsc5ZNx3FokHappy asmara - Penipu alus [OFFICIAL]https://www.youtube.com/watch?v=C5BlFSkuMUkHappy asmara - Tatu [OFFICIAL AUDIO]https://www.youtube.com/watch?v=5Cxtovlm_xYHappy asmara - Aku tenang [OFFICIAL]https://www.youtube.com/watch?v=MVF_U0-8dKsHappy asmara - Rela demi cinta [OFFICIAL]https://www.youtube.com/watch?v=5F61m4HRetEHappy asmara - Yakinlah sayang [OFFICIAL]https://www.youtube.com/watch?v=_xyTdekFcksHappy asmara - Nembung Katresnan [OFFICIAL]https://www.youtube.com/watch?v=WLrfXwok2REHappy asmara - Konco Uripku [OFFICIAL]https://www.youtube.com/watch?v=oe3zzDHCrtgHappy Asmara - Welas hang ring kene [OFFICIAL]https://www.youtube.com/watch?v=dlc9kqF6jbINella Kharisma - Ora dolan [OFFICIAL]https://www.youtube.com/watch?v=220dWP-y6TUNella Kharisma - Di rabi mantan [OFFICIAL]https://www.youtube.com/watch?v=F-Tw4IhbgJoNella kharisma - Mendem cinta [OFFICIAL]https://www.youtube.com/watch?v=nRHhzwJlCUINella kharisma - Sayangen aku [OFFICIAL]https://www.youtube.com/watch?v=d_WMuLCVCSkYouTube channel managed by MusicYes Digital DistributionFully YouTube CertifiedJoin MusicYeshttps://musicyess.com/Account/Register#HappyAsmara #BanyuMoto #Dangdut"
"Ei5GgRyRb3w","MAELL LEE VS MAMAK MAMAK","2020-06-25T13:15:30Z","UCgYmNAhjfv5GYWBOfzp831Q","Maell Lee","23","20.28.06","maelle|maellers|bukan|kaleng|gak ada otak kau|kuretakkan|ginjal|kau|video baru maell lee","831238","31964","677","1794","https://i.ytimg.com/vi/Ei5GgRyRb3w/default.jpg","False","False","GAK FOLLOW RETAK GINJAL KAU!!!INSTAGRAM @maell_leehttps://www.instagram.com/maell_lee/@rama_djarothttps://www.instagram.com/rama_djarot/@rudypoetraahttps://www.instagram.com/rudypoetraa/@rubbypakhoyhttps://www.instagram.com/rubbypakhoy/@awekxsitepuhttps://www.instagram.com/awekxsitepu/BUSINESS INQUIRIESEmail : maelllee.management@gmail.comTelp : 082210013138 (egy) - 0818951886 (robert)"
"8yvhX07l58E","BLACKPINK - 'How You Like That' M/V | BLEKJEK REACTION (INDONESIA)","2020-06-26T11:00:13Z","UCKmnQK_4cVjPHhXXo_OI5qw","eJ Peace","23","20.28.06","yg entertainment|yg|와이지|k-pop|blackpink|블랙핑크|블핑|제니|로제|리사|지수|lisa|jisoo|jennie|rosé|blink|블링크|how you like that|blackpink how you like that|블랙핑크 how you like that|hylt|blackpink hylt|블랙핑크 hylt|hylt mv|how you like that mv|EJ PEACE|BLEKJEK|INDONESIA|PARODY","156670","15170","177","924","https://i.ytimg.com/vi/8yvhX07l58E/default.jpg","False","False","HOW YOU LIKE THAT PARODY SOON---------------------------------------------------------------Follow us on Instagramhttps://www.instagram.com/ejpeace.ent...https://www.instagram.com/ejprecords/EJ https://www.instagram.com/great.ej/DENA https://www.instagram.com/maulanahasyim_/GOOD https://www.instagram.com/bagud_rp/DAYAT https://www.instagram.com/raflihidayatulloh/Follow us on Twitterhttps://twitter.com/ejpeace_ent____________________________________For Business or Any Other Inquirers :ej.peace2@gmail.com___________________________________#blackpink #blekjek #ejpeace #parody"
"E30BuL9-0Vk","[BE ORIGINAL] SEVENTEEN(세븐틴) 'Left & Right' (4K)","2020-06-24T15:30:05Z","UCEIi7zFR_wE23jFncVtd6-A","STUDIO CHOOM [스튜디오 춤]","24","20.28.06","M2|엠투|스튜디오 춤|스춤|Studio choom|COVERS|커버스|DANCE THE X|댄스 더 엑스|댄스|DANCE|비 오리지널|BE ORIGINAL|커버|COVER|세븐틴|SEVENTEEN|호시|Hoshi|우지|Woozi|정한|Jeonghan|원우|Wonwoo|조슈아|Joshua|민규|Mingyu|준|Jun|승관|SeungKwan|에스쿱스|S.COUPS|버논|Vernon|도겸|DK|디노|Dino|디에잇|THE8|seventeen|세봉|빅히트|bighit|Left & Right","1907959","244919","593","9174","https://i.ytimg.com/vi/E30BuL9-0Vk/default.jpg","False","False","[BE ORIGINAL] SEVENTEEN 'Left & Right' [비 오리지널] 세븐틴 'Left & Right' 청춘물? 세븐틴 BE ORIGINAL 봐야지🙌스춤으로 세봉이들 청량에너지 완충🔋(2:21) 요정 윤정한 비쥬얼 보고가세요🤗Stream various performance video on STUDIO CHOOM!👉SUBSCRIBE👈YouTube: https://www.youtube.com/STUDIOCHOOMFacebook:  https://www.facebook.com/StudioCHOOMInstagram: https://www.instagram.com/studio_choom/Naver TV: https://tv.naver.com/cjenm.STUDIOCHOOM"
"dE4dmRIy0D0","ASHANTY AKHIRNYA MENJAWAB (krisdayanti - Raul Lemos - Aurel - Azriel)","2020-06-25T07:41:24Z","UCYk4LJI0Pr6RBDWowMm-KUw","Deddy Corbuzier","24","20.28.06","ashanty|anang|KRISDAYANTI|raul lemos|aurel|azriel","4398642","262394","3737","17121","https://i.ytimg.com/vi/dE4dmRIy0D0/default.jpg","False","False","#ashanty #aurel #krisdayanti"
