video_id,title,publishedAt,channelId,channelTitle,categoryId,trending_date,tags,view_count,likes,dislikes,comment_count,thumbnail_link,comments_disabled,ratings_disabled,description
"tcrShKrB6cs","Glenn Fredly - Itu Saja ft. Mutia Ayu (Official Music Video)","2020-08-19T13:00:09Z","UCIw7Fc-CHTG1dH62aCaEmEw","Glenn Fredly","10","20.28.08","itu saja|glenn fredly|glenn feat mutia ayu|mutia ayu|glenn fredly feat mutia ayu|itu saja glenn fredly|itu saja lirik|itu saja musik video|video sedih|mutia ayu glenn fredly|glenn fredly itu saja|lagu baru|video lirik|video klip itu saja|viral|video tiktok|tiktok song|tiktok viral|trending|itu saja mutia ayu|akhir cerita cinta|musik bagus|musikbagus|lagu baru 2020|lagu galau terbaru","1452480","134678","659","8969","https://i.ytimg.com/vi/tcrShKrB6cs/default.jpg","False","False","Apakah cinta sejati dan rindu akan selalu menjadi kata tanpa tanda baca, karena setiap angan manusia memiliki teater yang di dalamnya ketiga kata tersebut berperan berbeda-beda. Pada akhirnya kata-kata ini kembali menjadi nilai kemanusiaan yang abadi, lebih kekal dari raga dan lebih menjaga dari dermaga.Single “Itu Saja” merupakan sebuah lukisan bernada yang mengartikan dengan sederhana makna cinta sejati melalui rasa rindu. Lagu ini dikemas menjadi hadiah yang manis dari Mutia Ayu untuk mendiang Glenn Fredly, sebagai tanda satu tahun perayaan pernikahan keduanya.Selamat menikmati, single “Itu Saja” juga sudah dapat teman-teman dengarkan di seluruh digital musik platform kesayangan kalian (Joox), (Spotify), (Apple Music), (Deezer). Jangan lupa untuk subscribe, like, dan share ke kerabat, sanak saudara dan keluarga terkasih.“Kangen kamu, Itu Saja.”_________________________________Song writer : Glenn FredlyMusic producer : Rayendra Sunito, Rifka RachmanPiano and synth : Rifka RachmanDrum programming : Rayendra SunitoAc. and El. Guitar : Andre DinuthBackground Vocals : Renita MartadinataVocal director : Bowo SoulmateVocal editor : RioexondulMixing : Rayendra SunitoMastering : Bonar AbrahamExecutive Producer : Bumi EntertainmentA Bumi Entertainment ProductionStarring : Glenn Fredly & Mutia AyuExecutive Producer : Mutia Ayu & Rachel Sutanto LatuihamalloProducer : Kinasih SaraswatiLine Producer : Rolando OctavioDirector : Crist TariganCreative Director : Ismi PuspitaDOP : Crist Tarigan & Debast JatinEquipment Guard : MaxianoBTS Photographer & Videographer : HezronEditor : Crist TariganMUA : Marlene HarimanHair do : TiniWardrobe : PhangsannyStylist : Wulan Logistik : Rani Nur AfsariSong cover artwork design : Yulius CarloPhotograph : Crist Tarigan_________________________________Akun dikelola oleh Bumi EntertainmentConnect with ushttps://www.instagram.com/glennfredlymusik/https://www.instagram.com/mutia_ayuu/https://www.instagram.com/bumientertainment/"
"O1A2fiX3GT4","Epic MotoGP Last Lap | 2020 StyrianGP","2020-08-23T23:00:05Z","UC8pYaQzbBBXg9GIOHRvTmDQ","MotoGP","17","20.28.08","motogp|moto2|moto3|crash|overtake|rossi|marquez|clash|suzuki|yamaha|honda|ducati|aprilia|ktm|redbull|repsol honda|marquez crash thailand|quartararo|fabio quartararo|quartararo marquez|sepang 2015|rossi marquez 2015|sepang clash|dovizioso|malaysia motogp|qatargp|americasgp|argentinagp|spanishgp|frenchgp|italiangp|catalangp|germangp|czechgp|dutchgp|finnishgp|sanmarinogp|aragongp|thaigp|japanesegp|australiangp|malaysiangp|valenciagp","1800615","25307","551","2062","https://i.ytimg.com/vi/O1A2fiX3GT4/default.jpg","False","False","Relive the breathtaking final lap of the #MotoGP race at Styria as Espargaró, Miller and Oliveira battled for the 900th premier class race victory!#AustrianGPVisit The Official Website: http://www.motogp.com/enOfficial App on iTunes: http://bit.ly/MotoGPAppItunesOfficial App on Google Play: http://bit.ly/MotoGPAppGooglePlayBuy your VideoPass: http://bit.ly/1VideoPass  Buy your TimingPass: http://bit.ly/TimingPassFollow MotoGP on Instagram: https://www.instagram.com/motogp/Like MotoGP on Facebook: http://www.facebook.com/MotoGPFollow MotoGP on Twitter: http://www.twitter.com/MotoGPFollow MotoGP on TikTok: https://www.tiktok.com/@motogpSubscribe to MotoGP on YouTube: http://goo.gl/IV00sBuy the Official MotoGP Merchandise: http://bit.ly/1XeSqhz"
"Kg4c6k_Fzc4","Akhirnya Alwi Bertemu Dengan Judika | Selebrita Siang 19/08/2020","2020-08-19T04:53:21Z","UC4tpqQ4Ti9XoC0g0CLM0TFA","Selebrita7. com","24","20.28.08","selebrita|selebrita7|hot gosip|trans7|reality artis|kasus artis|gosip hari ini","640606","9317","306","660","https://i.ytimg.com/vi/Kg4c6k_Fzc4/default.jpg","False","False","Program yang menayangkan info terkini dari selebritis indonesia.Berita seputar kegiatan artis maupun gosip artis, kami sajikan hanya di Selebrita. -------Selebrita Pagi dan Siang                     : Senin - Jumat pukul 07.30 & 10.30 WIB Selebrita Pagi dan On The Weekend : Sabtu & Minggu 07.30 & 11.00 WIBSeleb Expose                                          : Sabtu & Minggu 15.00 WIBhanya di Trans7-------Follow usTwitter: @Selebrita7Instagram :@Selebrita7 Youtube : Selebrita7"
"BIQBixqgCz0","Anya Geraldine Putus, Rizky Febian Tancap Gas? - iSeleb 26/08","2020-08-26T08:38:45Z","UCy1TDp6C5KoKMMaFqVX8qqg","iSeleb","24","20.28.08","iNews|i-Tainment|Gosip|Gossip|Selebriti|Entertainment|Artis|Selebgram|keanu agl|viral|trending|iseleb","72966","514","32","62","https://i.ytimg.com/vi/BIQBixqgCz0/default.jpg","False","False","Tanggal Tayang: 26/08/2020iSeleb menyajikan informasi terkini seputar dunia selebriti mulai dari kisah hidup, kontroversi, hingga sensasi.Subscribe iNews Official Youtube Channel:https://www.youtube.com/OfficialiNews?sub_confirmation=1dan subscribe iSeleb Youtube Channel:https://www.youtube.com/channel/UCy1TDp6C5KoKMMaFqVX8qqg?sub_confirmation=1Follow Our Official Twitter: https://twitter.com/OfficialiNewsTVCheck Our Official Website: https://www.inews.idLike Our Official Facebook: https://www.facebook.com/OfficialiNewsFollow Our Official Instagram: https://www.instagram.com/officialinewstvSabang, Lampung, Pelaihari, Banjarmasin, Masohi - 50 UHF | Lhokseumawe, Jabodetabek - 30 UHF | Banda Aceh - 40 UHF | Medan, Pontianak, Semarang - 45 UHF | Pematang Siantar - 58 UHF | Pekan Baru - 48 UHF | Tanah Datar, Bukit Tinggi, Palangkaraya - 33 UHF | Padang, Cirebon - 31 UHF | Batam, Samarinda - 61 UHF | Palembang, Kendari - 44 UHF | Pangkal Pinang - 37 UHF | Bengkulu, Merauke - 24 UHF | Bandung - 22 UHF | Tasikmalaya - 52 UHF | Magelang - 54 UHF | Surabaya - 62 UHF | Denpasar - 53 UHF | Mataram - 38 UHF | Kupang, Gorontalo 56 UHF | Makassar - 51 UHF | Mamuju - 28 UHF | Tarakan - 41 UHF | Palu - 45 UHF | Manado - 26 UHF | Ternate, Manokwari - 34 UHF | Indovision -Channel 83 |Top TV - Channel 83 | Okevision - Channel 101"
"hkN5FmhqiwQ","DYNAMITE - BTS (cover by Ghea Indrawari) | Live at MTRLS","2020-08-26T11:49:44Z","UC-5bSboxRIAc8okL83azS2g","Ghea Indrawari","24","20.28.08","Ghea Indrawari|ghea|idol|indonesian idol|BTS|Dynamite|Cover|army|cover|vocal cover|acoustic cover|ghea idol|kpop|kpoper|korean|korea|boyband","67445","11893","141","728","https://i.ytimg.com/vi/hkN5FmhqiwQ/default.jpg","False","False","Song by: BTSMusic by: @andrewjoschaProduction by MTRLS Follow MTRLS Studio: Youtube : https://www.youtube.com/channel/UCPS7Ya0hIi_wQIxpZ1keybwInstagram :  https://instagram.com/mtrls.studio?igshid=1sopuz6ex2417====================Contact Person: indrawarighea@gmail.comJob: +6281388396186 (Rajib)===================="
"n4fXmZTVdZg","Real Life Robot Dog","2020-08-24T22:05:58Z","UCRijo3ddMTht_IHyNSNXpNQ","Dude Perfect","17","20.28.08","dude perfect|dude perfect stereotypes|dude perfect water bottle flip|bottle flip|water bottle flip|dude perfect bottle flip|dude perfect basketball|dp|dude perfect world record|edition|nerf|trick shots|trick shot|family|ping pong|bowling|clean|family friendly|bubble wrap|soccer|football|spinner|spinners|fidget spinners|dude","15327161","523321","17068","26419","https://i.ytimg.com/vi/n4fXmZTVdZg/default.jpg","False","False","Games with Consequences is back, and a real life ROBOT DOG.. YES! Time for OT17!Thanks to PGA TOUR 2K21 for sponsoring this video! Click HERE to get download the game for yourself: http://dudeperfect.com/PGA2k21/► Thanks for subscribing! - http://bit.ly/SubDudePerfectThe FedEx Cup Championship are going on RIGHT NOW! In the game you can play and access these same courses!NEXT LEVEL STUFF -------------------------------------------🎒 NEW Merch - http://bit.ly/DPStore🎮 Play our FREE iPhone game! - http://smarturl.it/DudePerfect2📱 Text us - (469) 205-7005🔔 Hit the bell next to Subscribe so you don't miss a video!👨🏻‍💻 Watch our newest vids! - http://bit.ly/NewDPVids📕 Read our Book - Go Big - http://amzn.to/OYdZ2sFollow our Instagrams so we can be best friends -------------------------------------------🏆 http://Instagram.com/DudePerfect🧔🏻 http://Instagram.com/TylerNToney👱🏻‍♂️ http://Instagram.com/Cody_Jones_🙋🏻‍♂️ http://Instagram.com/CobyCotton👨‍🦰 http://Instagram.com/GarrettHilbert⛹🏻‍♂️ http://Instagram.com/CoryCotton-------------------------------------------Bonus points if you're still reading this! Comment: What our next Wheel Unfortunate should be!!!Click here to learn more about Dude Perfect:http://bit.ly/AboutDudePerfectAs always...Go Big and God Bless!- Your friends at Dude PerfectBusiness or Media, please contact us at: Dude@DudePerfect.com------------5 Best Friends and a Panda.If you like Sports + Comedy, come join the Dude Perfect team!Best known for trick shots, stereotypes, battles, bottle flips, ping pong shots and all-around competitive fun, Dude Perfect prides ourselves in making the absolute best family-friendly entertainment possible! Welcome to the crew! Pound it 👊🏻 Noggin 🙇🏻‍♂️ - Dude Perfect"
"5crMc4ZxDp8","Apakah Itu Cinta - Lala Widy Feat Gerry Mahesa ( Official Music Video )","2020-08-20T13:00:12Z","UCcSVA15A6UNouOvHsixy1ng","PT. MUSIK PERDANA KREATIVA","10","20.28.08","New Monata 2020|New Monata 2019|New Monata Los dol|New Monata Dalan liyane|Apakah itu cinta|apakah itu cinta monata|apakah itu cinta koplo|apakah itu cinta happy asmara|apakah itu cinta dj|apakah itu cinta new monata|apakah itu cinta full album|Live Streaming New Monata|apakah itu cinta Lirik|apakah itu cinta karaoke ipank|apakah itu cinta gerla|apakah itu cinta Vita Alvia|apakah itu cinta safira inema|apakah itu cinta tiktok|apakah itu cinta yang lagi viral","308447","3139","208","689","https://i.ytimg.com/vi/5crMc4ZxDp8/default.jpg","False","False","#LalaWidyFeatGerryMahesa  #ApakahItuCinta #Ipank  Official Music Video from Lala Widy feat Gerry Mahesa  Apakah Itu Cinta  Subscribe MPR Channel here: https://smarturl.it/SubscribeMPRStream Available on:https://backl.ink/142804673RBT : Coming Soon Songtitle    : Apakah Itu CintaVoc             : Lala Widy Feat Gerry Mahesa Music         : New MonataSongwriter : Ipank INFO MPRFacebook  : https://smarturl.it/FacebookMPRInstagram : https://smarturl.it/MPRinstagramTikTok       : https://vt.tiktok.com/DmGXDW/Whatsapp : 081232732672Lirik Lagu : Apakah Itu Cinta Cinta apakah itu cintaBertanya tanpa sengajaCinta berkorban jiwaIndah harum bermaknaHehehe... hehehe... heheheHaaa.haaa.haaaMmmm.Mmmm.MmmmOoo itukah cintaCinta oh cinta suciJanganlah kau nodaiMerintih diri sendiriMenangis di ruang sunyiPerasaan yang tanpa kabarTakkan tahu kapan dia datangMulianya hati jernihkan pikiranSiapkan iman kepada TuhanBila kau rindu pikiranmu tergangguBila kau dapah siaplah tuk berkorbanCinta yang suci duniakan abadiBila terkhianat ingatlah diriCinta yang suci duniakan abadiBila terkhianat ingatlah diriCinta oh cinta suciJanganlah kau nodaiMerintih diri sendiriMenangis diruang sunyiPerasaan yang tanpa kabarTakkan tahu kapan dia datangMulianya hati jernihkan pikiranSiapkan iman kepada tuhanBila kau rindu pikiran mu tergangguBila kau dapah siaplah tuk berkorbanCinta yang suci duniakan abadiBila terkhianat ingatlah diriCinta yang suci duniakan abadiBila terkhianat ingatlah diri"
"y8XJe3Zinm4","ALWIANSYAH DAN JUDIKA PERTAMA KALI DUET DI TV NIH! | SANTUY MALAM (26/8/20) P1","2020-08-27T07:33:34Z","UCIohHXwCEKxWCLvAguJ-GjA","TRANS TV Official","24","20.28.08","TRANSTV|TRANS TV|TRANSMEDIA|LIVE STREAMING TRANS TV|TRANS TV LIVE STREAMING|#StayHome|#WithMe|StayAtHome|#dirumahaja|TERBARU|ACARA TRANS TV|TRANS TV LIVE|TRENDIN|VIDEO TRENDING|TRENDING HARI INI","574507","12956","468","1323","https://i.ytimg.com/vi/y8XJe3Zinm4/default.jpg","False","False","SANTUY MALAM===TAYANG SETIAP HARI SENIN-JUM'AT PUKUL 19.00 WIB===PART 1: https://youtu.be/y8XJe3Zinm4PART 2: https://youtu.be/f8sFAFsGq1cPART 3: https://youtu.be/zL0zJ-39d8sPART 4: https://youtu.be/gZ5q-qL7RSo===Kangen sama komedinya Andre, Sule, Atau Nunung? Gimana kalau mereka disatukan 'kembali' ya? Apalagi ditambah dengan bintang tamu yang nggak kalah serunya. Setelah seharian kerja, saatnya dihibur oleh program baru kami, Santuy! Capek Seharian kerja? Lelah banyak masalah? Santuy-in aja bos!===WEBSITE - http://www.transtv.co.idTWITTER - https://twitter.com/TRANSTV_CORPFACEBOOK - https://www.facebook.com/TransTVMediaINSTAGRAM -  Uhttps://www.instagram.com/TRANSTV_CORP#NontonSantuyMalamSamaSaya  #SantuyMalamSamaSaya #SantuyMalam26Agustus2020"
"5DDNyFX9Zmo","How to Make Blackpink's How You Like That DROP LEAD!","2020-08-21T16:19:09Z","UC2G22-5R0-KCQGKJOUPktYQ","Eka Gustiwana","10","20.28.08","eka gustiwana","438274","36282","357","1379","https://i.ytimg.com/vi/5DDNyFX9Zmo/default.jpg","False","False","Sefruit tutorial cara bikin lead drop (bagian instrumental) dari How You Like That-nya Blackpink!Original Song:How You Like That - BlackpinkCheck Alwiansyah's Video:https://www.instagram.com/p/CCm2FG_FpLs/?igshid=1q2niuygbhsgt"
"cJkB1QFg3d0","KARNA KO - MACEPURBA X BELLO KARETH X D'ARI (OFFICIAL MUSIC VIDEO)","2020-08-19T00:52:44Z","UCfH8w5EY9ZIbwg1bgTuaVEw","Mace Purba","22","20.28.08","Mace Purba Karna Ko|Karna Ko Mace Purba|Mace Purba|Karna Ko|Mace Purba 2020|Karna Ko 2020|official Mace Purba video|Mace Purba official video|official Karna Ko|official Karna Ko video|D'Ari Karna Ko|Karna Ko D'Ari|D'Ari|D'Ari 2020|official D'Ari video|D'Ari official video|Bello Kareth Karna Ko|Karna Ko Bello Kareth|Bello Kareth|Bello Kareth 2020|official Bello Kareth video|Bello Kareth official video|official music video|mace purba dari|terbaru","510819","19107","196","888","https://i.ytimg.com/vi/cJkB1QFg3d0/default.jpg","False","False","WEKAMMMMMMM!!!!!Yoyoyoyo Selamat menikmati HIDANGAN dari kami berTIGA JANGAN LUPA SHARE , LIKE , COMMENT DAN PALING PENTING ITU SUBSCRIBE SUPAYA KAM TRA KETINGGALAN TONG PU LAGU TERBARU TERIMAKASIH BUAT KAM YANG SELALU SETIA BERSAMA KAMI AKHIR KATA SALAM OLAHRAGA!!!#MacePurba #KarnaKo #OfficialMusicVideo"
"RaG_tSbYdrM","NGOBROL SANTAI BARENG AHMAD DHANI","2020-08-22T05:00:04Z","UCTgu78pYt2h1N87lHwT0Vpw","Rhoma Irama Official","22","20.28.08","rhoma irama|rhoma|irama|Ahmad dhani|ahmad dhani dewa|video legend|soneta|soneta group|studio soneta group|Rhoma Irama Ahmad Dhani|Rhoma Irama full album|roma irama|Rhoma Irama official|tulus hati luhur budi|musisi|dangdut","356700","11906","233","1794","https://i.ytimg.com/vi/RaG_tSbYdrM/default.jpg","False","False","Musisi Ahmad Dhani berkunjung ke studio Soneta Rhoma Irama, dan membahas banyak hal bersama Rhoma Irama.Jangan lupa untuk Like, Share, Comment, Subscribe dan klik tombol notifikasi agar tidak ketinggalan video exclusive terbaru RHOMA IRAMA dan SONETA GROUP lainnya.Kunjungi Website Resmi dan Follow Media Sosial resmi Rhoma Irama:https://www.rhomairama.infohttps://www.instagram.com/rhoma_officialhttps://www.facebook.com/RI.rhomairama/https://www.twitter.com/@rhoma_official"
"-5u_QqI4Hbg","Tom & Jerry | Jerry, the Master of Tricks! | Classic Cartoon Compilation | WB Kids","2020-08-22T15:00:00Z","UC9trsD1jCTXXtN3xIOIU8gg","WB Kids","1","20.28.08","Scooby-Doo!|Tom and Jerry|Looney Tunes|Bugs Bunny|Compilation|Cartoons|Classic Cartoons|Animation|full episodes|Scooby doo where are you|chuck jones|Mel Blanc|Spike the Dog|Daffy Duck|Porky Pig|Coyote & Roadrunner|TJ|CLASSIC","2947164","16603","5754","0","https://i.ytimg.com/vi/-5u_QqI4Hbg/default.jpg","True","False","Between Tom and Jerry, we think that Jerry definitely wins in the tricking department!Catch up with Tom & Jerry as they chase each other, avoid Spike, and play with friends like Little Quacker and Butch the cat.WB Kids is the home of all of your favorite clips featuring characters from the Looney Tunes, Scooby-Doo, Tom and Jerry and More!Tom & Jerry available on digital!MORE VIDEOS HERE ►https://www.youtube.com/channel/UC9trsD1jCTXXtN3xIOIU8gg MORE GAMES & ACTIVITIES HERE ►https://www.wbkidsgo.com/All Warner Bros. related characters and elements © & ™ Warner Bros. Entertainment Inc. (s20)"
"lTzs0O0FkV0","RIZKY BILLAR DAN LESTI KEJORA BIKIN BAPER.. ANDRE SETUJU KALAU MEREKA JADIAN","2020-08-25T10:00:30Z","UC6SPCnTAIanF2_8ST2wrQzw","TAULANY TV","24","20.28.08","TAULANY TV|TAULANY|TV|ANDRE TAULANY|RIZKY BILLAR|DEDE|RIZKY|BILLAR|LESTY|KEJORA|LESTY KEJORA|ANJAY|BAPER|PASANGAN|COUPLE|VLOG|SCTV|VIRAL|TALKSHOW|COMEDY|TONO|TEH TONO|RAFFI AHMAD|THE SULTAN|SULTAN|LESTI|LESTI KEJORA","1061194","95136","503","9678","https://i.ytimg.com/vi/lTzs0O0FkV0/default.jpg","False","False","FOLLOW INSTAGRAM TAULANY TV : https://www.instagram.com/taulany_tv/taulany tv adalah channel yang sangat menghibur, serta ada berbagai karakter yang di mainkan oleh komedian ternama andre taulany,...yuk di tonton videonya sampai habis...sama sama bangun channel ini untuk menjadi channel yang bisa menghibur serta membuat kehidupan ini jauh lebih kocak... jangan lupa di like subscribe dan comment,...share juga kepada orang terdekat kalian."
"8Qdf0JQq4p4","ZARA ADHISTY, TEMEN NYA BH4NGSAT⁉️ feat Boris Bokir- Deddy Corbuzier Podcast","2020-08-25T04:12:25Z","UCYk4LJI0Pr6RBDWowMm-KUw","Deddy Corbuzier","24","20.28.08","zara adhisty|pacaran|pacar|video|viral|parah|cewe|cowo","2205581","80293","3589","11480","https://i.ytimg.com/vi/8Qdf0JQq4p4/default.jpg","False","False","#zaraadisty #deddycorbuzier #podcast"
"6hk4EnasAIo","MENGGIURKAN! Unboxing Infinix ZERO 8, Seri yang Bangkit dari Kubur!","2020-08-28T00:00:01Z","UC_I2Xa7VKqWqJO5nzwRUxhQ","GontaGantiHape","28","20.28.08","Bahasa|Indonesia|Melayu|Malay|Malaysia|Unboxing|Infinix|ZERO 8|Infinix Zero 8|Mediatek|Helio G90T|NFC|XOS|flash sale|lazada","42858","1596","41","923","https://i.ytimg.com/vi/6hk4EnasAIo/default.jpg","False","False","Infinix Official Store: https://invol.co/cllib7Cari TWS Bagus?- Di bawah 300-ribu: https://smarturl.it/GGT_300K- Di bawah 500 ribuan: https://smarturl.it/GGT_500K- Di bawah 1 juta: https://smarturl.it/GGT_1M- Di atas 1 juta: https://smarturl.it/GGT_PREMIUMCari Smartwatch Murah?- Di bawah 300-ribu: https://smarturl.it/GGW_300K- Di bawah 600 ribuan: https://smarturl.it/GGW_600K- Di bawah 1 juta: https://smarturl.it/GGW_1M- 1-2 juta: https://smarturl.it/GGW_2M- Di atas 2 juta: https://smarturl.it/GGW_PREMIUMBelanja di Shopee? Klik aja: https://bit.ly/GontagantihapeShopeeBEKAS REVIEW kadang DIJUAL di: https://smarturl.it/SHOPEE_GGHPTrack: South London HIFI - Sunrise DriveMusic provided by Youtube Audio Library.e-mail for business inquiry: irfanoize@gmail.com#MadewithFilmora"
"cr0M8y1KA3M","Saat Teduh Bersama - Komitmen Mengikut Yesus | 26 Agustus 2020 (Official Philip Mantofa)","2020-08-26T13:20:40Z","UCaxNFw2ryxzjSAxRVP-0Dfg","Philip Mantofa","29","20.28.08","[none]","85658","7041","77","789","https://i.ytimg.com/vi/cr0M8y1KA3M/default.jpg","False","False","Welcome Home! Senang sekali Anda dapat bergabung dengan kami. Untuk permohonan doa dapat dikirimkan ke https://gms.church/form. Tuhan Yesus MemberkatiSaat Teduh Bersama Ps Philip Mantofa Setiap Rabu & Sabtu, pukul 19.00 WIBDi YouTube dan Instagram Live @philipmantofa .Follow PHILIP MANTOFAYouTube: http://www.youtube.com/philipmantofaministryWebsite: http://www.philipmantofa.com/Facebook: https://www.facebook.com/ps.philip.mantofaTwitter: https://twitter.com/philipmantofainstagram: https://www.instagram.com/philipmantofa#StayHome #PhilipMantofa #GMSChurch #SaatTeduhBersama"
"-JZlu1qP8YI","SABYAN X HANIN DHIYA - FATIMAH AZ ZAHRA (OFFICIAL MUSIC VIDEO)","2020-08-21T08:00:12Z","UCeZA77FZSG4YzBcvBJ9eynA","SABYAN","10","20.28.08","nissa|sabyan|nissa sabyan|sabyan gambus|lagu sabyan|sabyan terbaru|sabyan hanin|sabyan hanin dhiya|nissa sabyan hanin|nissa sabyan hanin dhiya|sabyan dan hanin|nissa sabyan dan hanin|nissa hanin|nissa hanin dhiya|nissa dan hanin|nissa dan hanin dhiya|sabyan hanin fatimah az zahra|sabyan hanin fatimah|sabyan dan hanin fatimah|nissa hanin fatimah az zahra|sabyan feat hanin|sabyan feat hanin dhiya|nissa sabyan feat hanin|nissa sabyan feat hanin dhiya","374839","43933","197","16582","https://i.ytimg.com/vi/-JZlu1qP8YI/default.jpg","False","False","SABYAN X HANIN DHIYA - FATIMAH AZ ZAHRA Cipt : AyusPutri tercinta suci tuk slamanyaTangguh menyusuri getir rasa duniaJari tangan mu basuhi tubuhnyaDari nistaan yang menghujam sang rosulullahReff :Ooh fatimah, rosul menyayangibintang fajar melekat di ujung nama manismuBaju pelindung yg menjadi pengikat cintamu dengan pilihan rosulKau pemimpin wanita di surgaTiada yang lebih harta di milikiKalung memori pun kau lepas tuk yang lainReff :Ooh fatimah, rosul menyayangibintang fajar melekat di ujung nama manismuBaju pelindung yg menjadi pengikat cintamu dengan pilihan rosulKau pemimpin wanita di surgaMenangis seketika tertawaDi akhir usia rosul berbisikKau segera menyusulnya_________________________________Location : Vila Air Natural Resort, Bandung @vilaairnaturalresorthttps://instagram.com/vilaairnaturalresort?igshid=rn4vw0oqw4xaSand Art by @aberubio_sandartisthttps://instagram.com/aberubio_sandartist?igshid=s48jh2nitbsuFollow instagram Sabyan Gambushttps://www.instagram.com/sabyan_gambus//Follow instagram Hanin Dhiyahttps://instagram.com/hanindhiyaatys?igshid=1dbf5e4lm4g0wVocal : Nissa & Hanin DhiyaKeyboard : AyusPercussion : KamalAudio by Oum Music !SongWriter : AyusMusic Producer : Yeru Arrangement : Yeru & AyusVocal Director : Ayus & Langen DumadiMixing & Mastering : Yeru at Oum MusicMusic performed by : SabyanAdditional Musician !Piano : Langen Dumadi @langenpianoGuitar : Hedi Alfian @alfianhediBass : Jalu Rohanda @jalu_rohandaDrum programming : Yeru @yu_yeruBacking Vocal : Habibah @habibahoumar---------------------------------------------Video by Oum Picture!DOP : Fandi @fandy_1288Editor : Dawan @dawanrzkTerima kasih sudah mendukung kami dengan memberikan like, koment, dan subscribe.Untuk pertanyaan bisnis silahkan hubungi :☎ 021-22321217Manager : 08161967703 (Owan) (Wa Only)"
"PQYB9qLIB_8","KIAT GENIUS SEPUTAR MAKANAN DAN TRIK TikTok || Ide DIY Seru Menyelundupkan Makanan oleh 123 GO! BOYS","2020-08-17T02:00:04Z","UCmWPgDvrvP_svfJ1F40L3Vw","123 GO! BOYS Indonesian","24","20.28.08","DIY|kiathidup|tantangan|lucu|prank|cowok|123GO!BOYS|123go|123goboys","1125743","9859","1222","588","https://i.ytimg.com/vi/PQYB9qLIB_8/default.jpg","False","False","Kita suka makan, tapi kadang, makan aja bisa bikin ribet. Jadi lain kali, coba saja kiat seputar makanan ini! Suka kiat-kiat dari kami? Bagikan video ini pada temanmu dan ajak mereka mencoba tips ini! Dan, pastinya, jangan lupa berlangganan channel Youtube 123 GO! BOYS untuk beragam kiat keren lainnya!#hacks #123GO #TikTokBerlangganan: https://bit.ly/2yuvmtUMusik oleh Epidemic Sound: https://www.epidemicsound.com/Materi stok:https://www.depositphotos.comhttps://www.shutterstock.comVideo ini ditujukan sebagai hiburan. Kami tidak menjamin kelengkapan, keamanan, dan kelayakan apa pun. Segala tindakan yang dilakukan berdasarkan informasi di video ini akan sepenuhnya menjadi risiko pelaku, dan kami tidak akan bertanggung jawab atas segala kerusakan dan kehilangan. Pemirsa bertanggung jawab penuh untuk menilai, merawat, dan melakukan tindak pencegahan jika berencana untuk meniru.Video berikut ini mungkin menampilkan aktivitas yang dilakukan oleh aktor-aktor kami dalam lingkungan terkendali - mohon bertindak penuh pertimbangan, kewaspadaan, dan kehati-hatian apabila hendak meniru."
"fy8Fzo3WbWc","Not Shy - ITZY [뮤직뱅크/Music Bank] 20200821","2020-08-21T09:22:38Z","UCeLPm9yH_a_QH8n6445G-Ow","KBS Kpop","10","20.28.08","Not Shy|가요|가수|음악|케이팝|ITZY","1451028","69140","1175","1632","https://i.ytimg.com/vi/fy8Fzo3WbWc/default.jpg","False","False","Not Shy - ITZYKBS2 TV 뮤직뱅크｜매주 금요일 오후 5시에 방송됩니다."
"uze2-0_GC6A","PIYIK ISTIMEWA !! YAKUZEN DENGAN BETINA BARU","2020-08-27T11:28:31Z","UCi_OwnNPdlq1qgv3xvCTfBw","Merpatiku","15","20.28.08","merpatiku|tutorial merpati|melatih merpati|merpati kolong|merpati balap|merpati tinggi|merpati rumahan|burung merpati|burung dara|dara balap|merpati kolong meja|pigeons","53136","2828","72","675","https://i.ytimg.com/vi/uze2-0_GC6A/default.jpg","False","False","Pemasangan cincin piyikan yakuzen dengan betina baru- Bisnis Atau Kerjasama- Email doarestufb@gmail.comSubscribe  : https://www.youtube.com/c/Merpatiku?sub_confirmation=1Facebook   : https://web.facebook.com/Merpatiku01Instagram  : https://www.instagram.com/merpatiku01Goolge +     : https://plus.google.com/+Merpatiku1- Musik Song: Peyruis - Finesse (Vlog No Copyright Music) Music promoted by Vlog No Copyright Music. Video Link: https://youtu.be/bdy0m2C-lXQ"
"AiX6gdfGhHg","SURPRISE Dari KELUARGA PACAR DAN SAHABAT !!","2020-08-26T10:49:54Z","UCR2Rk1nRREWoYgOegCTbEXw","Athalla Naufal","22","20.28.08","Athalla|Naufal|Aisyah|Aqilah|Verrel|Bramasta|VRL|Venna|Malinda|Vania|Athabina|Seleb|Indo|Artis|Indonesia|Youtuber","88829","5775","42","149","https://i.ytimg.com/vi/AiX6gdfGhHg/default.jpg","False","False",""
