video_id,title,publishedAt,channelId,channelTitle,categoryId,trending_date,tags,view_count,likes,dislikes,comment_count,thumbnail_link,comments_disabled,ratings_disabled,description
"_nNuXhpzyos","Kenapa Kalau Huh Dingin tapi Hah Panas?","2020-06-27T12:48:45Z","UCu0yQD7NFMyLu_-TmKa4Hqg","Kok Bisa?","27","20.28.06","kok|bisa|kokbisa|kokbisa?|bisa?|indonesia|animasi|lucu|kocak|edukasi|belajar|hiburan|menghibur|entertainment|informatif|wawasan|sains|teknologi|technology|science","277317","26872","153","3068","https://i.ytimg.com/vi/_nNuXhpzyos/default.jpg","False","False","Kali ini, Kok Bisa akan ngejawab satu misteri super penting yang sering banget ditanyain. Ya, kayak yang ditanyakan Philip ini, dan yang ditanya Ayu, dan Rizky, dan Monica, dan banyak banget dari kalian semua! Kenapa kalau kita napas huh ke tangan rasanya dingin tapi hah rasanya panas? Apakah semua ini adalah rahasia elit global?! Enjoy the video!---Tanyakan pertanyaan aneh anda disini! NGGA ada pertanyaan yang bodoh! 'Kok Bisa' ngga cuma sekedar mencoba menjawab pertanyaan-pertanyaan yang terlihat bodoh, aneh dan dungu disini, tapi juga mencoba menumbuhkan rasa keingintahuan anda terhadap segala hal di dunia ini. Jadi tunggu apalagi? Ayo subscribe, let's watch the videos and go curiosity!---FAQ (Frequently Asked Questions):Q: Min, upload tiap hari apa?A: Tiap hari Rabu. Tapi kadang-kadang ada video yang butuh waktu pembuatan lebih lama. So, stay tuned!Q: Min, animasinya pake software apa?A: Adobe after effectsQ: MIN, KENAPA DI VIDEONYA ADA BAKSONYA TERUS!?A: Bakso is inspiration *wink---Follow our social media for more updates, stuff and facts!Facebook: https://www.facebook.com/kokbisachannelInstagram: https://instagram.com/kokbisaLine: http://bit.ly/linekokbisaTwitter: https://twitter.com/kokbisachannel---For business inquiries: kokbisachannel@gmail.com---References:---Credits:- Kevin MacLeod for awesome music- Tiffani Angelica, for this episode's end narrator (instagram.com/tiffaniangelica)- And a massive THANK YOU to everyone for watching this and for all of your support!"
"zoGqKCraUCk","PERGI, HILANG DAN LUPAKAN - REMEMBER OF TODAY | DJ REMIX FULL BASS TERBARU 2020","2020-06-26T08:00:12Z","UCBRTQnz0s56WFUrTaR-9Dug","Nofin Asia","10","20.28.06","remix|terbaru|dj terbaru 2020|Pergi Hilang Dan Lupakan Remix|Remember Of Today Pergi Hilang Dan Lupakan|Pergi Hilang Dan Lupakan Remember Of Today Remix|Remember Of Today|Pergi Hilang Dan Lupakan|Nofin Asia|Nofin Asia Remix|Nofin Asia Pergi Hilang Dan Lupakan|Pergi Hilang Dan Lupakan Nofin Asia Remix|Remix Remember Of Today|Remix Nofin Asia|dj|Nofin Asia 2020|dj nofin asia|remix full bass|dj remix full bass terbaru|dj 2020|dj remix|lagu indonesia|remix dj","238775","3697","220","405","https://i.ytimg.com/vi/zoGqKCraUCk/default.jpg","False","False","Terima kasih kepada remember of today karena telah memberikan izin untuk membuat cover lagu ini versi remix.Cekidot video asli Remember of Today: https://www.youtube.com/watch?v=fHjwk01VeIISelamat datang di channel Nofin Asia Hee Haa.Channel ini merupakan salah satu PIONIR musik remix breakbeat selow. (Musik Tik Tok)Channel Nofin Asia menggunakan konsep GREEN SCREEN dan merupakan channel remix pertama yang menerapkan konsep tersebut.Selain itu, Channel Nofin Asia identik dengan DJ yang menggunakan masker - topi dan headphone tidak lupa DJ PIONIR.NB: Joget atau Goyangan DJ identik dengan Jaipong / Sinden dikarenakan pengaruh budaya asal Indonesia.Jangan lupa SUBSCRIBE - LIKE - COMMENT dan SHARE semua video - video di channel ini.Nyalakan lonceng supaya kamu tidak ketinggalan UPLOAD terbaru dari channel ini.Facebook : https://www.facebook.com/NofinAsiaRemix/Instagram : https://www.instagram.com/nofinasia999/Subscribe Channel Nofin Asia  : https://goo.gl/h7roF9Tiktok: nofinasia999#rememberoftoday #pergihilangdanlupakanremix #nofinasia"
"B93VWYQ7LYU","SABYAN - KISAH SANG ROSUL | COVER","2020-06-23T04:00:13Z","UCeZA77FZSG4YzBcvBJ9eynA","SABYAN","10","20.28.06","Nissa sabyan|sabyan gambus|sabyan ya maulana|sabyan|nisa sabyan|lagu baru sabyan|sabyan manggung|vlog sabyan|sabyan live|sabyan konser|konser sabyan|sabyan idul fitri|sabyan bismillah|sabyan lagu corona|sabyan Kisah sang rosul|album sabyan|sabyan terbaru|sabyan gambus full album|sabyan karaoke|nissa sabyan terbaru|ya maulana remastered|mathasibnish|maulana sabyan|sabyan tabassam","377055","40469","281","7353","https://i.ytimg.com/vi/B93VWYQ7LYU/default.jpg","False","False","Assalamualaikum wr. wb.Alhamdulillah hari ini Sabyan upload video Cover lagu yang berjudul KISAH SANG ROSULTerima kasih banyak sudah mendukung kami sampai saat ini..Salam sahabat !Wassalamualaikum wr. wb.Original Song by : Laskar Cilik - Kisah Sang Rosulhttps://youtu.be/LgcBH5TJWbsLocation: Casablanca Villa, bogorhttps://www.instagram.com/p/B979xECgipd/?igshid=6tse9dca87mjFollow instagram Sabyan Gambushttps://www.instagram.com/sabyan_gambus//Vocal : NissaKeyboard : AyusPercussion : KamalMusic producer : YeruMixing & Mastering : @myproduction.idnMusic performed by : SabyanAdditional Musician :Guitar : Hedi @alfianhediBass : Jalu @jalu_rohandaPiano : Langen @langenpianoDrum : Yeru @yu_yeruBacking Vocal : Habibah @habibahoumarVideo by Sabyan Multimedia!DOP : Fandi @fandy_1288Editor : Dawan @dawanrzkHijab Nissa by : NS STORE @ns.nissastoreWardrobe Ayus & Nissa by : SQR APPAREL @sqr_apparel @sqrkatalogTerima kasih sudah mendukung kami dengan memberikan like, koment, dan subscribe.Untuk pertanyaan bisnis silahkan hubungi :☎ 021-22321217Manager : 08161967703 (Owan) (Wa Only)"
"yQMa-N4rOG4","Singgung Soal Sikap John Kei, Nus Kei: Faktanya Berbeda! | AKI Malam tvOne","2020-06-24T13:37:56Z","UCRVhCi6T_-Ogs9MPDh3kX1w","Apa Kabar Indonesia tvOne","25","20.28.06","tvone|tvonenews|tv one|tvone live|tv one live|berita terbaru|news|berita|tvone terbaru|tv one terbaru|tvone update|tv one update|tvonenews.com|apa kabar indonesia|apa kabar indonesia tvone|apa kabar indonesia malam|apa kabar indonesia pagi|aki pagi tvone|aki malam tvone|akip|akim|talkshow tvone|talk show tv one|berita terkini","235834","1346","124","581","https://i.ytimg.com/vi/yQMa-N4rOG4/default.jpg","False","False","Apa Kabar Indonesia - Jakarta, tvOnenews.com - Direktorat Reserse Kriminal Umum Polda Metro Jaya menggelar reka ulang atau rekonstruksi kasus pembunuhan yang diduga dilakukan kelompok John Kei terhadap anggota kelompok Agrapinus Rumatora alias Nus Kei hari ini, Rabu (24/6).Apa Kabar Indonesia Malam (24/6/2020) mengangkat tema Kasus John Kei: Reka Ulang Temukan Apa?"
"YL2qcduUV8U","Saka & Seika Ft Betrand Peto Putra Onsu - BAPAK (Official Music Video)","2020-06-20T03:00:13Z","UCrrimexxJpH-zLIrg_IPV_w","MOP Channel","24","20.28.06","bapak|didi kempot|the god father|official music video|saka seika|betrand peto putra onsu|legend|campursari|keroncong|musik|penyanyi indonesia|trending|viral|update|sobat ambyar","2512760","227422","2372","56737","https://i.ytimg.com/vi/YL2qcduUV8U/default.jpg","False","False","Judul : Bapak Penyanyi: Saka & Seika ft Betrand Peto Putra Onsu Pencipta: Didi KempotThanks To : - Tuhan YME - Bento X Bensu Seluruh Indonesia, Taiwan, Malaysia, Singapore, Hongkong Dan Seluruh Dunia - MOP Lovers - Subscribers Mop Channel - Semua yang mensupport Mop Channel - Dan Semua yang terlibat dalam Video Klip Ini Lagu yang di dedikasikan untuk mengenang Alm. Didi Kempot ini yang juga di nyanyikan langsung oleh kedua anaknya yaitu Saka & Seika bersama dengan Betrand Peto Putra Onsu. Lagu Bapak merupakan lagu yang menceritakan perjuangan seorang Ayah dalam menafkahi keluarga nya.Lirik: BAPAK: Rambut wis ra irengWis malih rupaneIreng dadi putih saikineDino tambah dinoUmur tambah tuoNanging koyo koyo ora dirosoNgadeg dadi cagakNyonggo piringe anakMempeng kerjo ora mikir rogoParibasan umurWis akeh cacaheNganti bingung anggonku ngitungeReff;Bapak... bapak... tekadmu kuwi tak pujiBapak... bapak... kowe koyo senopatiBapak... bapak... panasmu ngungkuli geniBapak... bapak... keno angin soyo ndadiSenajan uwis tuwo nekat mempeng kerjoNyambut gawe kanggo nguripi kluargo...bapak... senajan umurmu wis tuwoNanging tekadmu iso dadi tulodho,Aku anakmu mung biso memujiMugo mugo bapak tansah pinaringan bagas warasSaking gusti ingkang moho kuwosoKulo, Pak anak sampean...Ngadeg dadi cagakNyonggo piringe anakMempeng…#bapak #didikempot #betrandpetoputraonsu"
"WBnqReAF8nU","Nella Kharisma feat. Dory Harsa - Banyu Moto [OFFICIAL]","2020-06-10T10:00:11Z","UC2sVRtimSUdDN2myZ6Cf03w","Nella Kharisma Official","10","20.28.06","nella kharisma|nella kharisma official|dory harsa|banyu moto|sleman receh|dangdut koplo|Nella Kharisma Official","19619447","577709","21258","98194","https://i.ytimg.com/vi/WBnqReAF8nU/default.jpg","False","False","Full Album Nella Kharisma: https://www.youtube.com/playlist?list=PLQVDVegXmBRqa3g92vhejz6SfPoxtxYlf♫ Digital Storeshttps://lnk.to/NellaDoryBanyuMotoFollow Instagram Nella Kharisma :https://instagram.com/nellakharisma?igshid=1he4ui1bnjs2xFollow Twitter Nella Kharisma :https://mobile.twitter.com/nellakharisma94Follow Tiktok Nella Kharisma :https://vt.tiktok.com/24maTU/Contact Person For Job :+6285806511128 ( Mas Candra )+6282143138402 ( Cak Rul )Title : Banyu MotoArtist : Nella Kharisma Feat. Dory HarsaSongwriter : Heri Marwanto ( Sleman Receh )Music & Video : NK CreativeProduction : Nella Kharisma OfficialCopyright © 2020 Nella Kharisma OfficialAll rights reserved.Song Lyric,BANYU MOTOtembang iki tak gawemung kanggo kowesing paling tak tenaninganti saikitumetese banyu moto ikising dadi saksisumpah lan janjisehidup sematisampai kapan kan kau buktikantresno tulus yo mung kanggo awakkusampai mati kan ku pastikanmergo mung kowe sing tak tresnani tekane maticahyo lintang ing wengi gawe anyeme atitambah nggegowo roso kangen mring sliramu, tresnakutumetese banyu moto iki sing dadi saksisumpah lan janji sehidup sematisampai kapan kan kau buktikantresno tulus yo mung kanggo awakkusampai mati kan ku pastikanmergo mung kowe sing tak tresnani tekane matisampai kapan kan kau buktikantresno tulus yo mung kanggo awakkusampai mati kan ku pastikanmergo mung kowe sing tak tresnani tekane maticahyo lintang ing wengi gawe anyeme atitambah ngegowo roso kangen mring sliramu, tresnakuINDONESIAlagu ini ku ciptakan hanya untukmuyang paling ku cintai sampai saat iniberlinang air mata ini yang jadi saksisumpah dan janji sehidup sematisampai kapan kan kau buktikancinta tulus hanya untuk dirikusampai mati kan ku pastikankarena hanya kamu yang ku cintai sampai maticahaya bintang di malam membuat tenangnya hatitambah membawa rasa kangen kepadamu, cintaku#NellaKharisma #DoryHarsa #BanyuMotoYouTube channel managed by MusicYes Digital DistributionFully YouTube CertifiedJoin MusicYeshttps://musicyess.com/Account/Register"
"IRO4V5028q0","LAGI VIRAL NIH, RESEP ROTI JABRIG NO ULEN SUPER EMPUK DAN LEMBUT","2020-06-24T07:00:09Z","UCEtCClARjnW24KODpvOUqdA","Asahid & TehYung","26","20.28.06","asahid & tehyung|Roti jabrig asahid tehyung|roti jabrig|roti jabrig viral|roti jabrik viral|roti jabrik|resep roti|cara membuat roti jabrig|roti viral|resep roti jabrig bandung|roti jabrig bandung|tutorial roti jabrig|roti jabrik anti gagal|resep membuat roti jabrig|roti jabrik bandung|donat jabrig|roti jabrig isi coklat lumer|cara membuat roti jabrik|cara buat roti jabrig|roti jabrig hits|cara membuat roti|jajanan kekinian|roti jabrik isi coklat","123139","5153","126","405","https://i.ytimg.com/vi/IRO4V5028q0/default.jpg","False","False","Video Cara membuat ROTI JABRIG NO ULEN SUPER EMPUK DAN LEMBUT.Asahid dan Tehyung kali ini akan mempersembahkan resepCara membuat ROTI JABRIG NO ULEN SUPER EMPUK DAN LEMBUT.Untuk Bahan-bahan membuat Resep Roti Jabrig bisa lihat link dibawah ini  :https://www.asahidtehyung.com/2020/06/resep-dan-cara-membuat-roti-jabrig.htmlSUBSRIBE YA AGAR TETEH UPLOAD VIDEO TUTORIAL LAINNYA https://goo.gl/KsKdmXVIDEO BARU https://goo.gl/7mMhP6VIDEO BANYAK DI TONTONhttps://goo.gl/MfCmmoIkuti Juga Asahid & TehYung di :Asahid Tehyung di Instagram :@asahid_tehyunghttps://instagram.com/asahid_tehyungJangan Lupa Sukai halaman Facebook ASAHID TEHYUNGFB: https://facebook.com/asahidtehyungAsahid Tehyung di Twitter@asahid_tehyunghttps://twitter.com/asahidtehyung#rotijabrig #rotiviral #reseproti"
"1o4gLX4p3eM","BLACKPINK - 'How You Like That' M/V REACTION","2020-06-26T10:12:35Z","UCXRvb2amew-biQXoeoOdacg","GZBKarma","24","20.28.06","kpop|music|reaction|mv|반응|리액션 뮤비 리액션|블랙핑크|블랙핑크 reaction|블랙핑크 how you like that|blackpink|blackpink reaction|blackpink mv reaction|blackpinkhow you like that|blackpink how you like that reaction|blackpink how you like that mv reaction|how you like that reaction|how you like that mv reaction|how you like that black pink|how you like that black pink reaction","380264","28430","365","1411","https://i.ytimg.com/vi/1o4gLX4p3eM/default.jpg","False","False","THEY’RE INSANE FOR DOING THIS?! The serve! Honestly this song slaps yes but the MV is on another level! It has so many elements from their past MV which is why it felt so familiar. I’ve missed their voices so so much and them coming back with such a strong song, filled with sass an attitude makes me the happiest person on earth right now! I’m living for the hair flipping, the gestures etc. They’re feeling themselves and I’m feeling myself thanks to them. Jisoo came through with that bad Bish vibe omg! Lisa killed her rap and the sass omg! Jennie’s everything, don’t at me I’m biased but also Rosé who looks and sound phenomenal here (as always) DAMN! They killed it and now I cannot wait for whatever they have in store for us next! → Watch the MV here: https://www.youtube.com/watch?v=ioNng23DkIM_____________________🔅Follow me on Instagram : https://www.instagram.com/gzbkarma/🔅Follow me on Twitter: https://twitter.com/gzbkarma🔅Follow me on Dailymotion: https://www.dailymotion.com/GZBKarma🔅For any business inquiry: eurasienne76@gmail.comYou can shop on those websites and use my code/link to save up some money. I get a small commission from the sales btw  which helps a lot so thank you ❤️🔸Use code 'gzbkarma' for 10% off of your order on http://cokodive.com?aff=64 🔸Shop on Yesstyle here : https://ystyle.co/7k87 and use code GZBKARMA to get a discount on your order🔸Use code : GZBKARMA for 10% off on https://seoulbox.co.uk/🔸Use code :gzbkarma for a discount on https://www.olensglobal.com/_____________________If you wish to use any of my video in yours please make sure to credit me! Thanks for understanding. Help me translate my videos : http://www.youtube.com/timedtext_cs_panel?c=UCXRvb2amew-biQXoeoOdacg&tab=2**No copyright infringement intended"
"z_nDDebiefE","As a kid, I used to eat zongzi wrapped in shells of bamboo shoots.我小时候吃过的传统笋壳粽子，你那有吗？丨Liziqi Channel","2020-06-25T14:03:38Z","UCoC47do520os_4DBMEFGg4A","李子柒 Liziqi","26","20.28.06","liziqi|liziqi vlogger|中國美食|中華傳統文化|Chinese food|饮食文化|中国风|田园|美食|ly tu that|李子柒|lý tử thất","4281880","192454","2705","11938","https://i.ytimg.com/vi/z_nDDebiefE/default.jpg","False","False","Please  subscribe to 【李子柒 Liziqi 】Liziqi Channel on YouTube if you like my videos: https://goo.gl/nkjpSx Turn on the little bell🔔  for notification and be the first one to watch liziqi's videos~开启小铃铛🔔通知，第一时间观看#李子柒Liziqi 精彩视频哦~Do you have that sort of zongzi in your hometown?At that time, before Dragon Boat Festival, Villagers would go to the mottled bamboo forest to pick up the shells to make zongzi.The fragrance of bamboo shoots and sweetness of glutinous rice are wrapped together,with a touch of alkali flavor.Dip it in sugar,Or drizzle with hot brown sugar syrup…I still haven’t outgrown that festive taste.小时候每到端午，村里的大人就忙着去斑竹林捡笋壳回来包粽子笋壳的清甜混合糯米的香软，还有淡淡面碱香吃的时候蘸一蘸白糖或淋一勺热热的红糖汁大概这就是我关于端午最深刻的味蕾回忆吧！#李子柒#李子柒Liziqi如果你喜欢我的视频别忘了订阅我的频道哦~ 【李子柒 Liziqi 】 https://goo.gl/nkjpSx--------------------------------------------------------------------liziqi李子柒更多精彩视频推荐/More wonderful video recommendations：liziqi李子柒精选视频/decent video selection：https://is.gd/qe9xuc李子柒●花开有声 | Soud of blooming flowers： https://is.gd/tyr1ja李子柒 ●饮食以节 | Chinese festival food： https://is.gd/3LsFnu李子柒 ●适时而食 | Seasonal diet： https://is.gd/JmLJH3东方非遗传承 | Oriental intangible cultural heritage ： https://is.gd/atatyo传统工艺 | Traditional handicraft： https://is.gd/FPl4dfSpring 春之卷：https://is.gd/EBwo2nSummer 夏之卷：https://is.gd/i1jJ46Autumn 秋之卷：https://is.gd/YBVeL2Winter 冬之卷：https://is.gd/3JqW8D#LýTửThất #李子柒 #liziqi"
"y_NPOrmUaGg","Demi Konten! Youtuber Ini Meregang Nyawa di Tangan Pacarnya Sendiri","2020-06-28T05:30:01Z","UCgiO267R4Qo-SJF2UzH5ccQ","The Shiny Peanut","22","20.28.06","pedro ruiz|konten kreator|tiktok|youtuber|monaliza perez|danny munro|adrian broadway","215943","10422","255","1439","https://i.ytimg.com/vi/y_NPOrmUaGg/default.jpg","False","False","For business inquiries please contact : theshinypeanut.official@gmail.comFollow Instagram tsp : https://www.instagram.com/tsp_id/For copyright matters please contact us at: theshinypeanut.official@gmail.comDisclaimer- Some contents are used for educational purpose under fair use. Copyright Disclaimer Under Section 107 of the Copyright Act 1976, allowance is made for fair use for purposes such as criticism, comment, news reporting, teaching, scholarship, and research. Fair use is a use permitted by copyright statute that might otherwise be infringing. Non-profit, educational or personal use tips the balance in favor of fair use."
"FZB6hSsziQI","EASY MOZZARELLA CORNDOG (TAKARAN SENDOK)","2020-06-25T10:00:14Z","UCfGczdfHjLeW2Y70jq2TFtQ","pufflova","26","20.28.06","corndog|mozzarella corndog|resep corndog|no oven recipe|korean street food|korean recipe|resep makanan korea|oemuk|resep tanpa oven|resep camilan|roti goreng","250502","20245","94","546","https://i.ytimg.com/vi/FZB6hSsziQI/default.jpg","False","False","Dapetin promo elektronik rumah tangga di @Tokopedia dengan diskon 60% hingga 200.000 disini:http://tkp.me/electronicbrandPuffResep takaran sendok:15 sdm (sendok makan biasa) atau 150 ml air hangat1 sdt ragi instan2 sdm gula pasir20 sdm (sendok makan biasa) atau 1 1/2 cup atau 200gr tepung terigu protein tinggi (misal cakra kembar, komachi)1 sdt garamSosis dan mozzarella secukupnyaBread crumbs / tepung roti secukupnyaNote:-Sebelum dililit pakai adonan, pastiin mozarella atau sosisnya kering supaya lebih gampang nempel.-Pakai tusukan yang tebel (aku pakai sumpit)#mozzarellacorndog #reseptanpaoven"
"cW5QcZs1K8k","『ウルトラマンＺ』第1話(新)「ご唱和ください、我の名を!」-公式配信- ULTRAMAN Z Episode 1 -Official-","2020-06-20T00:28:10Z","UC5PBnSG7C0WXp5gjd4bzKtw","ウルトラマン公式 ULTRAMAN OFFICIAL by TSUBURAYA PROD.","1","20.28.06","ウルトラマンＺ|ULTRAMAN Z|田口 清隆|平野 宏周|松田 リマ|橋爪 淳|黒木 ひかり|青柳 尊哉|野田 理人|小倉 久寛|ウルトラマンゼロ|ULTRAMAN ZERO|赛罗奥特曼|อุลตร้าแมนซีโร่|ウルトラマンジード|ULTRAMAN GEED|捷德奥特曼|อุลตร้าแมนจี๊ด|セブンガー|濱田 龍臣|ウインダム|遠藤正明|玉置成実|畠中祐|宮野真守|福原かつみ|かっこいい|楽しい|メカ|ロボット|かわいい","2250450","39877","1405","6635","https://i.ytimg.com/vi/cW5QcZs1K8k/default.jpg","False","False","【subscribe】→ http://m-78.jp/ultrach/公式映像を配信中！Ch登録-はこちらをClick！★STORY↓地球防衛軍日本支部のロボット部隊「ストレイジ」でパイロットを務めるナツカワ ハルキ。地球の平和を守る為に日夜戦い続ける彼の前に、新たなウルトラヒーローが舞い降りる！その名はウルトラマンゼット。ウルトラマンゼロの弟子を名乗る熱血漢だ。凶暴宇宙鮫ゲネガーグの攻撃の前に窮地に陥った彼らが一つになる時、新たなウルトラの物語が幕をあける！#ウルトラマンＺ #ウルトラマンゼロ■━━━━━━━━━━━━━━━━━■　 ウルトラマンスタンプ・チャレンジ ■━━━━━━━━━━━━━━━━━■　スタンプ、壁紙、時々商品GET⁉集めて得するスマホスタンプカード登場！☆　YouTube 見逃し配信限定で　☆＼＼ 月替わりスタンプGET！ ／／=============================▼【6月スタンプ配信中】▼下記URLをクリックしてスタンプスアプリをダウンロード！https://stamp.sc/dp?s=na&d=9f98b9edff28f55d805c&p=0※登録済の方はそのままスタンプGETできます。※楽しみ方は登録ページ下部をご参照ください！"
"osGpVWxVXr0","BLACKPINK - 'How You Like That' M/V Reaction [ INA ]","2020-06-26T09:57:40Z","UC7Jx-Jv2r-22NcGLtJKMcSQ","CoppaMagzTV","24","20.28.06","coppamagz|kpop","58033","5631","70","445","https://i.ytimg.com/vi/osGpVWxVXr0/default.jpg","False","False","Ga ngerti lagi de.. suka banget lagunyaaaaaaaaa!JOIN DISCORD KPOP Indonesia yuk:https://discord.gg/DUV99WK== Follow Our Social media ==LINE : https://line.me/R/ti/p/%40coppamagz IG : https://www.instagram.com/coppamagz/https://www.instagram.com/coppamagz.tv/TWT : https://twitter.com/coppamagzEditor :https://www.instagram.com/williamyuswan/"
"cqfahhBWHjs","Safira Inema - Sak Ora Orane - Reggae Santuy (Official Music Video)","2020-06-23T13:16:24Z","UCESai5qF00m8_U0QjyVfyVg","Maska Music Records","10","20.28.06","maska record|maska|musik|music|indonesia|dangdut|drm|safira inema|lagu dangdut|dangdut koplo|lirik lagu safira inema|lirik lagu jawa|lagu baru safira inema|lagu safira inema|safira inema lagu|album safira inema|dangdut safira inema|sak ora orane","371216","9260","146","1181","https://i.ytimg.com/vi/cqfahhBWHjs/default.jpg","False","False","Official Music Video from Safira Inema Sak Ora Orane Download & Streaming single album click here : ComingsoonSongwritter by Dhe BazArrangement by dimas_amirrullah27Videographer by Z-T Production℗ & © Maska Music RecordsSambel Terasi - Safira Inema : https://youtu.be/rJW0p9EQUocPengen Nangis Tapi Isin - Safira Inema :https://youtu.be/dDhTaWWkF-AOjo Goblok Mencinta - Safira Inema : https://youtu.be/LGIYRoC9cwABanyu Moto - Safira Inema : https://youtu.be/vqdQwz3b4YwSubcribe Chanel Maska Record's : http://bit.ly/SubsMaskaMusicRecordsLyricSak Ora OraneSaben bengi aku ora iso turu kelingan sliramuNalikane mbiyen kowe ninggal akuTanpo mergo ra crito opo salahkuSaiki ning kono kepiye kabarmuOpo kelingan awakku Aku seng mbok gawe loroIseh kroso natu mbekas neng dodo Ref:Sak ora orane pernah ono ning uripmuMasio ra pernah mbok anggep onoSak ora orane nate nyanding sliramuMasio saiki wis disanding wong liyo Saben bengi aku ora iso turu kelingan sliramuNalikane mbiyen kowe ninggal akuTanpo mergo ra crito opo salahkuSaiki ning kono kepiye kabarmuOpo kelingan awakku Aku seng mbok gawe loroIseh kroso natu mbekas neng dodo Sak ora orane pernah ono ning uripmuMasio ra pernah mbok anggep onoSak ora orane nate nyanding sliramuMasio saiki wis disanding wong liyo Sak ora orane pernah ono ning uripmuMasio ra pernah mbok anggep onoSak ora orane nate nyanding sliramuMasio saiki wis disanding wong liyo Sak ora orane nate nyanding sliramuMasio saiki wis disanding wong liyoFollow us :👇Facebook : http://bit.ly/32qrbcVInstagram : http://bit.ly/2xQzTTITwitter : maska_pro01Email : info@maskamusikdigital.comWebsite : http://bit.ly/2SfBITq--------------------------------------------------------------------------------------------------------------------------------#SafiraInema#ReggaeSantuy#SakOraOrane--------------------------------------------------------------------------------------------------------------------------------Music video by Safira Inema Performing Sak Ora Orane © 2020. Maska Music Records .All rights reservedMaska Music Record's Youtube is under management of:dr.m, Indonesia's 1st Certified & Official Youtube MCNhttps://servicesdirectory.withyoutube.com/directory/pt-digital-rantai-maya-drm"
"KYQDXfu2QM0","Saat Teduh Bersama - Komunikasi Dengan Tuhan Sebelum Tidur | 27 Juni 2020 (Official Philip Mantofa)","2020-06-27T13:14:13Z","UCaxNFw2ryxzjSAxRVP-0Dfg","Philip Mantofa","29","20.28.06","[none]","60539","5579","47","293","https://i.ytimg.com/vi/KYQDXfu2QM0/default.jpg","False","False","Saat Teduh Bersama Ps Philip Mantofa Setiap Rabu & Sabtu, pukul 19.00 WIBDi YouTube dan Instagram Live @philipmantofa Follow PHILIP MANTOFAYouTube: http://www.youtube.com/philipmantofaministryWebsite: http://www.philipmantofa.com/Facebook: https://www.facebook.com/ps.philip.mantofaTwitter: https://twitter.com/philipmantofainstagram: https://www.instagram.com/philipmantofa#stayhome #PhilipMantofa #GMSChurch #SaatTeduhBersama"
