video_id,title,publishedAt,channelId,channelTitle,categoryId,trending_date,tags,view_count,likes,dislikes,comment_count,thumbnail_link,comments_disabled,ratings_disabled,description
"ioNng23DkIM","BLACKPINK - 'How You Like That' M/V","2020-06-26T08:58:14Z","UCOmHUn--16B90oW2L6FRR3A","BLACKPINK","10","20.28.06","YG Entertainment|YG|와이지|K-pop|BLACKPINK|블랙핑크|블핑|제니|로제|리사|지수|Lisa|Jisoo|Jennie|Rosé|BLINK|블링크|How You Like That|BLACKPINK How You Like That|블랙핑크 How You Like That|HYLT|BLACKPINK HYLT|블랙핑크 HYLT|HYLT MV|How You Like That MV","126388892","10005203","506983","1767542","https://i.ytimg.com/vi/ioNng23DkIM/default.jpg","False","False","BLACKPINK - 'How You Like That'보란 듯이 무너졌어바닥을 뚫고 저 지하까지옷 끝자락 잡겠다고저 높이 두 손을 뻗어봐도다시 캄캄한 이곳에 light up the sky네 두 눈을 보며 I’ll kiss you goodbye실컷 비웃어라 꼴좋으니까이제 너희 하나 둘 셋Ha how you like that?You gon’ like that that that that thatHow you like that?How you like that that that that thatNow look at you now look at meLook at you now look at me Look at you now look at meHow you like thatNow look at you now look at meLook at you now look at me Look at you now look at meHow you like thatYour girl need it all and that’s a hundred백 개 중에 백 내 몫을 원해Karma come and get some 딱하지만 어쩔 수 없잖아What’s up, I’m right back방아쇠를 cock backPlain Jane get hijackedDon’t like me? Then tell me how you like that더 캄캄한 이곳에 shine like the stars그 미소를 띠며 I’ll kiss you goodbye실컷 비웃어라 꼴좋으니까 이제 너희 하나 둘 셋Ha how you like that?You gon’ like that that that that thatHow you like that?How you like that that that that thatNow look at you now look at meLook at you now look at me Look at you now look at meHow you like thatNow look at you now look at meLook at you now look at me Look at you now look at meHow you like that날개 잃은 채로 추락했던 날어두운 나날 속에 갇혀 있던 날그때쯤에 넌 날 끝내야 했어Look up in the sky it’s a bird it’s a planeBring out your boss bishBLACKPINK!How you like that You gon’ like that How you like that More about BLACKPINK @http://www.blackpinkofficial.com/http://www.facebook.com/BLACKPINKOFFICIALhttp://www.youtube.com/BLACKPINKOFFICIALhttp://www.instagram.com/BLACKPINKOFFICIALhttps://twitter.com/BLACKPINK#BLACKPINK #블랙핑크 #HowYouLikeThat #PreReleaseSingle #MV #20200626_6pm #OutNow #YG"
"yBZKk-cCv64","BLACKPINK: How You Like That (The Tonight Show: At Home Edition)","2020-06-27T04:00:09Z","UC8-Th83bH_thdKZDJCrn88g","The Tonight Show Starring Jimmy Fallon","23","20.28.06","The Tonight Show|Jimmy Fallon|BLACKPINK|How You Like That|The Tonight Show: At Home Edition|NBC|Television|Funny|Talk Show|humor|snl|tonight|show|funny video|talent|celebrities|video|clip|highlight|Blackpink on Fallon|Blackpink live|Sour Candy|Kill This Love|Kiss and make Up|As If It’s Your Last|DDU DU DDU DU|BOOMBAYAH|PLAYING WITH FIRE|WHISTLE|Don’t Know What To Do|Forever Young|How You Like That live|kpop|korean pop|k pop|bts|Lady Gaga|Dua Lipa","18340280","1376634","44735","73397","https://i.ytimg.com/vi/yBZKk-cCv64/default.jpg","False","False","BLACKPINK comes together for a debut performance of How You Like That for another Tonight Show: At Home Edition.Subscribe NOW to The Tonight Show Starring Jimmy Fallon: http://bit.ly/1nwT1aN Watch The Tonight Show Starring Jimmy Fallon Weeknights 11:35/10:35c Get more The Tonight Show Starring Jimmy Fallon: https://www.nbc.com/the-tonight-show JIMMY FALLON ON SOCIALFollow Jimmy: http://Twitter.com/JimmyFallonLike Jimmy: https://Facebook.com/JimmyFallonFollow Jimmy: https://www.instagram.com/jimmyfallon/ THE TONIGHT SHOW ON SOCIALFollow The Tonight Show: http://Twitter.com/FallonTonightLike The Tonight Show: https://Facebook.com/FallonTonightFollow The Tonight Show: https://www.instagram.com/fallontonight/Tonight Show Tumblr: http://fallontonight.tumblr.com The Tonight Show Starring Jimmy Fallon features hilarious highlights from the show, including comedy sketches, music parodies, celebrity interviews, ridiculous games, and, of course, Jimmy's Thank You Notes and hashtags! You'll also find behind the scenes videos and other great web exclusives. GET MORE NBCNBC YouTube: http://bit.ly/1dM1qBHLike NBC: http://Facebook.com/NBCFollow NBC: http://Twitter.com/NBCNBC Instagram: http://instagram.com/nbctvNBC Tumblr: http://nbctv.tumblr.com/ BLACKPINK: How You Like That (The Tonight Show: At Home Edition)http://www.youtube.com/fallontonight#FallonTonight#BLACKPINK#JimmyFallon"
"9IHwqdz8Xhw","BTS (방탄소년단) 'Stay Gold' Official MV","2020-06-26T08:59:11Z","UC3IZKseVpdzPSBaWxBxundA","Big Hit Labels","10","20.28.06","BIGHIT|빅히트|방탄소년단|BTS|BANGTAN|방탄","38923599","6269636","153178","1346595","https://i.ytimg.com/vi/9IHwqdz8Xhw/default.jpg","False","False","BTS (방탄소년단) 'Stay Gold' Official MVCredits:Written by UTAWritten by SUNNY BOYWritten by Melanie Joy FontanaWritten by Michel Lindgren SchulzWritten by JUNWritten by KM-MARKITDirector：Ko Yoo JeongBig Hit Entertainment. Rights are reserved selectively in the video. Unauthorized reproduction is a violation of applicable laws. Manufactured by Big Hit Entertainment, Seoul, Korea.Connect with BTS: https://ibighit.com/bts http://twitter.com/BTS_bighithttp://twitter.com/BTS_twt http://www.facebook.com/bangtan.official https://www.youtube.com/user/BANGTANTV http://instagram.com/BTS.bighitofficial https://channels.vlive.tv/FE619 https://www.tiktok.com/@bts_official_bighithttps://app.weverse.io/gpt4o https://www.weibo.com/BTSbighit https://www.weibo.com/BTSmembers http://i.youku.com/btsofficial http://btsblog.ibighit.com   #BTS #방탄소년단 #StayGold #MAP_OF_THE_SOUL_7_THE_JOURNEY #MV"
"o24tFFUP8vo","Tiara Andini - Maafkan Aku #TerlanjurMencinta (Official Lyric Video)","2020-06-25T17:00:17Z","UCl8TJXcR80R9ctpN0aX91bw","TiaraAndiniVEVO","10","20.28.06","#indonesianidol|#idol2020|#indonesianidol2020|#tiaraidol|#tiaraindonesianidol|#tiaraandini|#tiaraandiniidol|#tiaraidol2020|#finalisindonesianidol|#finalisidol2020|#gemintanghatiku|#pemenangidol|#laguidol|#lagukemenanganidol|#laguindonesianidol|#singleindonesianidol|#finalisidol|#tiarafinalisidol|#tiarapemenangidol|#laguterbaruindonesia|#lagubaruindonesia|#lyodraidol|#lyodraginting|#lyodraindonesianidol|#yoviewidianto","3658318","271732","15622","195728","https://i.ytimg.com/vi/o24tFFUP8vo/default.jpg","False","False","Tiara Andini’s official lyric video for new single ‘Maafkan Aku #TerlanjurMencinta’ Download and Stream : https://lnk.to/TiaraTerlanjurMencinta#TiaraAndini #MaafkanAku #TerlanjurMencinta Composer/ Lyric : Yovie WidiantoProducer : Yovie & Adrian (Yovie Widianto & Adrian Kitut ) All Keyboard Section & Drum : Adrian KitutAdd Piano : Yovie Widianto String Arrangement Ari RenaldiStrings Recorded at Studio 22 , Budapest HungaryMusic recorded & edited at Arsy’s Room by Arsy WidiantoVocal Director by Bowo Soulmate Recorded At Bro Studio by Aldi FachrobbyMixed & Mastered by Ari Renaldi at Aru Studio Bandung Video lyric by AVCD filmsLyrics :Aku t’lah tahu kita memang tak mungkinTapi mengapa kita selalu bertemu..Aku tlah tahu hati ini harus menghindarNamun kenyataan ku tak bisaMaafkan aku , Terlanjur Mencinta..Senyuman itu..Hanyalah menunda lukaYang tak pernah ku duga..Dan bila akhirnya kau harus dengannya mengapa kau dekati aku..Kau membuat semuanya..... indah , seolah takkan terpisahAku t’lah tahu kita memang tak mungkinTapi mengapa kita selalu bertemu..Aku tlah tahu hati ini harus menghindarNamun kenyataan ku tak bisaMaafkan aku , Terlanjur MencintaBila memang hatimu untuk aku.. Salahkah ku berharap, berharap kau memilih diriku cinta…*music*Tapi mengapa kita selalu bertemu..Aku tlah tahu hati ini harus menghindarNamun kenyataan ku tak bisaMaafkan aku , Terlanjur Mencinta..Aku t’lah tahu kita memang tak mungkinTapi mengapa kita selalu bertemu dan bertemuAku tlah tahu hati ini harus menghindarNamun kenyataan ku tak bisa..Maafkan aku , Terlanjur Mencinta..Ternyata hati…. tak sanggup melupa..Listen “Maafkan Aku #TerlanjurMencinta” on:Spotify: https://lnk.to/TiaraTerlanjurMencintaVD/spotifyApple Music: https://lnk.to/TiaraTerlanjurMencintaVD/applemusicYouTube Music: https://lnk.to/TiaraTerlanjurMencintaVD/youtubemusicJoox: https://lnk.to/TiaraTerlanjurMencintaVD/jooxLangit Musik: https://lnk.to/TiaraTerlanjurMencintaVD/langitmusikFollow Tiara Andini: Instagram: https://www.instagram.com/tiaraandini/Youtube: https://lnk.to/TiaraAndini/youtubeTwitter: https://twitter.com/initiaraandiniFacebook: https://www.facebook.com/TiaraIdol10/Official Lyric Video by Tiara Andini performing Maafkan Aku #TerlanjurMencinta © 2020 Universal Music Indonesiahttp://vevo.ly/9CFkfI"
"kHFBn4tx4Gw","NYAMAR JADI GEMBEL DEPAN RUMAH ARTIS❗SATU KELUARGA PANIK","2020-06-26T10:00:13Z","UCMTcqreJj9HY0SEzyn7wzHg","Nino Kuya","22","20.28.06","prank|nino kuya|uya kuya|cinta kuya|sosial eksperimen|viral|trending|hits|warga 62|mr.ganteng|gembel|iphone 11|iphone x|raja prank|raja settingan|hypebeast|aurelie hermansyah|anang|ashanty|keluarga hermansyah|podcast|deddy corbuzier|kekeyi|bintang emon|john kei|blackpink|lathi|weird genius","2037796","84357","10633","7062","https://i.ytimg.com/vi/kHFBn4tx4Gw/default.jpg","False","False","Business Inquiry /Contact Person Basyid : basyid@creativeindigo.net"
"9IF-AXISszY","Ziva Magnolya - Tak Sanggup Melupa #TerlanjurMencinta (Official Lyric Video)","2020-06-25T17:00:01Z","UChDuhCkrQ8IhdzSh2X7CkWg","ZivaMagnolyaVEVO","10","20.28.06","#indonesianidol|#idol2020|#indonesianidol2020|#tiaraidol|#tiaraindonesianidol|#tiaraandini|#tiaraandiniidol|#tiaraidol2020|#finalisindonesianidol|#finalisidol2020|#gemintanghatiku|#pemenangidol|#laguidol|#lagukemenanganidol|#laguindonesianidol|#singleindonesianidol|#finalisidol|#tiarafinalisidol|#tiarapemenangidol|#laguterbaruindonesia|#lagubaruindonesia|#lyodraidol|#lyodraginting|#lyodraindonesianidol|#yoviewidianto","2535800","216363","6500","129214","https://i.ytimg.com/vi/9IF-AXISszY/default.jpg","False","False","Ziva Magnolya’s official lyric video for new single ‘Tak Sanggup Melupa #TerlanjurMencinta’ Download and Stream : https://lnk.to/ZivaTerlanjurMencinta#ZivaMagnolya #TakSanggupMelupa #TerlanjurMencinta Composer / Lyric : Yovie WidiantoProducer : Yovie & Adrian (Yovie Widianto & Adrian Kitut)All Keyboard Section & Drum by Adrian KitutGuitar by Topan Abimanyu Vocal Directed by Dennis NussyEdited by Muhammad FitryRecorded at Bro Studio by Aldi FachrobbyMusic recorded & edited at Arsy’s Room by Arsy WidiantoMixed & Mastered by Ari Renaldi at Aru Studio Bandung Video lyric Producer : Rivo RimawanDirector : AkbaralazizAsst. Director : Dhandy DevoIllustration by : AqilavvivEditor : Dhandy & AkbaralazizLyrics :Aku t’lah tahu kita memang tak mungkinTapi mengapa kita selalu bertemu..Aku tlah tahu hati ini harus menghindarNamun kenyataan ku tak bisaMaafkan aku , Terlanjur Mencinta.Senyuman itu..Hanyalah menunda lukaYang tak pernah ku duga..Dan bila akhirnya kau harus dengannya mengapa kau dekati aku..Kau membuat semuanya..... indah , seolah takkan terpisahAku t’lah tahu kita memang tak mungkinTapi mengapa kita selalu bertemu..Aku tlah tahu hati ini harus menghindarNamun kenyataan ku tak bisaMaafkan aku , Terlanjur MencintaBila memang hatimu untuk aku.. Salahkahku berharap, berharap kau memilih diriku cinta…Aku t’lah tahu kita memang tak mungkinTapi mengapa kita selalu bertemu..Aku tlah tahu hati ini harus menghindarNamun kenyataan ku tak bisaMaafkan aku , Terlanjur MencintaAku t’lah tahu kita memang tak mungkinTapi mengapa kita selalu bertemu..Aku tlah tahu hati ini harus menghindarNamun kenyataan ku tak bisaMaafkan aku , Terlanjur Mencinta..Ternyata hati tak sanggup melupa..------------------------------------------------------------------------------------Listen “Tak Sanggup Melupa #TerlanjurMencinta” on:Spotify: https://lnk.to/ZivaTerlanjurMencintaVD/spotifyApple Music: https://lnk.to/ZivaTerlanjurMencintaVD/applemusicYouTube Music: https://lnk.to/ZivaTerlanjurMencintaVD/youtubemusicJOOX: https://lnk.to/ZivaTerlanjurMencintaVD/jooxLangit Musik: https://lnk.to/ZivaTerlanjurMencintaVD/langitmusikFollow Ziva Magnolya: Instagram: https://www.instagram.com/zivamagnolya/Youtube: https://lnk.to/ZivaMagnolya/youtubeTwitter: https://twitter.com/yaelahZivaFacebook: https://www.facebook.com/ZivaIdol10/Official Lyric Video by Ziva Magnolya performing Tak Sanggup Melupa #TerlanjurMencinta © 2020 Universal Music Indonesia"
"ZUdd4N5NdCY","Lyodra - Mengapa Kita #TerlanjurMencinta (Official Lyric Video)","2020-06-25T17:00:12Z","UCaAE5pyrskvGdHmypXxqncA","LyodraVEVO","10","20.28.06","#indonesianidol|#idol2020|#indonesianidol2020|#tiaraidol|#tiaraindonesianidol|#tiaraandini|#tiaraandiniidol|#tiaraidol2020|#finalisindonesianidol|#finalisidol2020|#gemintanghatiku|#pemenangidol|#laguidol|#lagukemenanganidol|#laguindonesianidol|#singleindonesianidol|#finalisidol|#tiarafinalisidol|#tiarapemenangidol|#laguterbaruindonesia|#lagubaruindonesia|#lyodraidol|#lyodraginting|#lyodraindonesianidol|#yoviewidianto","2963462","235421","10427","196854","https://i.ytimg.com/vi/ZUdd4N5NdCY/default.jpg","False","False","Lyodra’s official lyric video for new single ‘Mengapa Kita #TerlanjurMencinta’ Download and Stream: https://lnk.to/LyodraTerlanjurMencinta#TiaraAndini #MengapaKita #TerlanjurMencinta Composer / lyric : Yovie WidiantoProducer : Yovie & Adrian ( Yovie Widianto & Adrian Kitut ) Co Producer : Ari RenaldiString Arrangement : Ari Renaldi Vocal Directed by IrvnatGuitar by Topan Abimanyu Bass by Rudy ZulkarnaenDrum by Ari RenaldiKeyboard Section & Piano by Adrian Kitut & Yovie WidiantoVocal Recorded at Bro Studio by Anggi Keyboard / piano Recorded & edited at Arsy’s Room by Arsy Widianto Add music recorded at Aru Studio BandungStrings recorded at Studio 22 , Budapest HungaryMixed & Mastered by Ari Renaldi at Aru Studio BandungVideo lyricDirected by Arkala StudioProduced by Nocturnal ProjectLyrics :Aku t’lah tahu kita memang tak mungkinTapi mengapa kita selalu bertemu..Aku tlah tahu hati ini harus menghindarNamun kenyataan ku tak bisaMaafkan aku , Terlanjur Mencinta.Senyuman itu..Hanyalah menunda lukaYang tak pernah ku duga..Dan bila akhirnya kau harus dengannya mengapa kau dekati aku..Kau membuat semuanya..... indah , seolah takkan TerpisahAku t’lah tahu kita memang tak mungkinTapi mengapa kita selalu bertemu..Aku tlah tahu hati ini harus menghindarNamun kenyataan ku tak bisaMaafkan aku , Terlanjur Mencinta.Bila memang hatimu untuk aku.. Salahkahku berharap, berharap kau memilih diriku cinta…Aku t’lah tahu kita memang tak mungkinTapi mengapa kita selalu bertemu..Aku tlah tahu hati ini harus menghindarNamun kenyataan ku tak bisaMaafkan aku , Terlanjur Mencinta.Aku t’lah tahu kita memang tak mungkinTapi mengapa kita selalu bertemu..Aku tlah tahu hati ini harus menghindarNamun kenyataan ku tak bisaMaafkan aku , Terlanjur Mencinta.Ternyata hati tak sanggup melupa..Listen “Mengapa Kita #TerlanjurMencinta” on:Spotify: https://lnk.to/LyodraTerlanjurMencintaVD/spotifyApple Music: https://lnk.to/LyodraTerlanjurMencintaVD/applemusicYouTube Music: https://lnk.to/LyodraTerlanjurMencintaVD/youtubemusicJoox: https://lnk.to/LyodraTerlanjurMencintaVD/jooxLangit Musik: https://lnk.to/LyodraTerlanjurMencintaVD/langitmusikFollow Lyodra : Twitter: https://twitter.com/LyodraIdol10Facebook: https://www.facebook.com/lyodraofficial/Instagram: https://www.instagram.com/lyodraofficial/Youtube: https://lnk.to/Lyodra/youtubeOfficial Lyric Video by Lyodra performing Mengapa Kita #TerlanjurMencinta © 2020 Universal Music Indonesia"
"77s99NET9Mw","Denny Caknan - LOS DOL (Official Music Video)","2020-06-20T08:00:13Z","UC0k3T5AJYvKnuc52bB7rJTA","DENNY CAKNAN","10","20.28.06","Denny caknan terbaru|denny caknan|los dol|full album denny cakanan|dodit mulyanto|cerita kehidupan","10305631","398973","9121","51802","https://i.ytimg.com/vi/77s99NET9Mw/default.jpg","False","False","Alhamdulilah Telah Rilis : LOS DOL- Cipt : Denny Caknan X Lek Dahlan - Artis : Denny CaknanLirik : Los Dol ndang lanjut leh mu Whatapp an cek paket datane, yen entek tak tukokne tenan dik elingo yen mantan nakokno kabarmu,tandane iku ora rindu, nanging kangen kringet bareng awakmu tak gawe los dol blas aku ra rewel nyanding sliramu sing angel di setel tutuk - tutuk no chatingan karo wong liyo rapopo, aku ra gelo, kok tutup - tutupi, nomere mbok ganti firasat ati angel di apusi senajan mbok ganti tukang las, bakul sayur lan tukang gastiteni, bakale ngerti reff : Los Dol ndang lanjut leh mu Whatapp an cek paket datane, yen entek tak tukokne tenan dik elingo yen mantan nakokno kabarmu,tandane iku ora rindu, nanging kangen kringet bareng awakmu back __________ARR : - BAYU ONYONK TALENT : - Dodit Mulyanto - ega alfaris ( agus kotak ) - bella bonita - dllVIDEO : IF OFFICIAL ( IKHSAN WORRY x FOTOSINTESIS  ) TERIMAKASIH :  - TUHAN YME .- KELUARGA .- TEMAN .- DAN SEMUANYA .TEAM : - DIDIT W.U- DHIMAS PRASETYO- DLL  _____________________________________________________________#DennyCaknan #LosDol #MusicTetap dukung setiap karya kami , kalian sangat luar biasa SAMPAI JUMPA .....========================================Licensed to YouTube by IDE (Music)This channel & Video optimized by IDE OptimizationLicense your music here: https://smarturl.id/idemusicOptimize your video now: https://smarturl.id/optimize"
"EasWagnJvSI","Chelsea 2-1 Manchester City | Pulisic & Willian Seal Dramatic Victory | Premier League Highlights","2020-06-25T23:44:22Z","UCU2PacFf99vhb3hNiYDmxww","Chelsea Football Club","17","20.28.06","willian|pulisic|chelsea fc|christian pulisic|pulisic goal|chelsea football club news|chelsea 2-1 man city 2020|Chelsea F.C. (Football Team)|Chelsea TV (TV Network)|chelsea highlights|manchester city vs chelsea|chelsea vs man city|chelsea vs manchester city highlights|willian goal|chelsea 2-1 manchester city|Chelsea vs manchester city|chelsea|kante|Premier League|manchester city|goal|luiz|soccer|lampard|de bruyne freekick|skills|abraham|hudson-odoi|training|Nike","3143143","53045","1571","3348","https://i.ytimg.com/vi/EasWagnJvSI/default.jpg","False","False","Watch highlights of our Premier League match against Manchester City at home.Download Chelsea FC's official mobile app:-App Store https://apple.co/2vvlN9t-Play Store http://bit.ly/2MfNJHX Subscribe: http://che.lc/YTsubscribeTo watch more EXCLUSIVE Chelsea content go to: http://che.lc/YTwebsiteWelcome to the official home of Chelsea Football Club on YouTube. It’s the only channel where you’ll get an authentic look at life at this great club. Every week we’ll be uploading fresh content from the training ground, our famous stadium and much, much more. Nowhere else will you get closer to world-class stars like Christian Pulisic, Kepa Arrizabalaga, Willian, Pedro & N’golo Kanté. ABOUT CHELSEA FOOTBALL CLUBFounded in 1905, Chelsea Football Club has a rich history, with its many successes including 5 Premier League titles, 8 FA Cups and 1 Champions League, secured on a memorable night in 2012. Famous former Blues include Peter Osgood, Gianfranco Zola, Dennis Wise, John Terry, Didier Drogba & Eden Hazard."
"4shsG2alxU0","Juventus 4-0 Lecce | Ronaldo, Dybala and Higuain Secure the Three Points | Serie A TIM","2020-06-26T22:36:35Z","UCBJeMCIeLQos7wacox4hmLQ","Serie A","17","20.28.06","Ronaldo|Serie A|Higuain|Dybala|highlights|Insigne|Juventus|AC Milan|Inter Milan|Napoli|Roma|CR7|Cristiano Ronaldo|goals|full highlights|watch|stream|partita|migliori gol|migliori in campo|migliori al mondo|gol del mese|federcalcio|calcio|Italia|lukaku|de ligt|balotelli|Lecce|juventus Lecce|juventus 4-0 lecce|juventus lecce 4 0|sp:ty=high|sp:dt=2020-06-26T19:45:00Z|sp:st=soccer|sp:li=seri|sp:ti:home=JUV|sp:ti:away=LEC|sp:vl=en","6335287","123032","2851","5339","https://i.ytimg.com/vi/4shsG2alxU0/default.jpg","False","False","Juventus win against 10-man Lecce thanks to goals from Cristiano Ronaldo, Paulo Dybala, Gonzalo Higuain and Matthijs De Ligt | Serie A TIMThis is the official channel for the Serie A, providing all the latest highlights, interviews, news and features to keep you up to date with all things Italian football.Subscribe to the channel here! https://bit.ly/2OM2Eax Find out more about the Serie A at: http://www.legaseriea.it/en/ Questo è il canale ufficiale della Serie A, dove potrai avere accesso ai momenti salienti, alle interviste, alle notizie e alle funzionalità del momento per rimanere aggiornato sulle ultime novità del campionato.Iscriviti qui al canale! https://bit.ly/2OM2EaxPer maggiori informazioni sulla Serie A: http://www.legaseriea.it/it"
"ZsByFCv_7J0","8 KIAT HIDUP LUAR BIASA UNTUK SEGALA SITUASI || DIY dan Kerajinan Lucu oleh 123 GO! GOLD","2020-06-21T06:00:12Z","UCwIzd032IQjvJ9larkdcwgg","123 GO! GOLD Indonesian","24","20.28.06","123|123 go|123go|123 go gold|123gogold|123go!|123 go!|123 go! gold|123go!gold|tantangan|lelucon|trik kehidupan|DIY|kerajinan|proyek DIY|bermain peran|komedi|sketsa|humor|tertawa|sketsa komedi|trik|kerjakan sendiri|seru|lucu|video lucu|sketsa lucu|video seru|langkah-langkah|cara membuat|tutorial|buatan tangan|buatan rumah","3740406","36624","5025","2169","https://i.ytimg.com/vi/ZsByFCv_7J0/default.jpg","False","False","Menyikat gigi setiap hari memang kegiatan yang paling membosankan, dua kali pula😱! Kami sudah menemukan cara agar kamu tidak bosan melakukannya dan bisa melewati rutinitas pagimu dengan mudah!Kamu akan belajar cara membuat bola pasta gigi kunyah untuk dibawa bepergian, cara menangani masalah darurat, dan memperbaiki pakaianmu dalam sekejap!Subscribe ke YouTube 123 GO! GOLD👑 Indonesian dan nyalakan loncengnya 🔔 supaya kamu tidak ketinggalan video-video kami.Sampai ketemu lagi!#123GO #GOLD #lucu #kiathidup URUTAN WAKTU:00:00 Kiat hidup seputar pasta gigi01:38 Kiat luar ruangan yang brilian02:29 Kiat darurat03:32 Kiat pakaian untuk perempuan06:13 Kiat hidup seputar kecantikan07:34 Kiat menggambar yang kreatif10:29 Dibuang sayangBERLANGGANAN: https://bit.ly/3blXLA0----------------------------------------------------------------Musik oleh Epidemic Sound: https://www.epidemicsound.com/Sampel Foto: https://www.depositphotos.com https://www.shutterstock.com"
"wT-C3b-5na8","Nella Kharisma - Ku Puja Puja [OFFICIAL]","2020-06-26T10:00:10Z","UC2sVRtimSUdDN2myZ6Cf03w","Nella Kharisma Official","10","20.28.06","[none]","1437854","53224","1563","10391","https://i.ytimg.com/vi/wT-C3b-5na8/default.jpg","False","False","Full Album Nella Kharisma: https://www.youtube.com/playlist?list=PLQVDVegXmBRqa3g92vhejz6SfPoxtxYlfFollow Instagram Nella Kharisma :https://instagram.com/nellakharisma?igshid=1he4ui1bnjs2xFollow Twitter Nella Kharisma :https://mobile.twitter.com/nellakharisma94Follow Tiktok Nella Kharisma :https://vt.tiktok.com/24maTU/Contact Person For Job :+6285806511128 ( Mas Candra )+6282143138402 ( Cak Rul )Title : Ku Puja PujaArtist : Nella KharismaSongwriter : IpankMusic & Video : NK CreativeProduction : Nella Kharisma OfficialCopyright © 2020 Nella Kharisma OfficialAll rights reserved.Song Lyrick, KU PUJA PUJASungguh terpuruk dalam lamunanSeakan ragaku hangus terbakarBegitu besar api'Tak akan mampu 'ku siramiSengajakah kau kirimkan undanganAtaukah hanya pelampiasanAdakah alasanYang akan kau tungguApa salahkuApa dosakuHingga kau tega menyakitiKau yang s'lalu 'ku puja-pujaNamamu terukir indahGelapnya indah duniaTerluka penuh kecewaLuka tiada mengesanLarut kesepianSengajakah kau kirimkan undanganAtaukah hanya pelampiasanAdakah alasanYang akan kau tungguApa salahkuApa dosakuHingga kau tega menyakitiKau yang s'lalu 'ku puja-pujaNamamu terukir indahGelapnya indah duniaTerluka penuh kecewaLuka tiada mengesanLarut kesepian#NellaKharisma #Kupujapuja #DangdutKoploYouTube channel managed by MusicYes Digital DistributionFully YouTube CertifiedJoin MusicYeshttps://musicyess.com/Account/Register"
"UOHid6WKvFU","Viral Baku Pukul Tentara India Vs China","2020-06-26T05:36:07Z","UCB1fvlA5xmLJ0tZblpoTuaQ","VIVA.CO.ID","24","20.28.06","viva|newstainment|news|berita|viva.co.id|vivacoid","1879017","17035","1070","10637","https://i.ytimg.com/vi/UOHid6WKvFU/default.jpg","False","False","VIVA - Sebuah video yang menggambarkan perkelahian antara dua kelompok tentara beredar di media sosial. Video ini disebut-sebut sebagai perkelahian antara tentara India dan China di perbatasan kedua negara.#IndiaVsChina==========================VIVA.co.id : https://www.viva.co.id/Facebook : https://www.facebook.com/vivacoidTwitter : https://twitter.com/VIVAcoidGoogle+ : https://plus.google.com/+VIVAcoidLINE: https://timeline.line.me/user/_dT4rd5dLUvSPNGSG4PiUvrMTbY_qnTrclU6-odgInstagram : https://www.instagram.com/vivacoid/?hl=enSaksikan video terbaru lainnya di sini https://goo.gl/hYoQ7t"
