video_id,title,publishedAt,channelId,channelTitle,categoryId,trending_date,tags,view_count,likes,dislikes,comment_count,thumbnail_link,comments_disabled,ratings_disabled,description
"BxZVxFGTQNU","[STATION] Red Velvet 레드벨벳 'Milky Way' Live Video - Our Beloved BoA #4","2020-08-21T09:00:04Z","UC7xrN8sK99nXgE_wL-3f7Kg","SM STATION","10","20.28.08","[none]","2939298","425829","1656","30782","https://i.ytimg.com/vi/BxZVxFGTQNU/default.jpg","False","False","Red Velvet's new single Milky Way is out!!Listen & Download on your favorite platform: https://smarturl.it/OurBelovedBoA4✔SM STATION Playlist Spotify: https://smarturl.it/SMSTATION_SpotifyApple Music: https://smarturl.it/SMSTATION_Apple✔SM STATION Officialhttp://www.instagram.com/smtownstationhttp://www.facebook.com/station.smtown#OurBelovedBoA #RedVelvet #MilkyWay #레드벨벳 #보아20주년 #STATION #스테이션[STATION] Red Velvet 레드벨벳 'Milky Way' Live Video - Our Beloved BoA #4 ℗ SM ENTERTAINMENT"
"njFtmJ1Wu-w","Raih Mimpimu dan Hadiah Magic Cube Bersama Free Fire! | Free Fire 3rd Anniversary","2020-08-18T04:03:39Z","UCM3SMB1jINy_NxH1O01z5gA","Garena Free Fire Indonesia","20","20.28.08","[none]","7127820","59627","3169","5606","https://i.ytimg.com/vi/njFtmJ1Wu-w/default.jpg","False","False","Hi Survivors!Raih mimpimu dan jadi siapapun yang kamu mau dengan Free Fire! Menyambut 3rd Anniversary kami, banyak hal yang bisa kamu capai dan hadiah yang bisa kamu dapatkan. Karakter permanen, Magic Cube Fragment, Gun Skin — semuanya ada di genggamanmu!  Yuk download dan main Free Fire sekarang, hadiahnya dijamin nggak main-main! https://bit.ly/FF3rdAnniv_YT#FreeFire #MainFreeFire #HadiahnyaGaMainMain #3rdAnniversary••••••••••••••••••••••••••••••••••🔥Free Fire Indonesia Official Channel🔥🎟 Official YouTube: http://www.youtube.com/c/GarenaFreeFireIndonesia🎟 Official Instagram: https://www.instagram.com/freefirebgid/🎟 Official Tournament Page: https://www.facebook.com/FFEsports🎟 Official Tik Tok Channel: https://vt.tiktok.com/rqEW4q/"
"mALQdXJex_Q","AYAM GAK BOLEH NYEBRANG?? | Geolive ATURANCU by Coki Pardede & Tretan Muslim","2020-08-26T12:00:13Z","UCsfBhdQQmE0NuljXe-Gl5Dg","Geolive","27","20.28.08","geolive id|katacania|bedah medis|seputar ekonomi|cania citta|poltak geolive|cania geolive|coki muslim geolive|angellie geolive|telat siaran|aturancu|geolive aturancu|geolive telat siaran|ryu hasan geolive|bincang nalar|geolive bincang nalar|coki pardede|tretan muslim|perda syariah|aturan rancu|aturan aneh|aturan absurd|AYAM GAK BOLEH NYEBRANG?? | Geolive ATURANCU by Coki Pardede & Tretan Muslim|Geolive|Aturancu|Coki Paradede|Tretan Muslim|coki|tretan","202926","9499","73","688","https://i.ytimg.com/vi/mALQdXJex_Q/default.jpg","False","False","Koreksi:20% lebih besarYang benar adalah 33% lebih besar:)Connect with COKI:https://www.instagram.com/CokiPardede666Connect with MUSLIM:https://twitter.com/TretanMuslimhttps://www.instagram.com/TretanMuslimConnect with GEOLIVE:https://www.instagram.com/GeoliveIDwww.geolive.idgeolive.id@gmail.com__AYAM GAK BOLEH NYEBRANG?? | Geolive ATURANCU by Coki Pardede & Tretan Muslim#ATURANCU #CokiPardede #TretanMuslim"
"UGPrHj1nPt0","Terrifying MotoGP™ crash from every angle | #AustrianGP 2020","2020-08-17T05:38:58Z","UC8pYaQzbBBXg9GIOHRvTmDQ","MotoGP","17","20.28.08","motogp|moto2|moto3|crash|overtake|rossi|marquez|clash|suzuki|yamaha|honda|ducati|aprilia|ktm|redbull|repsol honda|marquez crash thailand|quartararo|fabio quartararo|quartararo marquez|sepang 2015|rossi marquez 2015|sepang clash|dovizioso|malaysia motogp|qatargp|americasgp|argentinagp|spanishgp|frenchgp|italiangp|catalangp|germangp|czechgp|dutchgp|finnishgp|sanmarinogp|aragongp|thaigp|japanesegp|australiangp|malaysiangp|valenciagp","5751925","60273","1659","4494","https://i.ytimg.com/vi/UGPrHj1nPt0/default.jpg","False","False","Check out all of the views from the horrific premier class crash at Turn 3 in Austria.#AustrianGPVisit The Official Website: http://www.motogp.com/enOfficial App on iTunes: http://bit.ly/MotoGPAppItunesOfficial App on Google Play: http://bit.ly/MotoGPAppGooglePlayBuy your VideoPass: http://bit.ly/1VideoPass  Buy your TimingPass: http://bit.ly/TimingPassFollow MotoGP on Instagram: https://www.instagram.com/motogp/Like MotoGP on Facebook: http://www.facebook.com/MotoGPFollow MotoGP on Twitter: http://www.twitter.com/MotoGPFollow MotoGP on TikTok: https://www.tiktok.com/@motogpSubscribe to MotoGP on YouTube: http://goo.gl/IV00sBuy the Official MotoGP Merchandise: http://bit.ly/1XeSqhz"
"7_RpJd39Bc4","Reacting to BLACKPINK - 'Ice Cream (with Selena Gomez)' M/V","2020-08-28T04:46:23Z","UCEcqr9Hm-LEios9gBNqonZw","Dezzy March","24","20.28.08","dezzy march|reactions|kpop reactions|fanboy|kpop reaction|music reaction|review|k-pop|korean|pop|r&b|hip-hop|rap|blackpink ice cream mv reaction|blackpink reaction|king blink|blink reaction to blackpink|blink reaction|BLACKPINK - 'Ice Cream (with Selena Gomez)' M/V Reaction|Reacting to BLACKPINK - 'Ice Cream (with Selena Gomez)' M/VSaving draft...|blackpink selena gomez reaction","188422","15506","249","962","https://i.ytimg.com/vi/7_RpJd39Bc4/default.jpg","False","False","Reacting to BLACKPINK - 'Ice Cream (with Selena Gomez)' M/V #BLACKPINK #블랙핑크 #SelenaGomezMore content on Patreon • https://patreon.com/dezzymarchCheck out our Podcast on the HIMALAYA APPhttps://link.chtbl.com/BRIZZYFOLLOW YA BOY ON THE SOCIAL MEDIAS!Instagram • https://www.instagram.com/dezzymarchTwitter • https://twitter.com/dezzymarchWatch The Original Video • https://www.youtube.com/watch?v=vRXZj0DzXIAIntro Song • https://www.youtube.com/watch?v=6rzzQ-q8ag4* For All Business Inquiries: DezzyMarch@gmail.com *I love you, all y'all. Make sure you drink water, preferably alkaline water, eat fruits & veggies, but also stay positive & read you a book. For real tho.. DRINK WATER"
"RkID8_gnTxw","K/DA - THE BADDEST ft. (G)I-DLE, Bea Miller, Wolftyla (Official Lyric Video) | League of Legends","2020-08-27T19:00:09Z","UC2t5bjwHdUX4vM2g8TRDq5g","League of Legends","20","20.28.08","Riot Games|Riot|League of Legends|League|LoL|MOBA|kda|comeback|popstars|the baddest|return|kpop|league|lol|league of legends|music video|lyric video|animatic|akali|ahri|kaisa|evelynn|eve|kda akali|kda ahri|kda kaisa|kda evelynn|single|(G)I-dle|soyeon|miyeon|Soyeon of (G)I-dle|Miyeon of (G)I-dle|bea miller|wolftyla|rmg|riot music group|kda2|kda album|kda ep","6882531","663403","22693","37889","https://i.ytimg.com/vi/RkID8_gnTxw/default.jpg","False","False","Follow @KDA_MUSIC on Twitter and Instagram for daily updates.Call it a flex. Witness K/DA’s comeback with their pre-release single, “THE BADDEST,” featuring the vocal talents of SOYEON and MIYEON of (G)I-DLE, Bea Miller, and Wolftyla.K/DA is a virtual music supergroup by Ahri, Evelynn, Akali, and Kai’Sa. Following their explosive “POP/STARS” debut, K/DA returns this year with a long-awaited EP—coming soon.MEET THE BAND:https://na.leagueoflegends.com/en-us/event/kda-official-fan-club/LISTEN NOW: https://ffm.to/kda-thebaddestSpotify: https://ffm.to/kdathebaddest-spotifyApple Music: https://ffm.to/kdathebaddest-applemusicYouTube Music: https://ffm.to/kdathebaddest-youtubemusicDeezer: https://ffm.to/kdathebaddest-deezerAmazon Music: https://ffm.to/kdathebaddest-amazonmusicPRODUCTION CREDITS:K/DA - THE BADDESTFeatured artists: (G)I-DLE, Bea Miller, and Wolftyla Written by: Riot Music Team and Bekuh BOOMKorean translation by: Lydia Paek and Minji Kim  Produced by: Riot Music Team and YasuoExecutive Produced by: Akali Mixed by: Riot Music Team Mastered by: Riot Music TeamVocals performed by: SOYEON of (G)I-DLE, MIYEON of (G)I-DLE, Bea Miller, and WolftylaAdditional vocals by: Bekuh BOOMVocal production by: Riot Music TeamAdditional Vocal Production by: Oscar Freehttps://www.instagram.com/official_g_i_dlehttps://www.instagram.com/beamillerhttps://www.instagram.com/wolftylaANIMATION: Jordan Taylor Studios and Riot Games https://www.everythingtaylor.comLYRICS:Baddest do what the baddest doThe baddest do we the baddest oohBaddest do what the baddest doThe baddest do we the baddestComing at you liveReal real wildHere to light it upSet the world on fireGonna break rulesAnd hearts in twosCause that's what the baddest doNever going backNah not thatDiamonds on dripCause I came to make a splashGonna break rulesAnd hearts in twosCause that's what the baddest doI spit heat, I melt your face offDisappear, I'm your eraserIn the cut just like a razorMurder business, where my blazer?I got all the boys on meI got all the lines on ringKnock 'em dead, turnin headsI got all the eyes on mePretty face 걸어들어와유행 선두자원하지만 못하잖아애가 타잖아You like “whoa” KALI you the goat난 알지 I know준비해 cause I like to ball멈추지 않아나는 lit 크게 like a bit그거 말고 byte믿어봐 큰 만큼 크게어깨 펴고 high백 퍼센트덤비지 못해죽여주잖아나는 boss 간지 with the sauce원하면 줄게I’m doing damageWent just how I planned itI do what I want when I say모두 날 따라 해난 끝내주잖아(Like) to live on the edge of insane(It's crazy)Sorry for the bad news sorry I’m so badOnly took a minute for me to get what you hadSorry for the bad news know it makes you sadI’ll be here for a minute baby you should pack your bagsWay that I look should be breaking the lawIf I don’t got it I take what I wantMy circle small like a round of applauseYou know that I love the sound of applauseYou know I mean everything that I sayWhen you see me coming get out of the wayI came to slay I came to slayback and I’m better and ready to stay(It's crazy)Sorry not sorry for being the best언제든지 내가 좀 해Look at the gold all on my chestLook at the gold call it a flexMORE RIOT GAMES MUSIC:https://www.youtube.com/user/RiotGamesInc/playlists?shelf_id=23&sort=dd&view=50PLAY LEAGUE OF LEGENDS:http://riot.com/signup#KDA #KDACOMEBACK #LEAGUEOFLEGENDS #THEBADDEST"
"UAYM_LApgkQ","Fine DIE Ning with Fadil Aljaidi","2020-08-17T15:00:11Z","UCIecZQpkLmj1HdBR6iV9rlQ","Rachel & Niko","24","20.28.08","[none]","1443113","104910","1075","6255","https://i.ytimg.com/vi/UAYM_LApgkQ/default.jpg","False","False","Siapa dinner date berikutnya? Komen dibawah❤️"
"I7y24dyiv4A","Rara Kaget Ady Sky Tiba-Tiba Datang, Akhirnya Bertemu! Cocok Gak Sih? | BROWNIS (26/8/20) P2","2020-08-26T10:31:20Z","UCIohHXwCEKxWCLvAguJ-GjA","TRANS TV Official","24","20.28.08","TRANSTV|TRANS TV|TRANSMEDIA|LIVE STREAMING TRANS TV|TRANS TV LIVE STREAMING|#StayHome|#WithMe|StayAtHome|#dirumahaja|TERBARU|ACARA TRANS TV|TRANS TV LIVE|TRENDIN|VIDEO TRENDING|TRENDING HARI INI","1437200","46530","907","19650","https://i.ytimg.com/vi/I7y24dyiv4A/default.jpg","False","False","BROWNIS===TAYANG SETIAP HARI PUKUL 12.30 WIB===PART 1: https://youtu.be/-P-Us6bGQFgPART 2: https://youtu.be/I7y24dyiv4APART 3: https://youtu.be/WhDj5IEvQtcPART 4: https://youtu.be/84qgWW_5jz4===Obrolan yang selalu mencuri perhatian dari kolaborasi kocak Ivan Gunawan, Ruben Onsu, Wendy Cagur, dan Ayu Ting Ting.Dengan aksi yang super lucu mereka siap mengocok perut anda ===WEBSITE - http://www.transtv.co.idTWITTER - https://twitter.com/TRANSTV_CORPFACEBOOK - https://www.facebook.com/TransTVMediaINSTAGRAM -  Uhttps://www.instagram.com/TRANSTV_CORP#SantuySamaSaya #NontonBrownisDiTransTV #Brownis26Agustus2020"
"Mf_YrJnxVqY","Wajah Anak Pertama Citra Kirana Buat Mantan Pacar Rezky Aditya Kagum","2020-08-28T06:30:17Z","UC-inGkOwn_su3qh40RYC11A","TRIBUN LAMPUNG NEWS VIDEO","25","20.28.08","citra kirana|citra kirana kelahiran|citra kirana dan ali syakieb|citra kirana dan rezky aditya terbaru|citra kirana rezky aditya|artis|selebrita|entertaimen","58958","540","19","23","https://i.ytimg.com/vi/Mf_YrJnxVqY/default.jpg","False","False","Tonton video-video lainnya KLIK http://bit.ly/VideoTribunLampung -------------------------- TRIBUNLAMPUNG.CO.ID - Citra Kirana baru saja melahirkan buah hati pertamanya dengan Rezky Aditya, Jumat (28/8/2020).Sederet artis Tanah Air ikut merasa bahagia atas kelahiran anak pertama Citra Kirana dan Rezky Aditya.Namun siapa sangka, rasa bahagia itu juga dirasakan oleh mantan kekasih Rezky Aditya sebelum menikahi Citra Kirana, Patricia Razer.Tak hanya ikut bahagia, Patricia Razer bahkan langsung 'kepincut' dengan wajah anak pertama Rezky Aditya dan Citra Kirana tersebut.Patricia Razer pun blak-blakan memuji wajah bayi laki-laki yang baru saja dilahirkan istri Rezky Aditya.Seperti diketahui Citra Kirana baru saja melahirkan seorang bayi laki-laki di sebuah rumah sakit di Jakarta.Lewat akun Instagramnya, Rezky tampak merekam video pertamanya dengan sang buah hati.Tampak bayi mungil tersebut menangis saat perawat mengukur lingkar perutnya.Dalam unggahan itu, Rezky juga sempat mengumumkan nama untuk sang buah hati.Pasangan Citra dan Rezky memilih nama Keene Atharrazka Adhitya untuk putra pertama mereka.Halo ! sapa Rezky Adhitya pada sang anak.Lebar perutnya 3,5 cm. Saturasi bagus. Habis ini divideoin untuk adzan, ucap suster.Bahagia dengan kelahiran anak pertama, Rezky Adhitya pun mengucap syukur.Alhamdulillahh ya allah @keeneatharrazka, pungkas Rezky Adhitya.Sederet artis turut bahagia atas kelahiran anak pertama Rezky dan Citra Kirana.nikitawillyofficial94 : Rezky congratssss... omg youre a father!! Huuggggggggg rezky and ciki!febbyrastanty : Waaah alhamdulillaaah! Selamaat kak rezky kak cikiiii!!bramastavrl : Alhamdulillah, selamat bang! sehat2 terus yaBukan cuma sang sahabat, mantan kekasih Rezky Adhitya, Patricia Razer juga turut mengurai kebahagiaan.Patricia Razer bahkan tampak kagum dengan wajah bayi Rezky dan Citra Kirana.Congratzz kii.. ganteng bgt anak lo mukanya ngambil papa mamanya, kata Patricia Razer, mantan kekasih Rezky Adhitya.Videografer Tribunlampung.co.id/Ikhsan Dwi Nur SatrioVideo Youtube Terpopuler: https://www.youtube.com/watch?v=JlLJEkLeCMAFollow Instagram:https://www.instagram.com/tribunlampung/?hl=id Follow Twitter: https://twitter.com/tribunlampung_ Follow Facebook: https://web.facebook.com/tribunnews.lampung/videos/254533195686435/Dengarkan podcast Tribun Lampung KLIK https://bit.ly/podcasttribunlampung#citrakirana #rezkyaditya #beritaterkiniartis"
"5Gbj5mrdnIc","EKSKLUSIF!  Telewicara Dengan Adhisty Zara | SELEBRITA EXPOSE (21/08/20)","2020-08-21T12:29:03Z","UCXZuKhvf6ZdLpqHMuXSC0Fw","TRANS7 Lifestyle","19","20.28.08","TRANS7|TRANS7 LIVE|TRANS7 HARI INI|TRANSMEDIA|TRANS7 LIVE STREAMING","504246","4682","450","1767","https://i.ytimg.com/vi/5Gbj5mrdnIc/default.jpg","False","False",""
"9ljBWshWf5Y","Bahasa Kalbu","2020-08-27T10:03:34Z","UCbbaUGg_hwl2u5R511BTMWw","Raisa - Topic","10","20.28.08","Raisa|Andi Rianto|Bahasa Kalbu","26494","3400","10","402","https://i.ytimg.com/vi/9ljBWshWf5Y/default.jpg","False","False","Provided to YouTube by Universal Music GroupBahasa Kalbu · Raisa · Andi RiantoBahasa Kalbu℗ 2020 Juni RecordsReleased on: 2020-08-28Associated  Performer, Vocals: RaisaAssociated  Performer, Piano, Producer: Andi RiantoComposer  Lyricist: Andi RiantoComposer  Lyricist: Dorie KalmasComposer  Lyricist: Titi DJAuto-generated by YouTube."
"03rcuEjrbf8","Detik-detik Upacara Pengibaran Bendera Merah Putih","2020-08-17T04:13:29Z","UCKII0Ml9S5wneKbHswmUrIQ","CNN Indonesia","25","20.28.08","Indonesia|cnn indonesia|berita|berita terbaru|trans tv|trans7|berita terakhir|terakhir|cnn|Berita Viral|Viral|transmedia|pengibaran bendera merah putih|17 Agustus|sang saka merah putih|upacara bendera|HUT kemerdekaan|HUT kemerdekaan ri|HUT kemerdekaan ri ke-75","1480794","36664","1266","2822","https://i.ytimg.com/vi/03rcuEjrbf8/default.jpg","False","False","Live streaming 24 jam: https://www.cnnindonesia.com/tvBerikut detik-detik pengibaran sang saka merah putih di Istana Merdeka, Jakarta. Upacara berjalan khidmat dan sukses.Upacara Peringatan HUT RI ke-75 di Istana Kepresidenan dimulai. Presiden Joko Widodo (Jokowi) menjadi inspektur upacara.Upacara HUT RI tahun ini berbeda dari biasanya karena digelar di tengah pandemi Corona. Jumlah peserta dibatasi dan tidak ada masyarakat yang diundang. Tamu-tamu hadir secara virtual.Ikuti berita terbaru di tahun 2020 dengan kemasan internasional berbahasa Indonesia, dan jangan ketinggalan breaking news dengan berita terakhir dan live report CNN Indonesia di https://www.cnnindonesia.com/tv dan channel CNN Indonesia di Transvision. CNN Indonesia tergabung dalam grup Transmedia. Dalam Transmedia, tergabung juga Trans TV, Trans7, Detikcom, Transvision, CNN Indonesia.com dan CNBC Indonesia. Follow & Mention Twitter kami:@myTranstweet@cnniddaily@cnnidconnected @cnnidinsight @cnnindonesia Like & Follow Facebook:CNN IndonesiaFollow IG: cnnindonesiatv"
"DQHDdP8QmNE","SHOKUGEKI NO ARNOLD : BIKIN PORK ROAST DITEMANI NAKIRI ERINA | FOOD WARS!","2020-08-26T07:00:14Z","UCr5k1iu1hF_01O1AD1JzcFA","Arnold Poernomo","24","20.28.08","Arnold Poernomo|Chef Arnold|Cooking|Master Chef|Resep|Menu Rahasia|pork roast|punipun|clarisa punipun|Yukihira Arnold|shokugeki no soma|chaliapin steak|CHALIAPIN STEAK DON|FOOD WARS|masakan anime|yukihira souma|yukihira soma|manga|mudah|enak|cepat|lezat|resep|menu|masakan|how to make|making a dish|foodie|anime|vs|real life|yummy|resep yukihira|cara membuat|murah|otaku|cosplay|nakiri|erina|masak|cooking","332937","16128","271","2122","https://i.ytimg.com/vi/DQHDdP8QmNE/default.jpg","False","False","Kembali lagi di Shokugeki No Arnold! di episode kali ini Yukihira Arnold tidak sendiri karena akan di temani Nakiri Erina (@Clarissa Punipun ) dan kita akan membuat PORK ROAST!!! Mudah, Enak, Cepat! Kita buktikan apa hidangan si Yukihira Souma yang kali ini se-enak itu? apakah di real life semenggiurkan seperti di anime atau manganya? tonton sampai habis Shokugeki No Arnold! Food Wars!!!Like Subs Dislike bla bla Karepmu#ShokugekiNoArnold #FoodWars #PorkRoastBantu yang sepi penghasilan karena sepinya jalananKlik untuk donasi - Saatnya Indonesia kembali satukan suara #SumbangSuaraLink : https://kitabisa.com/arnoldposumbangs...Subscribe Our Channel, Please Click This: https://www.youtube.com/channel/UCr5k...Catch us on SNS :https://www.instagram.com/arnoldpo/Official Site: https://starhits.id/Don't reupload our content but you can share our video.Production 2020 © Copyrights & Trademark by StarHits"
"HzNQKNlSiWM","Xiaomi Mi 10 Ultra: HP XIAOMI PALING FENOMENAL","2020-08-26T10:25:36Z","UCtaSWbg8OHxg6h10axQXV-g","DroidLime","28","20.28.08","droidlime|indonesia|teknologi|gadget|smartphone|review|unboxing|hands-on|tech|reviewer|jujur|romi hidayat|xiaomi mi 10 ultra|mi 10 ultra indonesia","188401","5701","149","1085","https://i.ytimg.com/vi/HzNQKNlSiWM/default.jpg","False","False","Jangan lupa nonton video ini sambil ngenyot susu Ultra yes...Spesifikasi Xiaomi Mi 10 Ultra:Harga: Rp9-13 juta (belom sama pajak)Chipset: Snapdragon 865GPU: Adreno 650RAM: 8/12/16 GBStorage: 128/256/512 GB (UFS)Layar: OLED 6,67 inci (2.400 x 1.080p) @120HzBaterai: 4.500  mAh (120 Watt)OS: Android 10 Kamera belakang: 48 MP + 48 MP (periscope) + 12 MP (telephoto) + 20 MP (ultrawide)Kamera depan: 20 MPNFC: Ya============================Kalo mau jajan gadget di sini aja:https://bit.ly/DroidlimeShopee============================Peralatan tempur DroidLime:Sony A7S ii Sony A6300Sony A6500ASUS ZenBook Pro,ASUS ROG StrixRazer Blade Pro========================Download aplikasi DroidLime:https://play.google.com/store/apps/details?id=com.droidlime.appsWebsite: https://www.droidlime.comInstagram: https://instagram.com/droidlime/Facebook: https://www.facebook.com/droidlimeTwitter: https://twitter.com/droidlimeTelegram: http://t.me/droidlime"
"Cz8xhxjw8yg","Trailer Kocak - Youtube's Got Talent (PART 1, 2, 3)","2020-08-23T01:45:00Z","UCvs--WnbNi5-uEhwLYb4lEg","Ray Buat Trailer","1","20.28.08","Trailer Kocak|Ray Buat Trailer|Ray The Explorer|Ray Restu Fauzi|Youtube's Got Talent|Skinnyindonesia24","507434","31926","433","2861","https://i.ytimg.com/vi/Cz8xhxjw8yg/default.jpg","False","False","Terima kasih skinnyindonesia24!Format video ini terinspirasi dari Honest Trailernya Screen Junkies, Literal Trailernya Toboscus, dan Weird Trailernya Aldo Jones. Video ini dibuat hanya untuk sebuah hiburan (parody) dan ngenalin secara rinkas sebuah channel, film, sinetron, dan hal lain yang ada di Indonesia. Tidak ada maksud untuk melanggar hak cipta. Segala candaan, hiburan, narasi, komentar, dan sedikit sindiran hanya dibuat untuk keperluan hiburan/kritikan, dan mohon dimaafkan jika memang ada yang merasa tersinggung. Kita santuy aja skuy!Please Look at This Channel Cause They're Really inspiring me for making a video :https://www.youtube.com/user/screenju...https://www.youtube.com/user/Tobuscushttps://www.youtube.com/user/AldoJonessMusik yang gw gunain :https://www.youtube.com/watch?v=z1wYUN_yGWshttps://www.youtube.com/watch?v=f-CHTInMS8cJangan lupa cek channelnya kak dovi dan jovi, disini :https://www.youtube.com/user/skinnyindonesian24Audisi biskuat :https://www.youtube.com/watch?v=KGBiCmin56YGw make clipnya HISHE, cek channelnya disini yak :https://www.youtube.com/watch?v=YnZ_-5I72ecCOPYRIGHT FAIR USE NOTICE, Title 17, US Code (Sections 107-118 of the copyright law):All media in this video is used for purpose of review & commentary under terms of fair use. All footage, music & images used belong to their respective owners. Okehhhhhh, Terima kasih :D Yang mau lebih kenal dekat sama gw  bisa ke instagram di @rayrestufauziFor Business Only :rayrestufauzi712@gmail.com (serious only)"
"-alPf8HgZEM","Waduh,  Seminggu Mengeluh Sakit, Lesti Rawat Inap Di Rumah Sakit | Intens Investigasi","2020-08-26T05:05:29Z","UCXxHcPruufr4DrgFqLNnGOQ","Intens Investigasi","24","20.28.08","Intens|Investigasi|Intens Investigasi|berita viral|berita terkini|berita terupdate|berita selebriti|selebritis|artis|Gosip|Lesti|Leslar|Rizky Billar|Rizki","1021442","25188","777","2148","https://i.ytimg.com/vi/-alPf8HgZEM/default.jpg","False","False","Intens Investigasi, tayang setiap hari Senin - Jumat pukul 12.00 dan 18.00 WIB Perjuangan penyanyi dangdut Lesti untuk mencapai apa yang ia peroleh saat ini  memang tak bisa dipandang sebelah mata. Memulai karir dari nol, kerja kerasnya kerap mengesampingkan kondisi fisik. Namun  bukan Lesti namanya jika mudah menyerah hadapi sakit nya. Kini kembali dilarikan ke rumah sakit usai drop selesai manggung, seperti apa kondisi terkini Lesti? Benarkah  sang biduan telah mengeluh sakit seminggu belakangan  namun tak menganggapnya serius? Saksikan semua di Intens Investigasi! Jangan lupa Subscribe, Like, Share, dan CommentInstagram : https://www.instagram.com/intensindigo/Facebook : https://www.facebook.com/intensinvestigasi/#Lesti #RizkyBillar #Leslar"
"B4AG76gfp9Y","NASIB WAK KELING SEKARANG","2020-08-26T09:30:00Z","UCfx3oPv3cJm2aCJ7UnhKx8A","Arif muhammad","23","20.28.08","arif muhammad|mak beti|ma beti|mamak beti|commedi|medan|sketsa|cerita lucu|logat medan|sumut|wak keling|endang","1519582","83715","1466","7026","https://i.ytimg.com/vi/B4AG76gfp9Y/default.jpg","False","False","Find me on sosial media :Instagram: https://www.instagram.com/arifmuhammaddd_/subscribe channel baru juga ya : https://www.youtube.com/channel/UCgw8MA5E6okfSgEAlWN-VCQfor bussines Email: arifmuhammadd35@gmail.com"
"QZG1CVhZ3RQ","MIPAN ZUZUZU - DEDDY CORBUZIER","2020-08-15T11:01:34Z","UC2G22-5R0-KCQGKJOUPktYQ","Eka Gustiwana","10","20.28.08","eka gustiwana|mipan zuzuzu|mipan sususu|deddy corbuzier|parodi mipan zuzu","4456626","290074","3047","14018","https://i.ytimg.com/vi/QZG1CVhZ3RQ/default.jpg","False","False","Mipan Zuzuzu original video:https://youtu.be/OS9ATzRsWvcDeddy Corbuzier original video:https://www.youtube.com/watch?v=nU3mKZ4ke8g"
"aYi7hHWG7zw","ITZY Not Shy Stage Practice","2020-08-19T09:00:00Z","UCDhM2k2Cua-JdobAh5moMFg","ITZY","24","20.28.08","JYP Entertainment|JYP|ITZY|있지|ITZY Video|ITZY Yeji|ITZY Lia|ITZY Ryujin|ITZY Chaeryeong|ITZY Yuna|있지 예지|있지 리아|있지 류진|있지 채령|있지 유나|예지|리아|류진|채령|유나|Yeji|Lia|Ryujin|Chaeryeong|Yuna|ITZY BEHIND|ITZY VIDEOS|ITZY DEBUT|있지 데뷔|not shy|ITZY not shy|ITZY TEASER|있지 티저|not shy 티저|있지 뮤비 티저|not shy 뮤비 티저|ITZY MV TEASER|ITZY MV|M/V|TEASER|있지 컴백|ITZY COMEBACK|not shy MV|낫샤이 뮤비|낫샤이|not shy opening trailer|opening trailer","7466353","579822","8562","28262","https://i.ytimg.com/vi/aYi7hHWG7zw/default.jpg","False","False","ITZY Not Shy Stage PracticeFind ITZY Not Shy onMelOn http://kko.to/WxG0NBrDHApple Music https://music.apple.com/us/album/not-shy-ep/1527387195?l=enSpotify https://open.spotify.com/album/0aqu2V5ohKHVfWqVFE7Ila[ITZY Official] https://www.youtube.com/c/ITZYhttps://www.instagram.com/itzy.all.in.us/http://www.twitter.com/ITZYOfficialhttp://www.facebook.com/OfficialITZYhttp://ITZY.jype.comhttp://fans.jype.com/ITZY#ITZY #NotShy #ITZY_NotShyCopyrights 2020 ⓒ JYP Entertainment. All Rights Reserved"
"p2sA5d-Ehvg","LIVE: Upacara Peringatan Detik-Detik Proklamasi Kemerdekaan RI, 17 Agustus 2020","2020-08-17T03:45:07Z","UC_m_NBgf7ieJBHzb6vvJC5A","Sekretariat Presiden","25","20.28.08","[none]","3184146","130855","2438","9912","https://i.ytimg.com/vi/p2sA5d-Ehvg/default.jpg","False","False",""
